Título,Preço,Departamento
Ovos Brancos Mantiqueira Extra Pvc C/ 20 Unid.,"R$ 19,90",Ovos
Ovos Brambilla Grande Branco Embalagem De Pvc C/ 20 Unid.,"R$ 18,90",Ovos
Ovos Mantiqueira Grande Branco Pvc C/ 30 Unid.,"R$ 28,90",Ovos
Ovos Mantiqueira Vermelho Happy Eggs C/ 20 Unid.,"R$ 25,90",Ovos
Ovos Asa Extra Branco Pvc C/ 20 Unid.,"R$ 19,90",Ovos
Ovos Brancos Mantiqueira Grande Polpa C/ 12 Unid.,"R$ 11,98",Ovos
Ovos Ares Do Campo Vermelho Galinha Livre Grande - 20 Unidades,"R$ 21,98",Ovos
Ovos Brambilla Grande Branco Pvc - 12 Unidades,"R$ 11,19",Ovos
Ovos Ares Do Campo Branco Galinha Livre Grande - 20 Unidades,"R$ 22,98",Ovos
Ovos Katayama Extra Branco Pvc C/ 30 Unid.,"R$ 28,90",Ovos
Ovos Katayama Extra Vermelho Pvc C/ 20 Unid.,"R$ 22,90",Ovos
Ovos Mantiqueira Branco Happy Eggs C/ 20 Unid.,"R$ 24,90",Ovos
Ovos Caipira Label Rouge Ômega 3 Grandes C/10 Unid.,"R$ 16,98",Ovos
Ovos Asa Grande Branco Polpa - 12 Unidades,"R$ 12,98",Ovos
Ovos Mantiqueira Jumbo Branco Embalagem C/ 10 Unid.,"R$ 10,98",Ovos
Ovos Ares Do Campo Caipira Vermelho Jumbo - 10 Unidades,"R$ 12,98",Ovos
Ovos Fazenda Da Toca Orgânicos Caipira Grandes C/10 Unid.,"R$ 16,90",Ovos
Ovos Katayama Extra Branco Imagic Polpa C/ 12 Unid.,"R$ 12,98",Ovos
Ovos De Codorna Asa - 30 Unidades,"R$ 7,99",Ovos
Ovos Caipira Label Rouge Grande Bandeja C/ 10 Unid.,"R$ 16,98",Ovos
Ovos De Codorna Katayama Com 30 Unidades,"R$ 7,98",Ovos
Ovos Brambilla Grande Branco Embalagem De Papelão C/ 12 Unid.,"R$ 10,98",Ovos
Ovos Mantiqueira Grande Vermelho Caipira C/ 10 Unid.,"R$ 13,98",Ovos
Ovos Label Rouge Orgânicos Caipira Grandes C/10 Unid.,"R$ 24,90",Ovos
Ovos Mantiqueira Vermelho Happy Eggs C/ 10 Unid.,"R$ 14,98",Ovos
Ovos Asa Extra Vermelho Pvc - 20 Unidades,"R$ 24,90",Ovos
Ovos Asa Grande Vermelho Polpa - 12 Unidades,"R$ 14,99",Ovos
Ovos Ares Do Campo Caipira Vermelho Grande - 10 Unidades,"R$ 11,98",Ovos
Ovos Mantiqueira Grande Vermelho Embalagem De Papelão C/ 12 Unid.,"R$ 12,98",Ovos
Ovos De Codorna Mantiqueira C/ 30 Unid.,"R$ 8,99",Ovos
Ovos Brambilla Grande Branco Embalagem De Pvc C/ 06 Unid.,"R$ 6,29",Ovos
Filé De Peito De Frango Congelado Pacote Kg,"R$ 22,90",Carnes.-Aves-E-Peixes
Fraldinha Bovina Embalada Kg,"R$ 42,90",Carnes.-Aves-E-Peixes
Filé De Peito De Frango Resfriado Kg,"R$ 25,90",Carnes.-Aves-E-Peixes
Músculo Bovino Bandeja Kg,"R$ 37,90",Carnes.-Aves-E-Peixes
Acém Bovino Sem Osso Moída Reserva Bandeja Kg,"R$ 44,90",Carnes.-Aves-E-Peixes
Contra Filé Bovino Porcionado Embalado À Vácuo Kg,"R$ 49,90",Carnes.-Aves-E-Peixes
Patinho Bovino Moído Reserva Bandeja Kg,"R$ 54,90",Carnes.-Aves-E-Peixes
Contra Filé Bovino Bife Granel,"R$ 59,90",Carnes.-Aves-E-Peixes
Filé De Costela Bovina Noix Maturatta Kg,"R$ 46,90",Carnes.-Aves-E-Peixes
Carne Moída Bovina Patinho Friboi Bandeja 500g,"R$ 27,90",Carnes.-Aves-E-Peixes
Peito De Frango Com Pele E Osso Bandeja Kg,"R$ 16,99",Carnes.-Aves-E-Peixes
Acém Bovino Reserva Bandeja Kg,"R$ 34,90",Carnes.-Aves-E-Peixes
Filé Mignon Suíno Bandeja Kg,"R$ 24,90",Carnes.-Aves-E-Peixes
Coxão Mole Bovino Reserva Bandeja Kg,"R$ 47,90",Carnes.-Aves-E-Peixes
Coxa Com Sobrecoxa De Frango Resfriado Bandeja Kg,"R$ 15,49",Carnes.-Aves-E-Peixes
Paleta Bovina Sem Osso Reserva Bandeja Kg,"R$ 39,90",Carnes.-Aves-E-Peixes
Coxinha Da Asa Resfriada A Granel Kg,"R$ 19,90",Carnes.-Aves-E-Peixes
Costela Janela Bovina Bandeja Kg,"R$ 25,90",Carnes.-Aves-E-Peixes
Músculo Bovino Moído Bandeja Kg,"R$ 43,90",Carnes.-Aves-E-Peixes
Bisteca Suína Congelada Bandeja Kg,"R$ 24,90",Carnes.-Aves-E-Peixes
Tulipa A Granel Kg,"R$ 27,90",Carnes.-Aves-E-Peixes
Picanha Bassi Kg,"R$ 139,90",Carnes.-Aves-E-Peixes
Picanha Bovina Maturatta Kg,"R$ 99,90",Carnes.-Aves-E-Peixes
Carne Moída Bovina Friboi Congelada Pacote 500g,"R$ 13,90",Carnes.-Aves-E-Peixes
Miolo De Alcatra Bovina Reserva Bife Bandeja Kg,"R$ 64,90",Carnes.-Aves-E-Peixes
Filé De Peito De Frango Bife Bandeja Kg,"R$ 29,90",Carnes.-Aves-E-Peixes
Paleta Bovina Miolo Reserva Kg,"R$ 39,90",Carnes.-Aves-E-Peixes
Bisteca Suína Bandeja Kg,"R$ 24,90",Carnes.-Aves-E-Peixes
Costela Suína Congelada Bandeja,"R$ 29,90",Carnes.-Aves-E-Peixes
Filezinho De Frango Sassami Seara Iqf 1kg,"R$ 27,00",Carnes.-Aves-E-Peixes
Filé De Tilápia Copacol 400g,"R$ 29,90",Carnes.-Aves-E-Peixes
Picanha Bovina Fatiada Bordon Kg,"R$ 44,90",Carnes.-Aves-E-Peixes
Contra Filé Bovino Maturatta Kg,"R$ 59,90",Carnes.-Aves-E-Peixes
Acém Bovino Sem Osso Em Cubos Reserva Bandeja Kg,"R$ 44,90",Carnes.-Aves-E-Peixes
Filé De Peito De Frango Perdigão Iqf 1kg,"R$ 29,90",Carnes.-Aves-E-Peixes
Frango Inteiro Resfriado A Granel Kg,"R$ 9,90",Carnes.-Aves-E-Peixes
Filé De Tilápia Copacol 800g,"R$ 52,90",Carnes.-Aves-E-Peixes
Sobrecoxa De Frango Resfriada A Granel Kg,"R$ 16,79",Carnes.-Aves-E-Peixes
Bife Ancho Bovino Bassi Kg,"R$ 64,90",Carnes.-Aves-E-Peixes
Pernil Sem Osso Bandeja Kg,"R$ 22,90",Carnes.-Aves-E-Peixes
Asa De Frango Resfriada Bandeja Kg,"R$ 16,90",Carnes.-Aves-E-Peixes
Coxa E Sobrecoxa Congelada Pacote Kg,"R$ 14,98",Carnes.-Aves-E-Peixes
Iscas De Tilápia Em Pedaços Brazilian Fish Congelada 300g,"R$ 18,90",Carnes.-Aves-E-Peixes
Filé Mignon Peça Embalado Kg,"R$ 79,90",Carnes.-Aves-E-Peixes
Filé De Peito De Frango Sadia Temperado Iqf Congelado 1kg,"R$ 29,90",Carnes.-Aves-E-Peixes
Coxão Mole Bovino Bife Reserva Bandeja Kg,"R$ 54,90",Carnes.-Aves-E-Peixes
Fígado Bovino Bandeja Kg,"R$ 12,90",Carnes.-Aves-E-Peixes
Paleta Bovina C/ Osso Reserva A Granel Kg,"R$ 29,90",Carnes.-Aves-E-Peixes
Filé De Peito Congelado Sadia 1kg,"R$ 28,90",Carnes.-Aves-E-Peixes
Patinho Bovino Bife Reserva Bandeja Kg,"R$ 54,90",Carnes.-Aves-E-Peixes
Filezinho Empanado Crocante Seara 400g,"R$ 17,99",Carnes.-Aves-E-Peixes
Filé De Tilápia Brazilian Fish Fresco 500g,"R$ 33,90",Carnes.-Aves-E-Peixes
Patinho Bovino Strogonoff Reserva Bandeja Kg,"R$ 54,90",Carnes.-Aves-E-Peixes
Filé Mignon Bife Bandeja Kg,"R$ 79,90",Carnes.-Aves-E-Peixes
Pernil Em Bife Bandeja Kg,"R$ 24,90",Carnes.-Aves-E-Peixes
Lagarto Bovino Reserva Peça Kg,"R$ 47,90",Carnes.-Aves-E-Peixes
Miolo De Alcatra Bovino Reserva Bandeja Kg,"R$ 59,90",Carnes.-Aves-E-Peixes
Filé De Sassami Perdigão 1kg,"R$ 28,90",Carnes.-Aves-E-Peixes
Filezinho Sassami Copacol Congelado 1kg,"R$ 26,90",Carnes.-Aves-E-Peixes
Costela Minga Bovina Bandeja Kg,"R$ 27,90",Carnes.-Aves-E-Peixes
Músculo Bovino Em Cubos Bandeja Kg,"R$ 43,90",Carnes.-Aves-E-Peixes
Peito De Frango Sadia Temperado Desfiado Cozido Congelado 400g,"R$ 24,90",Carnes.-Aves-E-Peixes
Paleta Bovina Moida Reserva Bandeja Kg,"R$ 46,90",Carnes.-Aves-E-Peixes
Frango De Padaria A Passarinho Temperado Seara Iqf 1kg,"R$ 15,90",Carnes.-Aves-E-Peixes
Lombo Suíno Bandeja Kg,"R$ 29,90",Carnes.-Aves-E-Peixes
Filé De Peito De Frango Cubos Bandeja Kg,"R$ 31,90",Carnes.-Aves-E-Peixes
Toucinho Suíno Bandeja Kg,"R$ 17,90",Carnes.-Aves-E-Peixes
Ponta De Peito Bovino Reserva Bandeja Kg,"R$ 37,90",Carnes.-Aves-E-Peixes
Coxa Com Sobrecoxa Frango Familiar Bandeja Kg,"R$ 13,49",Carnes.-Aves-E-Peixes
Acém Bovino Com Osso Reserva Bandeja Kg,"R$ 29,90",Carnes.-Aves-E-Peixes
Coxão Mole Bovino Moído Reserva Bandeja Kg,"R$ 49,90",Carnes.-Aves-E-Peixes
Filé De Tilápia Copacol Empanado Tradicional 400g,"R$ 34,90",Carnes.-Aves-E-Peixes
Cupim Embalado Kg,"R$ 41,90",Carnes.-Aves-E-Peixes
Filé De Sassami Congelado Sadia 1kg,"R$ 29,90",Carnes.-Aves-E-Peixes
Paleta Bovina Bife Borboleta Reserva Bandeja Kg,"R$ 46,90",Carnes.-Aves-E-Peixes
Filé De Salmão Bom Peixe C/ Pele Congelado Bandeja 300g,"R$ 49,90",Carnes.-Aves-E-Peixes
Coxinha Da Asa Sadia Sem Tempero Congelada 1kg,"R$ 22,90",Carnes.-Aves-E-Peixes
Filé De Tilápia Seara Iqf 600g,"R$ 42,90",Carnes.-Aves-E-Peixes
Costela Suína Seara Com Molho Barbecue Congelada 1kg,"R$ 69,90",Carnes.-Aves-E-Peixes
Coxinha Da Asa Tradicional Empanado Crocante Seara 400g,"R$ 17,99",Carnes.-Aves-E-Peixes
Filé De Merluza Argentina Congelado Bom Peixe 500g,"R$ 29,90",Carnes.-Aves-E-Peixes
Pernil Suíno C/ Osso E Couro Peça Kg,"R$ 17,90",Carnes.-Aves-E-Peixes
Panceta Suina Congelada Granel,"R$ 32,90",Carnes.-Aves-E-Peixes
Sobrecoxa Seara Iqf 1kg,"R$ 16,90",Carnes.-Aves-E-Peixes
Ponta De Peito Bovino Maturatta Kg,"R$ 39,90",Carnes.-Aves-E-Peixes
Filé Mignon Suíno Congelado Kg,"R$ 24,90",Carnes.-Aves-E-Peixes
Carne Moída Bovina Dianteiro Friboi Bandeja 500g,"R$ 22,90",Carnes.-Aves-E-Peixes
Carne Seca Seara Jerked Suíno - 400g,"R$ 13,99",Carnes.-Aves-E-Peixes
Coxinha Da Asa Seara Iqf 1kg,"R$ 21,90",Carnes.-Aves-E-Peixes
Maminha Maturatta Kg,"R$ 65,90",Carnes.-Aves-E-Peixes
Posta De Tilápia Copacol Congelada 800g,"R$ 29,90",Carnes.-Aves-E-Peixes
Moela De Frango Bandeja Kg,"R$ 17,99",Carnes.-Aves-E-Peixes
Miolo De Alcatra Bovina Strogonoff Reserva Bandeja Kg,"R$ 64,90",Carnes.-Aves-E-Peixes
Panceta Suino Familiar Bandeja Kg,"R$ 23,90",Carnes.-Aves-E-Peixes
Osso Buco Bovino Reserva Kg,"R$ 26,90",Carnes.-Aves-E-Peixes
Costela Suína A Granel Kg,"R$ 33,90",Carnes.-Aves-E-Peixes
Copa Lombo Sem Osso Bandeja Kg,"R$ 27,90",Carnes.-Aves-E-Peixes
Tirinhas De Tilápia Empanada Copacol Congelada 300g,"R$ 12,90",Carnes.-Aves-E-Peixes
Patinho Bovino Reserva Peça Kg,"R$ 47,90",Carnes.-Aves-E-Peixes
Acém Bovino Com Osso Reserva Bandeja Kg,"R$ 29,90",Carnes.-Aves-E-Peixes
Pernil Com Osso Bandeja Kg,"R$ 17,69",Carnes.-Aves-E-Peixes
Panceta Suína Bandeja Kg,"R$ 27,90",Carnes.-Aves-E-Peixes
File De Merluza Argentina Sem Pele Mar & Rio Pacote - 400g,"R$ 24,90",Carnes.-Aves-E-Peixes
Coxa Solteira De Frango Bandeja Kg,"R$ 12,90",Carnes.-Aves-E-Peixes
Coxão Duro Bovino Reserva Bandeja Kg,"R$ 44,90",Carnes.-Aves-E-Peixes
Picanha Bovina Kg,"R$ 79,90",Carnes.-Aves-E-Peixes
Coração De Frango Bandeja Kg,"R$ 37,90",Carnes.-Aves-E-Peixes
Filé De Tilápia Sadia Pescados Iqf Congelado Sem Pele 400g,"R$ 26,90",Carnes.-Aves-E-Peixes
Costela Suína Sadia Tiras Congeladas Kg,"R$ 30,90",Carnes.-Aves-E-Peixes
Coxa Sobrecoxa Desossada Perdigão Na Brasa Temperada Congelada 800g,"R$ 20,90",Carnes.-Aves-E-Peixes
Peito De Frango Com Osso Familiar Bandeja Kg,"R$ 18,90",Carnes.-Aves-E-Peixes
Filé De Tilápia Brazilian Fish Congelado 250g,"R$ 17,90",Carnes.-Aves-E-Peixes
Tulipa Bandeja Kg,"R$ 26,90",Carnes.-Aves-E-Peixes
Filé De Coxa E Sobrecoxa Seara Com Pele Iqf Congelado 1kg,"R$ 21,90",Carnes.-Aves-E-Peixes
Lombo Bacalhau Riberalves Gadus De Descongelado 1kg,"R$ 139,99",Carnes.-Aves-E-Peixes
Paleta Bovina Cubos Reserva Bandeja Kg,"R$ 46,90",Carnes.-Aves-E-Peixes
Coxa Desossada Com Pele Molho Na Mostarda Kg,"R$ 19,90",Carnes.-Aves-E-Peixes
Frango À Passarinho Lar Congelado Iqf - 1kg,"R$ 17,90",Carnes.-Aves-E-Peixes
Maminha Bovina Reserva Peça Kg,"R$ 59,90",Carnes.-Aves-E-Peixes
Sobrecoxa Sadia Congelada 1kg,"R$ 18,90",Carnes.-Aves-E-Peixes
Camarão Descascado Pré Cozido Eviscerado Qualimar 200g,"R$ 37,90",Carnes.-Aves-E-Peixes
Cação Em Posta Só Pesca 500g,"R$ 24,90",Carnes.-Aves-E-Peixes
Filé De Peito De Frango Korin Boa Pedida Congelado 600g,"R$ 28,90",Carnes.-Aves-E-Peixes
Coxa Desossada Com Pele Bandeja Kg,"R$ 19,90",Carnes.-Aves-E-Peixes
Frango À Passarinho Sadia Congelado 1kg,"R$ 19,90",Carnes.-Aves-E-Peixes
Coxinha Da Asa Lar Iqf Congelada Iqf - 1kg,"R$ 19,90",Carnes.-Aves-E-Peixes
Figado De Frango Bandeja Kg,"R$ 9,90",Carnes.-Aves-E-Peixes
Sardinha Espalmada Laje Bom Peixe Congelado 500g,"R$ 16,90",Carnes.-Aves-E-Peixes
Filé De Coxa De Frango Com Pele Resfriado À Granel Kg,"R$ 19,99",Carnes.-Aves-E-Peixes
Peito De Frango Com Osso Sem Pele Kg,"R$ 21,90",Carnes.-Aves-E-Peixes
Pernil C/ Couro Bandeja Kg,"R$ 17,69",Carnes.-Aves-E-Peixes
Contra Filé Bovino Porcionado Bandeja Granel,"R$ 64,90",Carnes.-Aves-E-Peixes
Camarão Sete Barbas Descascado S/ Cabeça Bom Peixe 250g,"R$ 27,90",Carnes.-Aves-E-Peixes
Filé Mignon Suíno Bandeja Kg,"R$ 26,90",Carnes.-Aves-E-Peixes
Cordão De Filé Mignon Embalado Kg,"R$ 39,90",Carnes.-Aves-E-Peixes
Filé De Tilápia Copacol Empanado Multigrãos Iqf 400g,"R$ 34,90",Carnes.-Aves-E-Peixes
Filé De Polaca Do Alasca 500g,"R$ 22,90",Carnes.-Aves-E-Peixes
Meio Da Asa Temperada Bandeja Kg,"R$ 29,90",Carnes.-Aves-E-Peixes
Filé De Peito Seara Iqf 1kg,"R$ 29,90",Carnes.-Aves-E-Peixes
Fraldinha Bovina Reserva Peça Kg,"R$ 59,90",Carnes.-Aves-E-Peixes
Filé De Merluza 500g,"R$ 26,90",Carnes.-Aves-E-Peixes
Pé De Frango Bandeja Kg,"R$ 12,59",Carnes.-Aves-E-Peixes
Miúdo Rabo Bovino Congelado Pacote Kg,"R$ 30,90",Carnes.-Aves-E-Peixes
Lagarto Bovino Reserva Bandeja Kg,"R$ 42,76",Carnes.-Aves-E-Peixes
Galinha Pesada Congelada Kg,"R$ 9,90",Carnes.-Aves-E-Peixes
Cação Em Posta Congelado Bom Peixe 500g,"R$ 26,90",Carnes.-Aves-E-Peixes
Filé De Peito Frango Strogonoff Bandeja Kg,"R$ 31,90",Carnes.-Aves-E-Peixes
Costela Gaúcha C/Osso Reserva Granel Kg,"R$ 28,90",Carnes.-Aves-E-Peixes
Meio Da Asa Sadia Congelada 1kg,"R$ 31,90",Carnes.-Aves-E-Peixes
Ponta De Peito Bovino Bife Min Reserva Bandeja Kg,"R$ 44,90",Carnes.-Aves-E-Peixes
Coxão Duro Bovino Cubos Reserva Bandeja Kg,"R$ 51,90",Carnes.-Aves-E-Peixes
Paleta Suína Com Osso E Couro Bandeja Kg,"R$ 17,90",Carnes.-Aves-E-Peixes
Coração De Frango Sadia Congelado 1kg,"R$ 38,90",Carnes.-Aves-E-Peixes
Coxa Sobrecoxa A Passarinho Copacol Congelado - 800g,"R$ 19,90",Carnes.-Aves-E-Peixes
Miúdo Bucho De Boi Bandeja Kg,"R$ 28,90",Carnes.-Aves-E-Peixes
Filé Mignon Bovino Medalhão Bandeja Kg,"R$ 79,90",Carnes.-Aves-E-Peixes
Coxinha Da Asa Sadia Bio Congelado 1kg,"R$ 26,90",Carnes.-Aves-E-Peixes
Coxão Mole Bovino Strogonoff Reserva Bandeja Kg,"R$ 57,90",Carnes.-Aves-E-Peixes
Filé De Peito Perdigão 800g,"R$ 30,90",Carnes.-Aves-E-Peixes
Costela Janela Bovina Bandeja Kg,"R$ 29,90",Carnes.-Aves-E-Peixes
"Coxa De Frango Temperada Assa Fácil Perdigão - 1,2kg","R$ 22,90",Carnes.-Aves-E-Peixes
Ponta De Peito Bovina Cubo Sopa Reserva Bandeja Kg,"R$ 44,90",Carnes.-Aves-E-Peixes
Coxão Duro Bovino Bife A Role Reserva Bandeja Kg,"R$ 51,90",Carnes.-Aves-E-Peixes
Filé Mignon Suino Congelado Bandeja Kg,"R$ 25,99",Carnes.-Aves-E-Peixes
Filé De Coxa Esobrecoxa Seara Chimichurri Congelado 800g,"R$ 24,90",Carnes.-Aves-E-Peixes
Filé De Sardinha Espalmado Copacol Congelada 800g,"R$ 32,90",Carnes.-Aves-E-Peixes
Filé De Merluza Copacol Congelado 800g,"R$ 59,90",Carnes.-Aves-E-Peixes
Pernil Suíno Com Osso E Couro Bandeja Kg,"R$ 17,90",Carnes.-Aves-E-Peixes
Bisteca Suína Copa Bandeja Kg,"R$ 27,90",Carnes.-Aves-E-Peixes
Filé Mignon Suíno Pamplona Sem Osso Temperado Kg,"R$ 36,90",Carnes.-Aves-E-Peixes
Coxão Duro Bovino Redbeef Reserva Bandeja Kg,"R$ 54,90",Carnes.-Aves-E-Peixes
Filé De Tilápia Brazilian Fish Congelada 800g,"R$ 52,90",Carnes.-Aves-E-Peixes
Paleta Bovina Peixinho Tradicional Reserva Bandeja Kg,"R$ 49,90",Carnes.-Aves-E-Peixes
Pão Com Linguiça Aurora Choripan - 400g,"R$ 23,99",Carnes.-Aves-E-Peixes
Peixe Pollaca Salgada Tipo Bacalhau Lasca Ou Desfiada Kg,"R$ 49,90",Carnes.-Aves-E-Peixes
Filézinho De Peito Perdigão 800g,"R$ 29,90",Carnes.-Aves-E-Peixes
Kani Bom Peixe 250g,"R$ 16,90",Carnes.-Aves-E-Peixes
Costelinha De Tilápia Copacol 600g,"R$ 24,90",Carnes.-Aves-E-Peixes
Coração Alcatra Bovina Maturatta Kg,"R$ 64,90",Carnes.-Aves-E-Peixes
Miúdo Mocotó Bovino Congelado Pacote Kg,"R$ 15,90",Carnes.-Aves-E-Peixes
Escalope Filé Mignon Bovino Bandeja Kg,"R$ 79,90",Carnes.-Aves-E-Peixes
Coxinha Da Asa Frango Familiar Bandeja Kg,"R$ 21,90",Carnes.-Aves-E-Peixes
"Sobrecoxa Temperada Assa Fácil Perdigão 1,2kg","R$ 22,90",Carnes.-Aves-E-Peixes
Peito De Frango Com Pele E Osso Bandeja Kg,"R$ 19,90",Carnes.-Aves-E-Peixes
Suã Suíno Bandeja Kg,"R$ 12,90",Carnes.-Aves-E-Peixes
Joelho Suíno Com Couro Kg,"R$ 18,90",Carnes.-Aves-E-Peixes
Costela Suina Perdigão Nabrasa Kg,"R$ 34,90",Carnes.-Aves-E-Peixes
Patinho Bovino Duckbeef Reserva Bandeja Kg,"R$ 54,90",Carnes.-Aves-E-Peixes
Miúdo Bucho De Boi Bandeja Kg,"R$ 24,90",Carnes.-Aves-E-Peixes
Coxinha Da Asa Bandeja Kg,"R$ 22,90",Carnes.-Aves-E-Peixes
Meio Da Asa Sadia Bio Congelado Pacote 1kg,"R$ 38,90",Carnes.-Aves-E-Peixes
Frango Inteiro Sadia Assa Fácil Tempeado Congelado Kg,"R$ 18,90",Carnes.-Aves-E-Peixes
Fraldinha Bassi Kg,"R$ 74,90",Carnes.-Aves-E-Peixes
Fraldinha Bovina Bandeja Kg,"R$ 46,90",Carnes.-Aves-E-Peixes
Filé De Peito Em Tiras Seara Iqf 1kg,"R$ 36,90",Carnes.-Aves-E-Peixes
Filé De Salmão Seara Iqf 500g,"R$ 64,90",Carnes.-Aves-E-Peixes
Camarão Vannamei Inteiro Cozido Bom Peixe 500g,"R$ 35,90",Carnes.-Aves-E-Peixes
Cupim Bandeja Kg,"R$ 35,90",Carnes.-Aves-E-Peixes
Peito A Passarinho Sadia Aperitivo Congelado 1kg,"R$ 28,90",Carnes.-Aves-E-Peixes
Miúdo Mocotó Bandeja Kg,"R$ 15,90",Carnes.-Aves-E-Peixes
Panceta Suina Frimesa Aperitivo Temperado Congelado 1kg,"R$ 34,90",Carnes.-Aves-E-Peixes
Contra Filé Bovino Com Osso Maturatta Chuleta Congelado Kg,"R$ 54,90",Carnes.-Aves-E-Peixes
Lombo Suíno Pamplona Sem Osso Temperado Kg,"R$ 34,90",Carnes.-Aves-E-Peixes
Filé De Peito Frango Familiar Bandeja Kg,"R$ 28,90",Carnes.-Aves-E-Peixes
Contra Filé Bovino Com Osso Maturatta Tbone Congelado Kg,"R$ 59,90",Carnes.-Aves-E-Peixes
Capa De File Bovino Bandeja Kg,"R$ 39,90",Carnes.-Aves-E-Peixes
Camarão Descascado Pré Cozido Eviscerado Qualimar 26/31 - 200g,"R$ 29,90",Carnes.-Aves-E-Peixes
Sobrecoxa Sem Pele Bandeja Kg,"R$ 19,90",Carnes.-Aves-E-Peixes
Coxão Mole Bovino Bife Paris Reserva Bandeja Kg,"R$ 57,90",Carnes.-Aves-E-Peixes
Posta De Tilápia Brazilian Fish Congelada 700g,"R$ 32,90",Carnes.-Aves-E-Peixes
Filé De Costela Suína Pamplona Sem Osso Temperada Kg,"R$ 32,90",Carnes.-Aves-E-Peixes
Filezinho Sassami Lar Congelado Iqf - 1kg,"R$ 28,90",Carnes.-Aves-E-Peixes
Patinho Bovino Flanbeef Reserva Bandeja Kg,"R$ 54,90",Carnes.-Aves-E-Peixes
Lombo Suíno Assa Fácil Sadia Kg,"R$ 24,90",Carnes.-Aves-E-Peixes
Costela Suína Bandeja Kg,"R$ 35,90",Carnes.-Aves-E-Peixes
Camarão Ao Requeijão Vivenda Do Camarão Com Catupiry Congelado 230g,"R$ 26,90",Carnes.-Aves-E-Peixes
Iscas De Tilápia Copacol Empanada Congelada 300g,"R$ 28,90",Carnes.-Aves-E-Peixes
Frango De Padaria Seara Temperado Tradicional Congelado Kg,"R$ 18,99",Carnes.-Aves-E-Peixes
Coxão Duro Bovino Stretto Reserva Bandeja Kg,"R$ 52,90",Carnes.-Aves-E-Peixes
Lagarto Bovino Bife Reserva Bandeja Kg,"R$ 44,90",Carnes.-Aves-E-Peixes
Costela Suína Com Couro Bandeja Kg,"R$ 34,90",Carnes.-Aves-E-Peixes
Peixe Congelado Manjubinha 500g,"R$ 18,90",Carnes.-Aves-E-Peixes
Paleta Bovina Bife Para Milanesa Reserva Bandeja Kg,"R$ 49,90",Carnes.-Aves-E-Peixes
Bife De Chorizo Bovino Bassi Kg,"R$ 69,90",Carnes.-Aves-E-Peixes
Alcatra Suína Pamplona Sem Osso Temperada Kg,"R$ 36,90",Carnes.-Aves-E-Peixes
Panceta Suína Pamplona Sem Osso Temperada Kg,"R$ 31,90",Carnes.-Aves-E-Peixes
Sobrecoxa Perdigão Na Brasa Chimichurri 800g,"R$ 22,90",Carnes.-Aves-E-Peixes
Miúdo Rabo Bovino Bandeja Kg,"R$ 30,90",Carnes.-Aves-E-Peixes
Miúdo Rabo Bovino Bandeja Kg,"R$ 30,90",Carnes.-Aves-E-Peixes
Filé De Peito Sadia Fácil Temperado Alho/Cebola/Ervas Finas 700g,"R$ 22,90",Carnes.-Aves-E-Peixes
Miúdo Lingua De Boi Congelado Pacote Kg,"R$ 16,90",Carnes.-Aves-E-Peixes
Sobrecoxa Bandeja Kg,"R$ 18,90",Carnes.-Aves-E-Peixes
Coxa Com Sobrecoxa De Frango Resfriado Bandeja Kg,"R$ 16,25",Carnes.-Aves-E-Peixes
Frango Caipira Nho Bento Cortado Congelado Granel,"R$ 21,90",Carnes.-Aves-E-Peixes
Moela De Frango Perdigão Congelado Pacote 1kg,"R$ 14,99",Carnes.-Aves-E-Peixes
Miúdo Fígado De Boi Bandeja Kg,"R$ 19,90",Carnes.-Aves-E-Peixes
Capa De Filé Bovino Bandeja Kg,"R$ 39,90",Carnes.-Aves-E-Peixes
Panceta Suína Temperada Resfriada Frinni Kg,"R$ 39,90",Carnes.-Aves-E-Peixes
Sobrecoxa Sadia Bio Congelada Bandeja 1kg,"R$ 21,90",Carnes.-Aves-E-Peixes
Costela Suína Familiar Bandeja Kg,"R$ 34,90",Carnes.-Aves-E-Peixes
Coxão Duro Bovino Bife Reserva Bandeja Kg,"R$ 51,90",Carnes.-Aves-E-Peixes
Tirinhas De Tilápia Brazilian Fish Congelado 500g,"R$ 38,90",Carnes.-Aves-E-Peixes
Picanha Bovina Bandeja Kg,"R$ 69,90",Carnes.-Aves-E-Peixes
Cação Em Posta Mar & Rio Pacote 800g,"R$ 36,90",Carnes.-Aves-E-Peixes
Porco A Passarinho Frimesa Temperada 1kg,"R$ 34,90",Carnes.-Aves-E-Peixes
Filezinho Sassami Seara Orgânico Iqf 600g,"R$ 34,90",Carnes.-Aves-E-Peixes
Panceta Suína Congelada Bandeja Kg,"R$ 32,90",Carnes.-Aves-E-Peixes
Sobrepaleta Suína Pamplona Sem Osso Temperada Kg,"R$ 32,90",Carnes.-Aves-E-Peixes
Costela Suína Temperada Sadia Fácil Congelado Kg,"R$ 37,90",Carnes.-Aves-E-Peixes
Miolo De Alcatra Bovina Baby Beef Reserva Bandeja Kg,"R$ 64,90",Carnes.-Aves-E-Peixes
Miolo De Alcatra Bovina Moída Reserva Bandeja Kg,"R$ 64,90",Carnes.-Aves-E-Peixes
Coxa Solteira Sobrecoxa Frango Familiar Bandeja Kg,"R$ 14,15",Carnes.-Aves-E-Peixes
Pescada Espalmada Oveva Mar & Rio - Pacote 800g,"R$ 30,90",Carnes.-Aves-E-Peixes
Coxa De Frango Sadia Congelada 1kg,"R$ 15,90",Carnes.-Aves-E-Peixes
Filé De Peito Sadia Cubos Cozido Congelado 400g,"R$ 29,90",Carnes.-Aves-E-Peixes
Petiscos De Tilápia Copacol Iqf Congelado 600g,"R$ 29,90",Carnes.-Aves-E-Peixes
Coxão Mole Bovino Bife Light Reserva Bandeja Kg,"R$ 57,90",Carnes.-Aves-E-Peixes
Filé De Peito Temperado Suculentíssimo Seara Iqf 1kg,"R$ 28,90",Carnes.-Aves-E-Peixes
Filézinho De Peito Sassami Temperado E Congelado Sadia Iqf 1kg,"R$ 26,90",Carnes.-Aves-E-Peixes
Almôndega Bovina Bandeja Congelada Kg,"R$ 42,90",Carnes.-Aves-E-Peixes
Paleta Bovina Peixinho Especial Reserva Bandeja Kg,"R$ 46,90",Carnes.-Aves-E-Peixes
Joelho Suíno Bandeja Kg,"R$ 18,90",Carnes.-Aves-E-Peixes
Coxinha Da Asa Temperada Bandeja Kg,"R$ 20,90",Carnes.-Aves-E-Peixes
Frango A Passarinho Seara Iqf 1kg,"R$ 19,90",Carnes.-Aves-E-Peixes
Filé Mignon Suíno Frinni Temperado Resfriado Kg,"R$ 35,90",Carnes.-Aves-E-Peixes
Coxinha Da Asa Perdigão Nabrasa Mostarda 800g,"R$ 24,90",Carnes.-Aves-E-Peixes
Filé De Peito De Frango Bandeja Kg,"R$ 28,90",Carnes.-Aves-E-Peixes
Carne Suína A Passarinho Pamplona Temperada 700g,"R$ 14,90",Carnes.-Aves-E-Peixes
Bisteca Suína Sadia Fatiada E Congelada Kg,"R$ 27,90",Carnes.-Aves-E-Peixes
Rabo Suíno Bandeja Kg,"R$ 17,75",Carnes.-Aves-E-Peixes
Miúdo Língua De Boi Bandeja Kg,"R$ 16,90",Carnes.-Aves-E-Peixes
Pé Suíno Bandeja Kg,"R$ 9,99",Carnes.-Aves-E-Peixes
Filé De Peito Temperado Bandeja Kg,"R$ 31,90",Carnes.-Aves-E-Peixes
Bisteca Suino Familiar Bandeja Kg,"R$ 25,90",Carnes.-Aves-E-Peixes
Picanha Bovina Do Chef Bandeja Kg,"R$ 119,00",Carnes.-Aves-E-Peixes
Lombo Bacalhau Saithe Dessalgado Riberalves Congelado 800g,"R$ 89,99",Carnes.-Aves-E-Peixes
Bacalhau Desfiado Dessalgado Riberalves Congelado 400g,"R$ 49,90",Carnes.-Aves-E-Peixes
Coxa E Sobrecoxa Copacol Congelado 1kg,"R$ 24,90",Carnes.-Aves-E-Peixes
Filezinho Sassami Copacol Congelado 800g,"R$ 26,90",Carnes.-Aves-E-Peixes
Coxinha Da Asa Copacol Temperado Congelado 1kg,"R$ 22,90",Carnes.-Aves-E-Peixes
Sobrecoxa Copacol Congelado 1kg,"R$ 22,90",Carnes.-Aves-E-Peixes
Posta De Cação Copacol Congelado 800g,"R$ 46,90",Carnes.-Aves-E-Peixes
Filé De Peito Dagranja Iqf 1kg,"R$ 32,90",Carnes.-Aves-E-Peixes
"Tirinhas De Tilápia Empanada Copacol Congelada 1,5kg","R$ 47,90",Carnes.-Aves-E-Peixes
File De Robalo Mar & Rio Pedaço Sem Pele Skin Pack - 300g,"R$ 52,90",Carnes.-Aves-E-Peixes
Tentáculos De Polvo Mar & Rio Skin Pack 300g,"R$ 64,90",Carnes.-Aves-E-Peixes
Lombo Bacalhau Morhua Dessalgado Brasmar Congelado 1kg,"R$ 129,90",Carnes.-Aves-E-Peixes
Ponta De Peito Bovina Fatiada Reserva Bandeja Kg,"R$ 44,90",Carnes.-Aves-E-Peixes
Beef Jerky Jack Links Sweet & Hot 30g,"R$ 11,45",Carnes.-Aves-E-Peixes
Costela Suína Bandeja Kg,"R$ 35,90",Carnes.-Aves-E-Peixes
Capa De Filé Bovino Peça Embalado Kg,"R$ 39,90",Carnes.-Aves-E-Peixes
Camarão Congelado Cinza Qualimar Parcialmente Cozido E Descascado 50/75 350g,"R$ 49,90",Carnes.-Aves-E-Peixes
Maminha Maturatta Bandeja Kg,"R$ 59,90",Carnes.-Aves-E-Peixes
Picanha Bovina Resfriada Do Chef Kg,"R$ 119,00",Carnes.-Aves-E-Peixes
Coxa E Sobrecoxa Com Osso Sem Pele Copacol Congelado 1kg,"R$ 19,90",Carnes.-Aves-E-Peixes
Filé De Peito Frango Copacol Congelado 1kg,"R$ 30,90",Carnes.-Aves-E-Peixes
Frango À Passarinho Copacol I.Q.F. 800g,"R$ 15,90",Carnes.-Aves-E-Peixes
Frango Sem Miúdos Seara Orgânico Kg,"R$ 22,90",Carnes.-Aves-E-Peixes
Frango Caipira Nho Bento Congelado Kg,"R$ 15,90",Carnes.-Aves-E-Peixes
Filé De Peito Temperado Seara Assa Fácil 800g,"R$ 26,90",Carnes.-Aves-E-Peixes
Paleta Bovina Raquete Friboi 1953 Embalada Kg,"R$ 64,90",Carnes.-Aves-E-Peixes
Frango À Passarinho Sadia Temperado Congelado 1kg,"R$ 21,90",Carnes.-Aves-E-Peixes
Ponta De Peito Bovina Sem Osso Reserva Peça Kg,"R$ 44,90",Carnes.-Aves-E-Peixes
Coxão Mole Bovino Flatbeef Reserva Bandeja Kg,"R$ 57,90",Carnes.-Aves-E-Peixes
Camarão Ao Molho Vivenda Do Camarão Tailandes 230g,"R$ 24,99",Carnes.-Aves-E-Peixes
Filé De Panceta Suína Pamplona Sem Osso Temperada Kg,"R$ 36,90",Carnes.-Aves-E-Peixes
Matambrito Suíno Frimesa Congelado Kg,"R$ 36,90",Carnes.-Aves-E-Peixes
Fraldinha Bovina Maturatta Kg,"R$ 69,90",Carnes.-Aves-E-Peixes
Filezinho Sassami Korin Boa Pedida Congelado Bandeja 600g,"R$ 27,90",Carnes.-Aves-E-Peixes
Meio Da Asa Copacol Temperado Congelado 1kg,"R$ 22,90",Carnes.-Aves-E-Peixes
Coxa Sem Pele Kg,"R$ 16,59",Carnes.-Aves-E-Peixes
Meio Da Asa Seara Iqf 1kg,"R$ 34,90",Carnes.-Aves-E-Peixes
Picanha Maturatta Bandeja Kg,"R$ 89,90",Carnes.-Aves-E-Peixes
Filezinho De Peito Sassami Sadia Bio Congelado Pacote 1kg,"R$ 32,90",Carnes.-Aves-E-Peixes
Lombo De Bacalhau Kg,"R$ 223,86",Carnes.-Aves-E-Peixes
Coxinha Da Asa Temperada Assa Fácil Perdigão Congelada 1kg,"R$ 20,90",Carnes.-Aves-E-Peixes
Costela Suína Temperada Perdigão Kg,"R$ 37,90",Carnes.-Aves-E-Peixes
Carne Moída Incrível! 100% Vegetal 200g,"R$ 22,99",Carnes.-Aves-E-Peixes
Filé De Peito Temperado Granel Kg,"R$ 29,90",Carnes.-Aves-E-Peixes
Costela Suína Temperada Resfriada Frinni Kg,"R$ 38,90",Carnes.-Aves-E-Peixes
Picanha Suína Frimesa Congelada Kg,"R$ 48,90",Carnes.-Aves-E-Peixes
Coxinha Da Asa Temperada Bandeja Kg,"R$ 21,90",Carnes.-Aves-E-Peixes
Contra File Suíno Pamplona Sem Osso Temperada Kg,"R$ 36,90",Carnes.-Aves-E-Peixes
Costela Suína Frimesa Temperada Congelada Kg,"R$ 45,90",Carnes.-Aves-E-Peixes
