Título,Preço,Departamento
Balão Junco Metalizado Prata 40cm N.6,"R$ 7,95",Bazar-E-Utilidades
Adubo Green Fix Raiz 120ml,"R$ 7,95",Bazar-E-Utilidades
Faca De Mesa Tramontina Inox Leme Vermelha Unid.,"R$ 12,90",Bazar-E-Utilidades
Linha Barbante Kimarc 4/8 80m Unid.,"R$ 3,69",Bazar-E-Utilidades
Vela Maroaba Votiva Mel 260g Unid.,"R$ 13,99",Bazar-E-Utilidades
"Assadeira De Vidro Marinex Retangular Grande Seletta C/ Tampa 3,5l","R$ 17,89",Bazar-E-Utilidades
Caixa Térmica Mor Preta 18l Unidade,"R$ 69,90",Bazar-E-Utilidades
Prato Nadir Fundo Primavera 22cm,"R$ 86,90",Bazar-E-Utilidades
Lava Autos Proauto Classic Neutro 500ml,"R$ 7,90",Bazar-E-Utilidades
Jogo Tramontina De Frigideira Alumínio Turim Bronze 2 Peças,"R$ 14,75",Bazar-E-Utilidades
Argila Expandida Pet Garden 1kg,"R$ 99,90",Bazar-E-Utilidades
Boneca Mattel Barbie Fantasy Princesa Basica,"R$ 10,99",Bazar-E-Utilidades
Mixer Mondial Pratic Preto - 127v,"R$ 79,90",Bazar-E-Utilidades
Escorredor Madefer Louça Arco Mini Top,"R$ 129,00",Bazar-E-Utilidades
Bandeja Junco Laminada Prata Numero 5 39x32cm,"R$ 39,90",Bazar-E-Utilidades
Jogo De Copo Sm Marrocos Long Drink 350ml C/ 6 Unid.,"R$ 5,99",Bazar-E-Utilidades
Garrafa Térmica Invicta Glt Vermelho Velvet 500ml,"R$ 36,90",Bazar-E-Utilidades
Garfo Trinchante Original Premium Ref Sl0355 Unid.,"R$ 54,90",Bazar-E-Utilidades
"Assadeira Marinex Retangular Média 2,2l","R$ 16,90",Bazar-E-Utilidades
Jogo Tramontina Trinchante Plenus 3 Peças,"R$ 61,90",Bazar-E-Utilidades
Conjunto Jarra De Vidro Sm Nature - 4 Copos,"R$ 27,90",Bazar-E-Utilidades
Chinelo Ipanema Barbie Style Infantil,"R$ 39,90",Bazar-E-Utilidades
Chinelo Ipanema Turma Da Mônica Infantil,"R$ 49,90",Bazar-E-Utilidades
Vela São Domingos Aromática Maçã Canela 130g,"R$ 38,90",Bazar-E-Utilidades
Resistência Kimarc Tipo Lorenzetti 220v 5400w,"R$ 10,89",Bazar-E-Utilidades
Prato Descartável Strawplast Cristal 21cm C/ 10 Unid.,"R$ 8,99",Bazar-E-Utilidades
Suporte Para Filtro Café Plásutil Decorado,"R$ 22,90",Bazar-E-Utilidades
Pote Plástico Plásutil Flip 700ml,"R$ 15,99",Bazar-E-Utilidades
Porta Sabão Em Pó Plásutil Decorado,"R$ 19,90",Bazar-E-Utilidades
Garrafa Térmica Invicta Glt Lille Capuccino 1l,"R$ 22,90",Bazar-E-Utilidades
Conjunto Talher Tramontina Dynamic Inox 12 Peças,"R$ 46,90",Bazar-E-Utilidades
Saco Infinite Para Lavar Roupas Basic G Unid.,"R$ 109,90",Bazar-E-Utilidades
Fura Coco Infinite Manual Premium Unid.,"R$ 13,90",Bazar-E-Utilidades
Cortador Cabelo Mondial C/ 8 Acessórios 127v,"R$ 18,90",Bazar-E-Utilidades
Liquidificador Mondial Easy Branco 2 Velocidades 127v,"R$ 85,90",Bazar-E-Utilidades
Panela Tramontina Loreto Alumínio Preta Unid.,"R$ 119,90",Bazar-E-Utilidades
Lâmpada Ourolux Controled Sensor Presença,"R$ 86,90",Bazar-E-Utilidades
Balde Simplo Dobrável Plástico 10l,"R$ 43,90",Bazar-E-Utilidades
Saca Rolha Brinox Preto 12cm - Unidade,"R$ 56,90",Bazar-E-Utilidades
Garrafa Plast Paramount - 2 Litros,"R$ 21,90",Bazar-E-Utilidades
Bowl Plástica Paramount Coração Le Cheff Branca 26x22x7cm,"R$ 13,90",Bazar-E-Utilidades
Caneta Bic Esf 4 Cores + Grafite Hb 0.7 Bl Unid.,"R$ 21,90",Bazar-E-Utilidades
Aditivo Proauto Para Radiador Prorad 1l,"R$ 35,90",Bazar-E-Utilidades
Caderno São Domingos Espiral My Pets 10 Matérias 160 Folhas,"R$ 19,90",Bazar-E-Utilidades
Marcador Faber Casstell Permanente Preto E Branco Com 2 Unid,"R$ 39,90",Bazar-E-Utilidades
Giz De Colorir Faber Castell C/ 12 Unid.,"R$ 19,99",Bazar-E-Utilidades
Garrafa Térmica Mor Use Pessego 1l Unid.,"R$ 12,90",Bazar-E-Utilidades
Garrafa Térmica Mor Use Preta 1l Unid.,"R$ 35,69",Bazar-E-Utilidades
Caneta Bic Gelocity Quick Dry Azul,"R$ 35,69",Bazar-E-Utilidades
Caneta Bic Esferográfica 4 Cores,"R$ 17,99",Bazar-E-Utilidades
Espuma Magica Proauto Aero 400ml,"R$ 16,99",Bazar-E-Utilidades
Lâmpada Ourolux Superled Alta Potência T30w 2400 Lm E27 6500k,"R$ 28,90",Bazar-E-Utilidades
Lampada Ourolux Superled Alta Potência T20w 1600 Lm E27 6500k,"R$ 28,90",Bazar-E-Utilidades
Cestinho Para Prendedor Plasútil Trama,"R$ 16,90",Bazar-E-Utilidades
Lápis De Cor Faber Castell 24 Cores + 4 Cores Pastel,"R$ 12,49",Bazar-E-Utilidades
Lapis De Cor Faber Castell Dinossauro 12+2cores,"R$ 46,90",Bazar-E-Utilidades
Flanela Ferreira Sacaria 28x38 Unid.,"R$ 23,90",Bazar-E-Utilidades
Copo De Vidro Nadir Dose Ole 60ml,"R$ 6,99",Bazar-E-Utilidades
Pote Plástico Ziploc Quadrado 900ml,"R$ 5,99",Bazar-E-Utilidades
Churrasqueira Elétrica Tok Grill 127v,"R$ 33,90",Bazar-E-Utilidades
Pote Plástico Plásutil Decorado Quadrado 200ml,"R$ 189,90",Bazar-E-Utilidades
Palito De Dente Gaboardi C/ 160 Unid.,"R$ 5,79",Bazar-E-Utilidades
Chinelo Havaianas Top Infantil Número 23 À 32,"R$ 2,15",Bazar-E-Utilidades
Chinelo Havaianas Brasil 33 À 47 Unid.,"R$ 36,90",Bazar-E-Utilidades
Plug Adaptador Kimarc 2p + Terra Iluminação,"R$ 63,99",Bazar-E-Utilidades
Esguicho Plástico Kimarc + União 3/4x1/2,"R$ 11,99",Bazar-E-Utilidades
Fita Para Embalar Kimarc 48mm X 40m,"R$ 8,99",Bazar-E-Utilidades
Prego Kimarc 17x21 Peso Líquido 65g,"R$ 12,99",Bazar-E-Utilidades
Fita Adesiva Kimarc 20m,"R$ 6,99",Bazar-E-Utilidades
Válvula Kimarc Clock/Globo/Fulg/Pen C/ 2 Unid.,"R$ 4,49",Bazar-E-Utilidades
Copo De Vidro Nadir Dose 45ml,"R$ 6,99",Bazar-E-Utilidades
Forma Panelux Redonda Polida Classic 26cm,"R$ 3,99",Bazar-E-Utilidades
Odorizante Para Automóvel Glade Gel Citrus 70g,"R$ 42,90",Bazar-E-Utilidades
Kit Escolar Bic Cristal 3 Lápis + 2 Canetas + 1 Borracha + 1 Apontador,"R$ 12,89",Bazar-E-Utilidades
Kit Escolar Bic 12 Lápis De Cor Evolution + 1 Borracha + 1 Apontador + 2 Canetas + Grátis 4 Lápis Pretos,"R$ 21,90",Bazar-E-Utilidades
Escumadeira Para Fritura Original Cook N.34 Unid.,"R$ 32,90",Bazar-E-Utilidades
Pegador Para Salada Original Premium 29cm Unid.,"R$ 16,90",Bazar-E-Utilidades
Faca Original Wood Design N.5,"R$ 19,69",Bazar-E-Utilidades
Faca Original Pantanal N.6,"R$ 14,99",Bazar-E-Utilidades
Vela De Aniversário Junco Vermelha Glitter Número 5 Unid.,"R$ 25,99",Bazar-E-Utilidades
Chinelo Rider Street Slide Adulto Unid.,"R$ 9,89",Bazar-E-Utilidades
Taça Ruvolo Berlin Vidro 330ml,"R$ 64,90",Bazar-E-Utilidades
Copo De Vidro Ruvolo Mirage On The Rocks 280ml,"R$ 14,90",Bazar-E-Utilidades
Caixa Organizadora Ligbrin Rattan Médio 16l,"R$ 9,99",Bazar-E-Utilidades
Silicone Proauto Gel 150g,"R$ 43,90",Bazar-E-Utilidades
Caçarola Panelux Magnific C/ Tampa Grafite 26cm,"R$ 14,99",Bazar-E-Utilidades
Cabide Melare Plástico Adulto C/ 3 Unid.,"R$ 89,90",Bazar-E-Utilidades
Tigela De Vidro Nadir Americano C/ Tampa 1l,"R$ 8,99",Bazar-E-Utilidades
Chinelo Havaianas Kids Flores 23 À 36 Unid.,"R$ 29,90",Bazar-E-Utilidades
Óleo De Motor Texaco Havoline Superior 20w50 Sl Mineral 1l,"R$ 47,90",Bazar-E-Utilidades
Lâmpada Kian Led Bulbo 15w 6500k E27 Bivolt,"R$ 33,90",Bazar-E-Utilidades
Corante Guarani Fixacor 40g,"R$ 14,99",Bazar-E-Utilidades
Colher Descartável Facilita Pronto Master C/ 50 Unid.,"R$ 7,49",Bazar-E-Utilidades
Pote De Vidro Marinex Facilita Vap Retangular 750ml,"R$ 16,29",Bazar-E-Utilidades
Vela De Aniversário Junco Live Collors C/ Gliter Azul Número 0 Unid.,"R$ 34,90",Bazar-E-Utilidades
Assadeira Life Clean Oval Descartável 7l,"R$ 9,99",Bazar-E-Utilidades
Lápis De Cor Multicolor Ecolapis 12 Cores + 2 Lápis,"R$ 9,69",Bazar-E-Utilidades
Resistência Lorenzetti Ultra 220v 5500w Unid.,"R$ 10,90",Bazar-E-Utilidades
Balão Junco Metalizado Dourado 40cm N.0,"R$ 35,90",Bazar-E-Utilidades
Taça Coza De Sobremesa Cozy 150ml Unid.,"R$ 7,95",Bazar-E-Utilidades
Silicone Proauto Multiuso Aqua 321ml,"R$ 5,79",Bazar-E-Utilidades
Tomada Kimarc Externa 2p + T,"R$ 29,90",Bazar-E-Utilidades
Balão Junco Liso Rosa Número 7 C/ 50 Unid.,"R$ 8,99",Bazar-E-Utilidades
Balão Junco Liso Branco Número 7 C/ 50 Unid.,"R$ 18,90",Bazar-E-Utilidades
Corante Para Bolo Junco Líquido Azul 10ml,"R$ 18,90",Bazar-E-Utilidades
Feltro Scotch Marrom Quadrado P C/ 12 Unid.,"R$ 8,25",Bazar-E-Utilidades
Bule Térmico Invicta Viena Preto 750ml,"R$ 10,29",Bazar-E-Utilidades
Vela Aniversário Junco Branca Número 4 Unid.,"R$ 61,90",Bazar-E-Utilidades
Limpa Estofado Luxcar 400ml,"R$ 49,90",Bazar-E-Utilidades
Lava Autos Proauto C/ Cera 500ml,"R$ 4,19",Bazar-E-Utilidades
Colher Tramontina De Chá Inox Leme Azul - Unidade,"R$ 19,99",Bazar-E-Utilidades
Concha Plasútil Unid.,"R$ 16,90",Bazar-E-Utilidades
Taça Plasutil Sobremesa Glamour,"R$ 2,99",Bazar-E-Utilidades
Chinelo Havaianas Top Disney,"R$ 7,89",Bazar-E-Utilidades
Garrafa Termica Invicta Vogue Vermelha 750ml Unidade,"R$ 12,90",Bazar-E-Utilidades
Garrafa De Alumínio Catuai Estampada Unidade 500ml,"R$ 58,90",Bazar-E-Utilidades
Assadeira Panelux Classic Alumínio Polido 38x26,"R$ 39,90",Bazar-E-Utilidades
Massa Durepox Kimarc 50g,"R$ 19,90",Bazar-E-Utilidades
Corante Guarany Tingecor Vinho 40g,"R$ 54,90",Bazar-E-Utilidades
Corante Guarany Tingecor Vermelho 40g,"R$ 13,99",Bazar-E-Utilidades
Conjunto Ruvolo Sobremesa New Paradise Vidro 12 Peças 220ml,"R$ 5,99",Bazar-E-Utilidades
Garrafa Térmica Termolar Magic Pump Vermelho 1l Ref 56518 Unid.,"R$ 5,99",Bazar-E-Utilidades
Cortador De Pizza Tramontina Preto Utilita Unid.,"R$ 59,90",Bazar-E-Utilidades
Colher De Sorvete Tramontina Utilita Preto Unid.,"R$ 72,90",Bazar-E-Utilidades
Petisqueira Plástica Paramount Le Cheff Redonda Branca Com 4 Divisões,"R$ 36,90",Bazar-E-Utilidades
Vela São Domingos Aromática Andiroba 160g,"R$ 29,90",Bazar-E-Utilidades
Vela São Domingos Aromática Capim Limão 130g,"R$ 22,90",Bazar-E-Utilidades
Copo Descartável Altacoppo 550ml C/ 50 Unid.,"R$ 10,89",Bazar-E-Utilidades
Resistência Kimarc Tipo Lorenzetti 127v 5400w,"R$ 10,89",Bazar-E-Utilidades
Copo Descartável Strawplast Cristal 300ml,"R$ 19,99",Bazar-E-Utilidades
Garrafa Térmica Invicta Sevilha Vermelho Velvet 1l,"R$ 8,99",Bazar-E-Utilidades
"Porta Mantimentos Ligbrin Cristal - 1,5 Litro","R$ 14,59",Bazar-E-Utilidades
Frigideira Brinox Fun Mostarda - 22cm,"R$ 49,90",Bazar-E-Utilidades
Cloro Hidroall Para Piscinas Penta 10kg,"R$ 24,90",Bazar-E-Utilidades
Marmita Paramount Plástica Pratica 12x8x9cm Unidade,"R$ 34,90",Bazar-E-Utilidades
Organizador Paramount Para 6 Latas - Unidade,"R$ 299,00",Bazar-E-Utilidades
Óleo Motor Ipiranga F1 Master Protection 20w50 1l,"R$ 17,90",Bazar-E-Utilidades
Lápis De Cor Faber Castell Caras & Cores 24+3cores,"R$ 35,90",Bazar-E-Utilidades
"Caneta Faber Castell Azul, Preta E Vermelho C/ 3 Unid.","R$ 36,90",Bazar-E-Utilidades
Caderno Foroni Brochurão Divertidamente 80 Folhas,"R$ 46,99",Bazar-E-Utilidades
Caderno Tilibra Espiral Mickey 10 Matérias 160 Folhas,"R$ 16,99",Bazar-E-Utilidades
Taça De Cerveja Nadir Floripa 300ml,"R$ 42,99",Bazar-E-Utilidades
Guarda Chuva Proteja-Se Mini Proteção Solar Unid.,"R$ 69,99",Bazar-E-Utilidades
Pote Plástico Plasútil Trava Mais Retangular 360ml,"R$ 12,99",Bazar-E-Utilidades
"Pote Plástico Plasútil Trava Mais Retangular 1,3l","R$ 27,90",Bazar-E-Utilidades
Apontador Faber Castell C/ Depósito Cristal Unid.,"R$ 9,99",Bazar-E-Utilidades
Caderno Foroni Espiral Mickey 80 Folhas,"R$ 27,90",Bazar-E-Utilidades
Filtro Exaustor Anis 80x60cm,"R$ 5,99",Bazar-E-Utilidades
Marca Texto Faber Castell Grifpen Com Cheirinho Relvigora E Energiza Com 5 Unid,"R$ 44,99",Bazar-E-Utilidades
"Kit Escolar Faber Castell 2 Lápis, 1 Borracha 1 Apontador Verde Pastel","R$ 10,49",Bazar-E-Utilidades
Tábua Original Para Corte 37cm Unid.,"R$ 33,90",Bazar-E-Utilidades
Vela Moroaba Número 10 Branca 484g,"R$ 17,99",Bazar-E-Utilidades
Garrafa Térmica Invicta Glt Lisa Preta 1l,"R$ 25,90",Bazar-E-Utilidades
Silicone Proauto Secagem Rápida 120ml,"R$ 25,90",Bazar-E-Utilidades
Saco Hermético Wyda C/ Fechamento Slider 19x17cm Unid.,"R$ 52,90",Bazar-E-Utilidades
Kit Ralo Telinha + Válvula De Segurança Kimarc Unidade,"R$ 15,99",Bazar-E-Utilidades
Ducha Lorenzetti Fashion Branca 220v 5500w,"R$ 15,35",Bazar-E-Utilidades
Pino 3 Saidas Kimarc Abnt C/ 1,"R$ 7,99",Bazar-E-Utilidades
"Bucha Kimarc Número 8 C/ 5 Unid. + 5 Parafusos 4,8x50","R$ 145,90",Bazar-E-Utilidades
Fita Para Embalar Kimarc 48mmx40m,"R$ 10,99",Bazar-E-Utilidades
Pote De Vidro Marinex Facilita Vap Quadrado 1l Unid.,"R$ 6,99",Bazar-E-Utilidades
Braço De Chuveiro Kimarc 40cm Unid.,"R$ 12,99",Bazar-E-Utilidades
Ralo Para Válvula Kimarc Cromado Americana,"R$ 36,90",Bazar-E-Utilidades
"Lasanheira Vidro Marinex Retangular C/ Tampa 5,3l","R$ 19,99",Bazar-E-Utilidades
Porta Talheres Plasútil C/ 5 Divisórias,"R$ 5,99",Bazar-E-Utilidades
Boneca Barbie Fashion Mattel Unid.,"R$ 84,90",Bazar-E-Utilidades
Chinelo Havaianas Baby Disney Classics,"R$ 25,90",Bazar-E-Utilidades
Espátula Original Curva Premium N.2.5 Unid.,"R$ 52,90",Bazar-E-Utilidades
Chinelo Havaianas Color Essential,"R$ 52,90",Bazar-E-Utilidades
Taça Ruvolo Bélgica Vidro 380ml,"R$ 24,90",Bazar-E-Utilidades
Taça Ruvolo Cristal Baden Baden Brasão 360ml,"R$ 52,90",Bazar-E-Utilidades
"Caixa Organizadora Ligbrin Rattan Mini 2,5l Sortidos","R$ 14,90",Bazar-E-Utilidades
Colher De Mesa Tramontina Inox Leme Preta Unid.,"R$ 41,90",Bazar-E-Utilidades
Baralho Copag 157 C/ 54 Cartas Unid.,"R$ 15,59",Bazar-E-Utilidades
Lava Autos Luxcar C/ Cera 500ml,"R$ 3,69",Bazar-E-Utilidades
Frigideira Panelux Francesa Cereja Premium 24 Aa,"R$ 21,90",Bazar-E-Utilidades
Jogo De Taça Nadir Agua Paulista 250ml C/6 Unid.,"R$ 16,89",Bazar-E-Utilidades
Caneca De Vidro Nadir Bistrol Cerveja 340ml,"R$ 54,90",Bazar-E-Utilidades
Frigideira Panelux Wok Cereja Magnific Aa 24cm,"R$ 43,90",Bazar-E-Utilidades
Copo Descartavel Facilita Pronto Cristal 200ml C/ 50 Unid.,"R$ 28,90",Bazar-E-Utilidades
Panela Panelux Magnific Com Tampa Grafite 20cm,"R$ 69,90",Bazar-E-Utilidades
Assadeira Life Clean Oval Descartável 4l,"R$ 14,29",Bazar-E-Utilidades
"Caçarola Ebony Com Tampa Preto Brinox 2,5 Litro 20x9cm","R$ 59,90",Bazar-E-Utilidades
Porta Escova Coza Bulky Com Tampa,"R$ 5,99",Bazar-E-Utilidades
Resistência Lorenzetti Ultra 127v 5500w 3 Temperatura Unid.,"R$ 89,90",Bazar-E-Utilidades
Balão Junco Metalizado Prata 40cm N.5,"R$ 26,90",Bazar-E-Utilidades
Balão Junco Metalizado Dourado 40cm N.2,"R$ 35,90",Bazar-E-Utilidades
Balão Junco Látex Liso Preto Número 70 C/ 50 Unid.,"R$ 7,95",Bazar-E-Utilidades
Balão Junco Gigante Azul Número 250,"R$ 7,95",Bazar-E-Utilidades
Corante Para Bolo Junco Líquido Vermelho 10ml,"R$ 18,90",Bazar-E-Utilidades
Cabides Catuai Preto Adulto - 6 Unidades,"R$ 15,90",Bazar-E-Utilidades
Afiador De Facas Mozcada Unid.,"R$ 8,25",Bazar-E-Utilidades
Xícara De Café Nadir Americano 90ml,"R$ 6,99",Bazar-E-Utilidades
Copo Plástico Plasútil Com Tampa Orelha Mickey - 500ml,"R$ 29,90",Bazar-E-Utilidades
Caneta Bic Marca Texto Amarelo Fino,"R$ 12,65",Bazar-E-Utilidades
Caixa Térmica Mor Azul 34l,"R$ 15,99",Bazar-E-Utilidades
Conjunto Para Fondue Brinox Preto C/ 10 Peças,"R$ 4,79",Bazar-E-Utilidades
Prato Duralex Fundo Astral 22cm Unid.,"R$ 99,90",Bazar-E-Utilidades
Resistência Lorenzetti Maxi Ducha 4t 127v 5500w Unid.,"R$ 129,90",Bazar-E-Utilidades
Prendedor Roupa Gina Madeira C/ 12 Unid.,"R$ 7,99",Bazar-E-Utilidades
Caneta Faber Castell Esferográfica Trilux Média Azul C/ 3 Unid.,"R$ 32,90",Bazar-E-Utilidades
Borracha Escolar Mercur Branca Record 20 Com 2 Unidades,"R$ 5,65",Bazar-E-Utilidades
Cola Escolar Bic Branca 90g,"R$ 4,99",Bazar-E-Utilidades
Espeto Gina Madeira C/ 100 Unid.,"R$ 3,69",Bazar-E-Utilidades
Liquidificador Mondial Turbo Power Vermelho 127v,"R$ 8,85",Bazar-E-Utilidades
Escova Sanitária Melare Sany Nylon C/ Estojo,"R$ 14,90",Bazar-E-Utilidades
Extensão Tripla Kimarc 2p + Terra 2m,"R$ 149,90",Bazar-E-Utilidades
Pino Triângulo Kimarc Perlex,"R$ 18,99",Bazar-E-Utilidades
Bico Torneira Plástica Kimarc Robusto 3/4,"R$ 49,90",Bazar-E-Utilidades
Registro Para Gas Kimarc,"R$ 9,99",Bazar-E-Utilidades
Churrasqueira Mor Montana Unid.,"R$ 4,99",Bazar-E-Utilidades
Espeto Mor Duplo 65cm Unid.,"R$ 39,90",Bazar-E-Utilidades
Faca Mor Assador Número 8 Unid.,"R$ 214,90",Bazar-E-Utilidades
Cortador Pizza Original Cook Unid.,"R$ 13,99",Bazar-E-Utilidades
Colher Original Cook 33.5cm Unid.,"R$ 27,90",Bazar-E-Utilidades
Vela De Aniversário Junco Ouro Glitter Número 8 Unid.,"R$ 16,29",Bazar-E-Utilidades
Vela De Aniversário Junco Vermelha Glitter Número 1 Unid.,"R$ 13,99",Bazar-E-Utilidades
Pino Femea Kimarc 10a 250v Unid.,"R$ 9,89",Bazar-E-Utilidades
Vela Aniversário Junco Emoji Beijinho Unid.,"R$ 9,89",Bazar-E-Utilidades
Odorizante Para Automóvel Proauto Breeza Sens Extra Forte Extreme - 5ml,"R$ 6,99",Bazar-E-Utilidades
Assadeira Panelux Classic Alumínio Polido 33x22,"R$ 13,79",Bazar-E-Utilidades
Bule Térmico Invicta Viena Baby C/ Gatilho Verde Lime 400ml,"R$ 22,99",Bazar-E-Utilidades
Frigideira Panelux Wok Rose Magnific Aa 24cm,"R$ 44,90",Bazar-E-Utilidades
Lâmpada Kian Led Bulbo 9w 6500k E27 Bivolt,"R$ 62,90",Bazar-E-Utilidades
Chaira Profissional Branca Aço Carbono Original Line Premium 8,"R$ 69,90",Bazar-E-Utilidades
Balão Junco Látex Liso Verde Escuro Número 70 C/ 50 Unid.,"R$ 7,99",Bazar-E-Utilidades
Vela Aniversário Junco Live Collors C/ Gliter Azul Número 6 Unid.,"R$ 49,90",Bazar-E-Utilidades
"Frigideira Ebony Preto Brinox 1,2 Litro 22x4cm","R$ 18,90",Bazar-E-Utilidades
"Panela Ebony Com Tampa Preto Brinox 1,75litro 18x8cm","R$ 9,99",Bazar-E-Utilidades
Caderno Tilibra Espiral It! 160 Folhas,"R$ 49,90",Bazar-E-Utilidades
Caderno Foroni Espiral Cliff 80 Folhas,"R$ 69,90",Bazar-E-Utilidades
Lápis Faber Castell Grafite Ecolapis Sextavado Leve 6 Pague 5,"R$ 51,90",Bazar-E-Utilidades
Bisnaga Plasútil Para Mostarda 280ml,"R$ 13,90",Bazar-E-Utilidades
Balão Junco Metalizado Prata 40cm N.2,"R$ 8,99",Bazar-E-Utilidades
Balão Junco Metalizado Dourado 40cm N.9,"R$ 8,55",Bazar-E-Utilidades
Balão Junco Metalizado Prata 40cm N.0,"R$ 7,95",Bazar-E-Utilidades
Cloro Hidroall Para Piscinas Penta Tablete 200g,"R$ 7,95",Bazar-E-Utilidades
Resistência Lorenzetti Advanced T 220v 7500w Unid.,"R$ 7,95",Bazar-E-Utilidades
Saco Lixo Saron Família C/ 10 Unid. 200l,"R$ 12,90",Bazar-E-Utilidades
Adubo Green Fix 10.10.10 1kg,"R$ 52,90",Bazar-E-Utilidades
Balão Junco Gigante Rosa Número 250,"R$ 28,90",Bazar-E-Utilidades
Forminha Junco Papel Azul Royal Número 5 C/ 100 Unid.,"R$ 29,90",Bazar-E-Utilidades
Espremedor Para Alho Catuai - 15cm,"R$ 15,90",Bazar-E-Utilidades
Vela Aniversário Junco Branca Número 1 Unid.,"R$ 2,99",Bazar-E-Utilidades
Vela Aniversário Junco Big Branca Número 8 Unid.,"R$ 6,99",Bazar-E-Utilidades
Copo De Vidro Nadir Vegas Long Drink 330ml Unid.,"R$ 4,19",Bazar-E-Utilidades
Jogo De Copo Nadir Long Drink Topázio C/ 6 Unid. 360ml,"R$ 4,19",Bazar-E-Utilidades
Copo Plástico Plasútil Neon Baixo 280ml Unid.,"R$ 9,19",Bazar-E-Utilidades
Faca Descartável Facilita & Pronto Refeição Branca - 50 Unidades,"R$ 64,90",Bazar-E-Utilidades
Borrifador Vertix Plástico Bola 150ml - Unidade,"R$ 4,09",Bazar-E-Utilidades
Jogo Copo Nadir Sm Nature C/ 6 Unid. 270ml,"R$ 6,79",Bazar-E-Utilidades
Massa Para Modelar Acrilex Soft C/ 6 Potes Cores 900g,"R$ 13,99",Bazar-E-Utilidades
Frigideira Tramontina Wok Loreto Preta 28cm,"R$ 19,90",Bazar-E-Utilidades
Taca Bohemia Vinho Gastro Cristal 650ml,"R$ 64,90",Bazar-E-Utilidades
Cesto Plasútil Para Roupas Trama Cinza 40l Unid.,"R$ 89,90",Bazar-E-Utilidades
Corante Guarany Tingecor Amarelo 40g,"R$ 27,90",Bazar-E-Utilidades
Tiracor Guarany 40g,"R$ 139,90",Bazar-E-Utilidades
Cutelo Peixeira Original Premium Ref Sl0338,"R$ 5,99",Bazar-E-Utilidades
Jogo Tramontina Trinchante Plenus 2 Peças,"R$ 6,55",Bazar-E-Utilidades
Panquequeira Tramontina Vermelha 22cm,"R$ 41,90",Bazar-E-Utilidades
Pote Plástico Plásutil Decorado Redondo 480ml,"R$ 45,90",Bazar-E-Utilidades
Copo Vidro Nadir Coca Cola Contour 270ml,"R$ 59,90",Bazar-E-Utilidades
Kit Churrasco Strawplast Pratos + Garfos +F Acas,"R$ 5,99",Bazar-E-Utilidades
Copo Vidro Sm Aruba Long Drink 465ml,"R$ 15,90",Bazar-E-Utilidades
Processador De Alimentos Manual Infinite Smart,"R$ 37,90",Bazar-E-Utilidades
Boneca Mattel Barbie Praia,"R$ 10,99",Bazar-E-Utilidades
Bateria Duracell Lítio Metálico Cr 2032 C/ 2 Unid.,"R$ 47,90",Bazar-E-Utilidades
"Regador Pet Garden 2,4lt","R$ 49,90",Bazar-E-Utilidades
"Porta Frios Ligbrin Retangular Com Separador - 1,1 Litro","R$ 35,90",Bazar-E-Utilidades
Pote Plástico Ligbrin Retângulo - 3 Litros,"R$ 19,45",Bazar-E-Utilidades
"Cloro Hidroall Para Piscinas Fibra/Vinil 2,5kg","R$ 33,90",Bazar-E-Utilidades
Mop Simplo Giro Fit Balde Com Esfregão - 8 Litros,"R$ 31,90",Bazar-E-Utilidades
Pote Plástico Plasutil Organizador Gire E Trave Com Alça M - 5 Peças,"R$ 109,90",Bazar-E-Utilidades
"Bowl Plast Paramount Red Bca 23,5x14,5cm","R$ 79,90",Bazar-E-Utilidades
"Travessa Paramount Oval Com Friso Le Chef Branca 33,5x23,5x12,5cm","R$ 24,90",Bazar-E-Utilidades
Pote Plástico Paramount Hermético Lumini Quadrado 480ml,"R$ 23,90",Bazar-E-Utilidades
Suporte Para Coador Melitta 103 Unid.,"R$ 33,90",Bazar-E-Utilidades
Caneca De Vidro Nadir Aspen 300ml Unid.,"R$ 25,90",Bazar-E-Utilidades
Caderno São Domingos Espiral My Pets 80 Folhas,"R$ 11,75",Bazar-E-Utilidades
Corretivo Líquido Bic Ecolutions 18ml,"R$ 9,99",Bazar-E-Utilidades
Caneca Vidro Nadir Americano 270ml,"R$ 25,90",Bazar-E-Utilidades
Caneta Bic Esferográfica Cristal Fashion Cores C/4 Unid.,"R$ 8,70",Bazar-E-Utilidades
Massa Para Modelar Acrilex Soft C/ 12 Cores Foscas 180g,"R$ 14,75",Bazar-E-Utilidades
Taça Ruvolo Champagne One 200ml,"R$ 12,90",Bazar-E-Utilidades
Faca Tramontina Para Carne Plenus Número 8,"R$ 7,99",Bazar-E-Utilidades
Guarda Chuva Proteja-Se Longo Portaria Curvo Preto Automatico Unid.,"R$ 20,90",Bazar-E-Utilidades
Forma Plástico Plasútil Para Gelo Garrafa Unid.,"R$ 33,90",Bazar-E-Utilidades
"Guardanapo Scott Folha Simples Dia A Dia Grande 30x26,2cm C/ 50 Unid.","R$ 37,90",Bazar-E-Utilidades
Vela Moroaba Novena 380g,"R$ 5,99",Bazar-E-Utilidades
Espátula Plasútil Unid.,"R$ 6,09",Bazar-E-Utilidades
Jogo De Taças Nadir Sorvete Paulista 400ml C/4 Unid.,"R$ 20,90",Bazar-E-Utilidades
Forma Plástica Plasútil Para Gelo Unid.,"R$ 6,99",Bazar-E-Utilidades
Fita Isolante Kimarc Anti Chamas 5m,"R$ 48,90",Bazar-E-Utilidades
"Bucha Kimarc Número 10 C/ 3 Unid. + 3 Parafusos 5,5x55","R$ 7,99",Bazar-E-Utilidades
"Mangueira Para Gás Kimarc 1,25m Unid.","R$ 6,99",Bazar-E-Utilidades
Prego Kimarc 10x10 Peso Líquido 50g,"R$ 5,99",Bazar-E-Utilidades
Prego Kimarc 12x12 Preso Líquido 50g,"R$ 38,90",Bazar-E-Utilidades
Escorredor Plasútil Talheres Decorado,"R$ 7,99",Bazar-E-Utilidades
Ducha Lorenzetti Maxi Blis 220v 5500w,"R$ 6,99",Bazar-E-Utilidades
Ducha Lorenzetti Bello C/ Cano 220v 5500w,"R$ 11,90",Bazar-E-Utilidades
Faca Original Peixeira Premium N.6,"R$ 94,90",Bazar-E-Utilidades
Kit Escolar Molin Office Plus 1 Caneta + 1 Lapiseira +1 Tubo Grafite + 12 Refil Borracha Lapiseira Unidade,"R$ 109,90",Bazar-E-Utilidades
Vela De Aniversário Junco Ouro Glitter Número 2 Unid.,"R$ 31,90",Bazar-E-Utilidades
Vela De Aniversário Junco Vermelha Glitter Número 0 Unid.,"R$ 28,90",Bazar-E-Utilidades
Vela De Aniversário Junco Ouro Glitter Número 3 Unid.,"R$ 9,89",Bazar-E-Utilidades
Vela De Aniversário Junco Vermelha Glitter Número 3 Unid.,"R$ 9,89",Bazar-E-Utilidades
Conjunto De Pote Plasutil Pop Quadrado 3 Peças Unid.,"R$ 9,89",Bazar-E-Utilidades
Bico Para Mangueira Plástico Kimarc Unid.,"R$ 9,89",Bazar-E-Utilidades
Chinelo Havaianas Kids Athletic,"R$ 24,49",Bazar-E-Utilidades
Taça Ruvolo Água One 490ml,"R$ 8,99",Bazar-E-Utilidades
Prendedor De Roupa Ligbrin Prende Fácil C/ 18 Unid.,"R$ 47,90",Bazar-E-Utilidades
Frigideira Panelux Francesa Cereja Premium 22 Aa,"R$ 14,90",Bazar-E-Utilidades
Copo De Vidro Sm Lager Cerveja 200ml,"R$ 15,99",Bazar-E-Utilidades
Lâmpada Kian Led Bulbo 12w 3000k E27 Bivolt,"R$ 49,90",Bazar-E-Utilidades
Espátula Original Line Para Manteiga C/ 4 Unid.,"R$ 7,89",Bazar-E-Utilidades
Ferro Vapor Mondial Branco/Azul 127v,"R$ 12,99",Bazar-E-Utilidades
Bisnaga Plasútil Para Maionese 280ml,"R$ 29,90",Bazar-E-Utilidades
Pote De Vidro Marinex Facilita Vap Quadrado 300ml,"R$ 139,90",Bazar-E-Utilidades
Chinelo Rider R1 Style Unid.,"R$ 7,19",Bazar-E-Utilidades
Caderno Espiral Flork Jandaia 80 Folhas,"R$ 16,95",Bazar-E-Utilidades
Porta Sabonete Líquido Coza Bulky 450ml,"R$ 46,90",Bazar-E-Utilidades
Balão Junco Metalizado Dourado 40cm N.8,"R$ 21,90",Bazar-E-Utilidades
Balão Junco Metalizado Dourado 40cm N.7,"R$ 25,90",Bazar-E-Utilidades
Rasteirinha Kl Calçados Solemar Unid.,"R$ 7,95",Bazar-E-Utilidades
Balão Junco Liso Vermelho Número 7 C/ 50 Unid.,"R$ 7,95",Bazar-E-Utilidades
Corante Para Bolo Junco Líquido Rosa 10ml,"R$ 29,99",Bazar-E-Utilidades
"Kit Bacia Goup Premium Com 3 Unidade 1,5l, 2,5l E 4l","R$ 18,90",Bazar-E-Utilidades
Acendedor Multiuso Bic Mega Lighter Unid.,"R$ 8,25",Bazar-E-Utilidades
Vela Aniversário Junco Branca Número 3 Unid.,"R$ 12,90",Bazar-E-Utilidades
Grelha Mor Simples Numero 2 Unid.,"R$ 33,90",Bazar-E-Utilidades
Garfo Descartável Facilita & Pronto Para Refeição Branco - 50 Unidades,"R$ 4,19",Bazar-E-Utilidades
Faca De Mesa Tramontina Inox Leme Azul - Unidade,"R$ 57,90",Bazar-E-Utilidades
Odorizante Para Automóvel Glade Refil Sport Acqua Gratis Aparelho 7ml,"R$ 6,79",Bazar-E-Utilidades
Conjunto Tramontina Facas Plenus Preto Com Suporte - 6 Peças,"R$ 3,69",Bazar-E-Utilidades
Fritadeira Mondial Air Fryer Preto 6 Litros 127v,"R$ 30,90",Bazar-E-Utilidades
Jogo De Copo Sm Aruba Long Drink 475ml C/ 6 Unid.,"R$ 115,99",Bazar-E-Utilidades
Taça Sm Vinho Royal Degustação 615ml,"R$ 699,00",Bazar-E-Utilidades
Cumbuca Plástica Coza Uno Preta 500ml,"R$ 61,90",Bazar-E-Utilidades
"Cesto Para Frituras Top Prat Inox Brinox 18x11,5cm Ref 2204/020 Unid.","R$ 19,89",Bazar-E-Utilidades
Panela Brinox Com Tampa Vermelho 16x7cm,"R$ 10,90",Bazar-E-Utilidades
Cumbuca Plast Coza Cozy 300ml Unid. Ref 20117/0009,"R$ 39,90",Bazar-E-Utilidades
Chinelo Ipanema Infantil Polly Max Stell,"R$ 74,90",Bazar-E-Utilidades
Máquina Cafeteira Três Touch Vermelha 127v,"R$ 5,99",Bazar-E-Utilidades
Organizador Coza Talheres Perfect Natural,"R$ 36,90",Bazar-E-Utilidades
Cumbuca Plástica Coza Uno Preta 300ml,"R$ 749,90",Bazar-E-Utilidades
