Título,Preço,Departamento
Jogo De Medidas Infinite Colors,"R$ 45,90",Bazar-E-Utilidades
Saco Hermet Ziploc Para Levar Pequeno C/ 14 Unid.,"R$ 6,99",Bazar-E-Utilidades
Limpa Vidros Proauto Gatilho 500ml,"R$ 19,90",Bazar-E-Utilidades
Ducha Lorenzetti Shower Multi 127v 5500w,"R$ 16,99",Bazar-E-Utilidades
Lampada Kian Led Mini T 9w 6500k E27 Bivolt - Unidade,"R$ 14,79",Bazar-E-Utilidades
Pote Plástico Ligbrin Retangular 500ml - 2 Unidades,"R$ 122,90",Bazar-E-Utilidades
Pote Plástico Ligbrin Retangular - 500ml,"R$ 8,99",Bazar-E-Utilidades
"Saca Rolha Brinox Preto 17,5cm - Unidade","R$ 34,90",Bazar-E-Utilidades
"Pote Plástico Paramount Slim Multiuso Branco - 2,030ml","R$ 13,90",Bazar-E-Utilidades
Porta Sabão Líquido Plasútil C/ Dosador,"R$ 26,90",Bazar-E-Utilidades
Tigela Bowl Nadir Astral 1l,"R$ 41,90",Bazar-E-Utilidades
Caneta Bic Esf 4 Cores Rose Gold Unid,"R$ 18,90",Bazar-E-Utilidades
Copo Plástico Plasútil Com Tampa Orelha Mínnie 500ml,"R$ 17,90",Bazar-E-Utilidades
Lápis Faber Castell Glitiz Grafite Red C/ 4 Unid.,"R$ 24,99",Bazar-E-Utilidades
"Kit Escolar Faber Castell 2 Lápis, 1 Borracha 1 Apontador Preto","R$ 15,99",Bazar-E-Utilidades
"Kit Escolar Faber Castell 2 Lápis, 1 Borracha 1 Apontador Rosa Pastel","R$ 9,99",Bazar-E-Utilidades
Caderno São Domingos Espiral Alice 10 Matérias 160 Folhas Unid.,"R$ 15,99",Bazar-E-Utilidades
Chinelo Havaianas Elegance,"R$ 17,99",Bazar-E-Utilidades
Lâmpada Ourolux Superled Alta Potência T40w 3200 Lm E27 6500k,"R$ 49,90",Bazar-E-Utilidades
Garrafa Térmica Invicta Arábica Cappuccino 1l,"R$ 45,99",Bazar-E-Utilidades
"Tigela De Vidro Marinex Astral C/ Tampa 1,5l","R$ 34,90",Bazar-E-Utilidades
Conjunto De Xícaras C/ Pires De Vidro Brinox Pavillion 70ml C/ 6 Unid.,"R$ 42,90",Bazar-E-Utilidades
Protetor Vinil/Couro Proauto 200ml,"R$ 37,90",Bazar-E-Utilidades
Vela Moroaba Recho Canela 90g,"R$ 62,90",Bazar-E-Utilidades
Filtro Para Coifas Scotch Brite Unid.,"R$ 25,90",Bazar-E-Utilidades
Garrafa Térmica Termolar Personal Inox 1l,"R$ 9,89",Bazar-E-Utilidades
Copo De Vidro Nadir Tulipa Para Cerveja 330ml,"R$ 14,90",Bazar-E-Utilidades
Garrafa Térmica Termolar Personal Preta 1l,"R$ 149,90",Bazar-E-Utilidades
Odorizante Para Automóvel Proauto Gel Morango 60g,"R$ 11,45",Bazar-E-Utilidades
Conector Kimarc Porcelana 10mm 2p Unid.,"R$ 72,90",Bazar-E-Utilidades
Abraçador De Rosca Kimarc S/Fim 5/8x3/4 C/ 1 Unid.,"R$ 14,99",Bazar-E-Utilidades
Grelha Mor Super Grill Dupla Número 1 Unid.,"R$ 8,99",Bazar-E-Utilidades
Espeto Mor Simples 75cm Unid.,"R$ 3,89",Bazar-E-Utilidades
Ralo Para Lavatório Kimarc C/ Telinha Unid.,"R$ 45,90",Bazar-E-Utilidades
Chinelo Cartago Dakar Unid.,"R$ 16,99",Bazar-E-Utilidades
Vaso Plástico Pet Garden Preto N.03,"R$ 4,99",Bazar-E-Utilidades
Frigideira Panelux Wok Cereja C/ Tampa Aa 24cm,"R$ 39,99",Bazar-E-Utilidades
Ducha Lorenzetti Top Jet Mult 127v 5500w Unid.,"R$ 7,15",Bazar-E-Utilidades
Cadeado Pado Blister 30mm Unid.,"R$ 109,90",Bazar-E-Utilidades
Kit Completo Faber Castell Lápis De Cor 12 Unid. + 2 Lápis Preto + 1 Apontador + 1 Borracha,"R$ 159,90",Bazar-E-Utilidades
"Panela Pressão Panelux Fechamento Externo Cereja 4,5l","R$ 35,90",Bazar-E-Utilidades
"Concha Original Cook Inox 32,8cm","R$ 30,45",Bazar-E-Utilidades
Vela De Aniversário Junco Ouro Glitter Número 6 Unid.,"R$ 149,00",Bazar-E-Utilidades
Vela De Aniversário Junco Ouro Glitter Número 9 Unid.,"R$ 12,90",Bazar-E-Utilidades
Odorizante Para Automóvel Proauto Breeze Sens Oceano 5ml,"R$ 9,89",Bazar-E-Utilidades
Odorizante Proauto Breeze Sensations Energy 5g,"R$ 9,89",Bazar-E-Utilidades
Cola Super Bonder Flex Gel 2g,"R$ 22,99",Bazar-E-Utilidades
Chinelo Havaianas Top Basic Unid.,"R$ 22,99",Bazar-E-Utilidades
Acendedor De Carvão Tok Grill Elétrico 127v,"R$ 11,99",Bazar-E-Utilidades
Tábua De Corte Oikos Ultrafina Arredondada 32x22cm,"R$ 58,69",Bazar-E-Utilidades
Panela Panelux Magnific C/ Tampa Grafite 16cm,"R$ 99,90",Bazar-E-Utilidades
"Assadeira Nadir Seletta Oval Media Vidro 3,2l","R$ 19,90",Bazar-E-Utilidades
Lâmpada Kian Led Bulbo 12w 6500k E27 Bivolt,"R$ 49,90",Bazar-E-Utilidades
"Pegador De Gelo Original Line 18,5cm","R$ 49,90",Bazar-E-Utilidades
Faca Tramontina Plenus Tomate Numero 5 Unid.,"R$ 12,99",Bazar-E-Utilidades
Espátula Plasútil Gourmet Unid.,"R$ 13,90",Bazar-E-Utilidades
Caderno Foroni Espiral Cliff 160 Folhas,"R$ 11,90",Bazar-E-Utilidades
Caderno Foroni Espiral Cliff 80 Folhas,"R$ 7,19",Bazar-E-Utilidades
Saleiro Plasútil Decorado 1kg,"R$ 23,90",Bazar-E-Utilidades
Taça Ruvolo Eisenbahn Royal Beer 330ml,"R$ 13,90",Bazar-E-Utilidades
Balão Junco Metalizado Prata 40cm N.8,"R$ 13,29",Bazar-E-Utilidades
Balão Junco Metalizado Prata 40cm N.7,"R$ 23,90",Bazar-E-Utilidades
Balão Junco Metalizado Prata 40cm N.3,"R$ 7,95",Bazar-E-Utilidades
Saboneteira Plasútil C/ Escorredor Unid.,"R$ 7,95",Bazar-E-Utilidades
Vela Aniversário Junco Branca Número 2 Unid.,"R$ 7,95",Bazar-E-Utilidades
Vela Aniversário Junco Big Branca Número 9 Unid.,"R$ 7,49",Bazar-E-Utilidades
Balão Junco Látex Salpicado Sortido Número 65 C/ 10 Unid.,"R$ 4,19",Bazar-E-Utilidades
Odorizante Para Automóvel Breeze Cheirinho Card Secret,"R$ 4,19",Bazar-E-Utilidades
Taça Plasutil Água Glamour,"R$ 6,90",Bazar-E-Utilidades
Feltro Scotch Marrom Red P C/ 12 Unid.,"R$ 11,99",Bazar-E-Utilidades
Boneca Mattel Barbie Fantasy Sereia Basica,"R$ 14,90",Bazar-E-Utilidades
Assadeiras Tramontina Preto Diversos - Unidade,"R$ 10,29",Bazar-E-Utilidades
Caneca Vidro Ruvolo Spaten - 400ml,"R$ 79,90",Bazar-E-Utilidades
Conjunto Tramontina Panquequeira E Bistequeira - 2 Peças,"R$ 71,90",Bazar-E-Utilidades
Churrasqueira Elétrica Mondial Preto 2000w 127v,"R$ 49,90",Bazar-E-Utilidades
Frigideira Tramontina Wok Loreto Vermelha 28cm,"R$ 129,90",Bazar-E-Utilidades
Panquequeira Tramontina Cinza 22cm,"R$ 249,00",Bazar-E-Utilidades
Odorizante Luxcar Spray Auto Anti Tabaco 60ml,"R$ 89,90",Bazar-E-Utilidades
Odorizante Luxcar Gel New Fresh Nytro 60g,"R$ 59,90",Bazar-E-Utilidades
Chinelo Rider R1 Speed Unid.,"R$ 17,59",Bazar-E-Utilidades
Chinelo Ipanema Oásis Feminino Unid.,"R$ 11,85",Bazar-E-Utilidades
Chinelo Rider Street Unid.,"R$ 41,79",Bazar-E-Utilidades
"Frigideira Brinox Wok Garlic Vermelho 28cm 4,1l","R$ 24,99",Bazar-E-Utilidades
"Caçarola Brinox C/ Tampa Garlic Vermelho 24x11cm 4,3l Unid.","R$ 29,99",Bazar-E-Utilidades
"Tapioqueira Brinox Garlic Vermelha 22x2cm 0,45l Unid.","R$ 95,90",Bazar-E-Utilidades
Taça Ruvolo Gin Club Haste Vermelha 705ml,"R$ 139,90",Bazar-E-Utilidades
Vela Aniversário Junco Branca Número 5 Unid.,"R$ 51,90",Bazar-E-Utilidades
Vela Aniversário Junco Branca Número 6 Unid.,"R$ 22,90",Bazar-E-Utilidades
Faqueiro Tramontina Leme Inox Vermelho Com 20 Peças,"R$ 4,19",Bazar-E-Utilidades
Garfo De Mesa Tramontina Colher Inox Leme Azul - Unidade,"R$ 4,19",Bazar-E-Utilidades
Colher De Mesa Tramontina Inox Leme Azul - Unidade,"R$ 69,90",Bazar-E-Utilidades
Pilha Panasonic Palito Alcalina Aaa C/ 2 Unid.,"R$ 49,90",Bazar-E-Utilidades
Limpador Multiuso Proauto 200ml,"R$ 3,69",Bazar-E-Utilidades
Gancho Scotch Grande Unid.,"R$ 3,69",Bazar-E-Utilidades
Conjunto Tramontina De Frigideiras Turim - 2 Peças,"R$ 18,79",Bazar-E-Utilidades
Secador Mondial Golden Rose 2000w 127v,"R$ 19,90",Bazar-E-Utilidades
Lixeira Arqplast Click Label Inox Com Tampa 9 Litros - Unidade,"R$ 19,90",Bazar-E-Utilidades
Conjunto Brinox 3 Canecas Para Café/Cappuccino Pavillion 300ml,"R$ 73,90",Bazar-E-Utilidades
Corante Guarany Tingecor Marrom 40g,"R$ 189,90",Bazar-E-Utilidades
Pilha Panasonic Alcalina Aaa 3+1 C/ 4 Unid.,"R$ 32,90",Bazar-E-Utilidades
Chinelo Havaianas Top Logo Mania 2 Unid.,"R$ 39,90",Bazar-E-Utilidades
Faca Para Carne Tramontina Dynamic N.8,"R$ 5,99",Bazar-E-Utilidades
Bandeja Facilita & Pronto Alumínio 750ml,"R$ 23,49",Bazar-E-Utilidades
"Fervedor Brinox Garlic Vermelho 12x11,5cm 1,2l Unid.","R$ 65,90",Bazar-E-Utilidades
Taça Ruvolo Gin Club Haste Verde 705ml,"R$ 39,90",Bazar-E-Utilidades
Petisqueira Plástica Paramount Le Cheff Redonda Branca Com 5 Divisões,"R$ 22,90",Bazar-E-Utilidades
Petisqueira Plástica Paramount Le Cheff Redonda Preta Com 5 Divisões,"R$ 69,90",Bazar-E-Utilidades
Vela São Domingos Aromática Lavanda 160g,"R$ 29,90",Bazar-E-Utilidades
Chinelo Rider Street Infantil,"R$ 22,90",Bazar-E-Utilidades
Kit Coza Organizando Sua Pia Preto,"R$ 22,90",Bazar-E-Utilidades
Dispenser Coza Single Vermelho 500ml,"R$ 10,89",Bazar-E-Utilidades
"Pote Plástico Plásutil Flip 1,9l","R$ 41,90",Bazar-E-Utilidades
Óleo Motor Ipiranga F1 Master Sintético 5w30sn 1l,"R$ 129,90",Bazar-E-Utilidades
Caderneta Tilibra Espiral D+ Apontamento 1/16 60 Folhas,"R$ 26,90",Bazar-E-Utilidades
Pilha Duracell Alarme Mn21 C/ 2 Unid.,"R$ 28,90",Bazar-E-Utilidades
Chinelo Ipanema Turma Da Mônica Baby,"R$ 49,90",Bazar-E-Utilidades
Copo Descartavel Copomais Transparente 330ml C/ 50 Unid.,"R$ 2,99",Bazar-E-Utilidades
Pote Plástico Paramount Slim Branco - 630ml,"R$ 41,90",Bazar-E-Utilidades
"Travessa Paramount Retangular Com Friso Le Chef Branca 27,5x19x6cm","R$ 38,90",Bazar-E-Utilidades
Pote Plástico Paramount Hermético Lumini Quadrado 1 Litro,"R$ 7,79",Bazar-E-Utilidades
"Bowl Plástica Paramount Redonda Le Cheff Preta 23,5x14,5cm","R$ 26,90",Bazar-E-Utilidades
Bowl Plástica Paramount Coração Le Cheff Preta 26x22x7cm,"R$ 26,90",Bazar-E-Utilidades
"Carvão Vegetal Estrela De Fogo 2,5kg","R$ 32,90",Bazar-E-Utilidades
Bule Térmico Tramontina Exata Vermelho 1l,"R$ 23,90",Bazar-E-Utilidades
Odorizante Luxcar New Fresh Car Lavanda,"R$ 21,90",Bazar-E-Utilidades
Borracha Faber Castell Branca C/ Capa C/ 2 Unid.,"R$ 19,90",Bazar-E-Utilidades
Kit Lápis Bic Evolution Grafite Verde C/ 4 Unid.,"R$ 73,90",Bazar-E-Utilidades
Lapiseira Bic Shimmers 0.5 Grátis 1 Lápiseira C/ 3 Unid.,"R$ 12,99",Bazar-E-Utilidades
Chinelo Kl Calçados Solemar King Star Unidade,"R$ 9,99",Bazar-E-Utilidades
Caderno São Domingos Brochurão Pixel 80 Folhas,"R$ 6,19",Bazar-E-Utilidades
Frigideira Brinox Para 4 Ovos Vermelha 26x8cm,"R$ 13,90",Bazar-E-Utilidades
Ralador Mozcada Inox C/ Silicone 15cm Unid.,"R$ 34,99",Bazar-E-Utilidades
Chinelo Havaianas Aloha Mista Unid.,"R$ 18,90",Bazar-E-Utilidades
Caderneta Espiral Credeal Apontamentos 1/18 40 Folhas,"R$ 69,90",Bazar-E-Utilidades
Adubo Pet Garden Humus De Minhoca 3kg,"R$ 21,90",Bazar-E-Utilidades
"Caneta Faber Castell Esferográfica Trilux Azul, Preta E Vermelha C/ 3 Unid.","R$ 57,99",Bazar-E-Utilidades
Assa Rápido Wyda Cozinha 41x33cm C/ 10 Unid.,"R$ 1,45",Bazar-E-Utilidades
Assadeira Wyda Oval Descartável 7l,"R$ 8,19",Bazar-E-Utilidades
Porta Escova De Dentes Plasútil C/ Tampa,"R$ 5,99",Bazar-E-Utilidades
Garrafa Térmica Invicta Glt Pressão 1l Unid.,"R$ 11,99",Bazar-E-Utilidades
Jogo De Taça Nadir Sobremesa Paulista 220ml C/6 Unid.,"R$ 21,90",Bazar-E-Utilidades
Pote Plástico Plásutil Decorado Quadrado 580ml,"R$ 13,90",Bazar-E-Utilidades
"Corda Kimarc Para Bagageiro Elástica C/ 1,5m","R$ 60,99",Bazar-E-Utilidades
Jogo De Copo Nadir Long Drink Oca C/ 6 Unid. 300ml,"R$ 61,90",Bazar-E-Utilidades
"Assadeira De Vidro Nadir Redonda 2,4l","R$ 8,55",Bazar-E-Utilidades
Ducha Lorenzetti Futura Multi 127v 5500w,"R$ 6,99",Bazar-E-Utilidades
Ducha Lorenzetti Fashion Branca 127v 5500w,"R$ 33,90",Bazar-E-Utilidades
Resistência Lorenzetti Ultra 127v 5500w 4 Temperatura,"R$ 48,90",Bazar-E-Utilidades
Resistência Lorenzetti Ultra 220v 6800w 4 Temperatura,"R$ 159,90",Bazar-E-Utilidades
Resistência Lorenzetti Duo Shower 220v 7500w,"R$ 145,90",Bazar-E-Utilidades
Plug Adaptador Kimarc Iluminação 2p + Terra,"R$ 49,90",Bazar-E-Utilidades
Pino Chato Kimarc Perlex,"R$ 49,90",Bazar-E-Utilidades
Chinelo Ipanema Happy Unid.,"R$ 52,90",Bazar-E-Utilidades
Vela São Domingos Decorativa Fina C/ 3 Unid.,"R$ 15,99",Bazar-E-Utilidades
Massa Pra Polir Proauto Numero 2 500g,"R$ 9,99",Bazar-E-Utilidades
Taça De Água Nadir Barone 490ml,"R$ 29,90",Bazar-E-Utilidades
Saca Rolha Original Toscana Unid.,"R$ 10,90",Bazar-E-Utilidades
Escumadeira Original Cook N.32 Unid.,"R$ 38,90",Bazar-E-Utilidades
Pegador Para Frios Original Premium 18cm Unid.,"R$ 21,90",Bazar-E-Utilidades
Ralador Original 4 Faces N.8 Unid.,"R$ 24,90",Bazar-E-Utilidades
Pegador Para Massa Original Premium 29cm Unid.,"R$ 11,90",Bazar-E-Utilidades
Conjunto Pote Plasútil Pop P/M/G Quadrado 3 Peças Unid.,"R$ 12,90",Bazar-E-Utilidades
Engate Para Mangueira Kimarc Unid.,"R$ 29,90",Bazar-E-Utilidades
Vela De Aniversario Junco Emoji Apaixonado Unid.,"R$ 21,90",Bazar-E-Utilidades
Vela De Aniversário Interrogação Junco Ouro Glitter Unid.,"R$ 26,90",Bazar-E-Utilidades
Cesta Ligbrin Para Prendedor Multi Uso C/ Alça,"R$ 11,99",Bazar-E-Utilidades
Colher De Chá Tramontina Inox Leme Preto Unidade,"R$ 13,79",Bazar-E-Utilidades
Chinelo Havaianas Slim Organic Unid.,"R$ 9,89",Bazar-E-Utilidades
Panela Panelux Magnific C/ Tampa Grafite 18cm,"R$ 13,90",Bazar-E-Utilidades
Frigideira Panelux Francesa Cereja Premium 20 Aa,"R$ 2,99",Bazar-E-Utilidades
Conjunto De Assadeira De Vidro Nadir Sempre Retangular C/ 2 Unid.,"R$ 62,90",Bazar-E-Utilidades
Copo Plástico Plasútil Com Tampa - 500ml,"R$ 49,90",Bazar-E-Utilidades
Vela Aniversário Junco Live Collors C/ Gliter Azul Número 2 Unid.,"R$ 44,90",Bazar-E-Utilidades
Assadeira Panelux Magnific Antiaderente 27x18,"R$ 86,90",Bazar-E-Utilidades
Caderno Foroni Espiral Cliff 160 Folhas,"R$ 7,89",Bazar-E-Utilidades
Balão Junco Metalizado Dourado 40cm N.1,"R$ 9,99",Bazar-E-Utilidades
Balão Junco Metalizado Dourado 40cm N.5,"R$ 54,90",Bazar-E-Utilidades
Kit Ph/Cloro Hidroall Para Piscinas 160g,"R$ 23,90",Bazar-E-Utilidades
Cloro Hidroall Para Piscinas Penta 1k,"R$ 7,95",Bazar-E-Utilidades
Limpa Bordas Hidroall Para Piscinas 1l,"R$ 7,95",Bazar-E-Utilidades
Resistencia Lorenzetti Bella 4t 127v 5500w Unid.,"R$ 42,90",Bazar-E-Utilidades
Adubo Green Fix Orquídeas 150ml,"R$ 44,90",Bazar-E-Utilidades
Ralador Plasútil 4 Faces Unid.,"R$ 23,90",Bazar-E-Utilidades
Garrafa Térmica Invicta Firenze Preta 1l Unid.,"R$ 48,90",Bazar-E-Utilidades
Balão Junco Látex Liso Sortidos Número 65 C/ 10 Unid.,"R$ 12,90",Bazar-E-Utilidades
Jogo De Copo Nadir Long Drink Opera C/ 6 Unid. 360ml,"R$ 13,79",Bazar-E-Utilidades
Conjunto Tramontina Panelas Turim Com 5 Peças,"R$ 47,99",Bazar-E-Utilidades
Adesivo Silicone Brascola Brascoved 50g,"R$ 5,55",Bazar-E-Utilidades
Caixa Térmica Mor Azul Com Laranja 18 Litros - Unidade,"R$ 64,90",Bazar-E-Utilidades
Baralho Copag Jogo Uno C/ 114 Cartas Unid.,"R$ 219,90",Bazar-E-Utilidades
Óleo Motor Ipiranga Protection Moto 20w50 1l,"R$ 18,99",Bazar-E-Utilidades
Gancho Scotch Medio C/ 3 Unid.,"R$ 86,90",Bazar-E-Utilidades
Chinelo Havaianas Top Athletic,"R$ 33,90",Bazar-E-Utilidades
Inseticida Vitaplan Fumax Pronto Uso 500 Ml,"R$ 34,49",Bazar-E-Utilidades
Adubo Green Fix Foliar 120ml,"R$ 19,90",Bazar-E-Utilidades
Conjunto De Facas Tramontina Naturalle Inox 4 Pecas,"R$ 44,90",Bazar-E-Utilidades
Toalha Papel Elegante 19cm X21cm C/ 2 Unid. 50 Folhas Cada,"R$ 33,90",Bazar-E-Utilidades
Prato Para Bolo Ruvolo Bari Raso 32cm Vidro Unid.,"R$ 12,90",Bazar-E-Utilidades
Concha Tramontina Inox Preto Utilita Unid.,"R$ 79,90",Bazar-E-Utilidades
Espátula De Pizza Tramontina Utilita,"R$ 6,59",Bazar-E-Utilidades
Panela Brinox C/ Tampa Vermelho 18x98cm Ref 7001/357,"R$ 37,90",Bazar-E-Utilidades
Copo De Vidro Nadir Boteco Cerveja 200ml,"R$ 34,90",Bazar-E-Utilidades
Petisqueira Plástica Paramount Le Cheff Redonda Preta Com 4 Divisões,"R$ 34,90",Bazar-E-Utilidades
Escorredor Coza Louça Basic Vermelho,"R$ 79,90",Bazar-E-Utilidades
"Pote Plástico Plásutil Flip 1,1l","R$ 6,29",Bazar-E-Utilidades
Caneca Plástica Plásutil Decorada C/ Bico,"R$ 22,90",Bazar-E-Utilidades
Lava Tudo Plásutil C/ Alça,"R$ 74,90",Bazar-E-Utilidades
Caderno Tilibra Espiral Minnie 10 Matérias 160 Folhas,"R$ 28,90",Bazar-E-Utilidades
Brinquedo Doce Brinquedo Surpresa Fundo Do Mar 98g,"R$ 10,90",Bazar-E-Utilidades
Boneca Mattel Barbie Bailarina,"R$ 9,90",Bazar-E-Utilidades
Conjunto De Pote De Vidro Euro Redondo C/ Tampa Plastica Preto 3pcs,"R$ 48,90",Bazar-E-Utilidades
Jogo Copo Nadir Lights Long Drink C/ 6 Unid. 300ml,"R$ 13,29",Bazar-E-Utilidades
Pote Plastico Ligbrin Retangular 3 - Peças,"R$ 79,90",Bazar-E-Utilidades
Frigideira Brinox Wok Fun Cereja - 24cm,"R$ 29,90",Bazar-E-Utilidades
Odorizante Para Automóvel Proauto Breeze Future,"R$ 33,90",Bazar-E-Utilidades
Lixeira Paramount Com Pedal Classic - 10 Litros,"R$ 42,90",Bazar-E-Utilidades
Odorizante Luxcar New Fresh Car Ocean,"R$ 53,90",Bazar-E-Utilidades
Bule Térmico Tramontina Exata Preto 1l,"R$ 11,99",Bazar-E-Utilidades
Lápis De Cor Multi Color Ecolápis Com 24 Unidades,"R$ 42,90",Bazar-E-Utilidades
Lápis De Cor Faber Castell Caras & Cores 12+3cores,"R$ 12,99",Bazar-E-Utilidades
Lapis De Cor Faber Castell Unicórnio 12+2cores,"R$ 73,90",Bazar-E-Utilidades
Chinelo Kl Calçados Rdk Chinelão Unidade,"R$ 22,69",Bazar-E-Utilidades
Kit Escolar Molin Love Poá C/5 Unid.,"R$ 23,90",Bazar-E-Utilidades
Caderno São Domingos Brochurão My Friends 80 Folhas,"R$ 23,90",Bazar-E-Utilidades
Forma Plástica Oikos Para Gelo Fundo De Silicone Unidade,"R$ 39,99",Bazar-E-Utilidades
Sacola Ecologica Cá Pra Lá Retornavel Para Vinho,"R$ 24,90",Bazar-E-Utilidades
Copo Descartável Altacoppo Branco 80ml C/ 100 Unid.,"R$ 19,90",Bazar-E-Utilidades
Lava Autos 300ml + Limpa Pneu 300ml + Limpa Vidro 100ml Proauto Unid.,"R$ 29,90",Bazar-E-Utilidades
Caderno Foroni Espiral Divertidamente 80 Folhas,"R$ 13,90",Bazar-E-Utilidades
"Folha De Alumínio Wyda 45x7,5mt Unid.","R$ 7,99",Bazar-E-Utilidades
Bandeja Facilita & Pronto Alumínio 500ml,"R$ 26,99",Bazar-E-Utilidades
Pilha Panasonic Pequena Alcalina Aa C/ 2 Unid.,"R$ 44,99",Bazar-E-Utilidades
Borracha Escolar Bic Branca C/ Capa Plastica Laranja C/ 2 Unid.,"R$ 13,99",Bazar-E-Utilidades
Limpa Pneus Proauto Autocraft 500ml,"R$ 18,99",Bazar-E-Utilidades
Assa Rápido Wyda Churrasco 45x5m Unid.,"R$ 16,90",Bazar-E-Utilidades
Espeto Mor Duplo 55cm Unid.,"R$ 6,99",Bazar-E-Utilidades
Ducha Lorenzetti Futura Multi 220v 7500w,"R$ 12,99",Bazar-E-Utilidades
Pino Soquete Kimarc Radial,"R$ 14,79",Bazar-E-Utilidades
"Bucha Kimarc Número 6 C/ 5 Unid. + 5 Parafusos 3,8x40","R$ 12,49",Bazar-E-Utilidades
Cola Para Contato Fort Adesivo Kimarc 30g,"R$ 159,90",Bazar-E-Utilidades
Torneira Plástica Para Jardim Kimarc 3/4 Pop Unidade,"R$ 9,99",Bazar-E-Utilidades
Retrozes Kimarc Branco/Preto C/ 2 Unid.,"R$ 4,99",Bazar-E-Utilidades
Espelho Kimarc Número 14 Unid.,"R$ 17,99",Bazar-E-Utilidades
Ralo Para Pia Kimarc Telinha Inox Unid.,"R$ 9,99",Bazar-E-Utilidades
Ducha Lorenzetti Bello C/ Cano 127v 5500w,"R$ 7,99",Bazar-E-Utilidades
Espátula Original Reta Premium N.4 Unid.,"R$ 9,99",Bazar-E-Utilidades
Vela De Aniversário Junco Ouro Glitter Número 4 Unid.,"R$ 6,99",Bazar-E-Utilidades
Vela De Aniversário Junco Ouro Glitter Número 5 Unid.,"R$ 109,90",Bazar-E-Utilidades
Vela De Aniversário Interrogação Junco Vermelha Glitter Unid.,"R$ 25,90",Bazar-E-Utilidades
Vela De Aniversário Junco Vermelha Glitter Número 7 Unid.,"R$ 9,89",Bazar-E-Utilidades
Vela De Aniversário Junco Vermelha Glitter Número 8 Unid.,"R$ 9,89",Bazar-E-Utilidades
Garfo De Mesa Tramontina Inox Leme Preta Unid.,"R$ 9,89",Bazar-E-Utilidades
Chinelo Havaianas Slim Pets Unid.,"R$ 9,89",Bazar-E-Utilidades
Conjunto Porta Mantimento Jaguar C/ Tampa De Rosca 5 Peças,"R$ 9,89",Bazar-E-Utilidades
Conjunto Pote Jaguar Organiza Redondo 3 Peças,"R$ 3,69",Bazar-E-Utilidades
"Assadeira Nadir Seletta Retangular Media Vidro 2,7l","R$ 62,90",Bazar-E-Utilidades
Copo Descartavel Facilita Pronto Cristal 300ml C/ 50 Unid.,"R$ 56,90",Bazar-E-Utilidades
Faca Descartavel Facilita Pronto Master Cristal C/ 50 Unid.,"R$ 14,29",Bazar-E-Utilidades
Copo Plástico Plasútil C/ Tampa C/ Bico 320ml,"R$ 49,90",Bazar-E-Utilidades
"Prato Laminado Junco Prata Número 07 35,5cm","R$ 18,99",Bazar-E-Utilidades
Vela Aniversário Junco Live Collors C/ Gliter Azul Número 4 Unid.,"R$ 12,29",Bazar-E-Utilidades
Assadeira Panelux Magnific Antiaderente 33x22,"R$ 7,89",Bazar-E-Utilidades
Caderno Espiral Minnie Mouse 10 Matérias Tilibra 160 Folhas,"R$ 7,99",Bazar-E-Utilidades
Caderno Espiral 4 Elementos Foroni 80 Folhas,"R$ 9,99",Bazar-E-Utilidades
Caderno Tilibra Espiral It! 80 Folhas,"R$ 69,90",Bazar-E-Utilidades
Caderno Tilibra Espiral Avengers 10 Matérias 160 Folhas,"R$ 59,90",Bazar-E-Utilidades
Caneta Faber Castell Marca Texto Amarela,"R$ 13,90",Bazar-E-Utilidades
Shakeira Coza Nutri Preta 500ml,"R$ 29,90",Bazar-E-Utilidades
Balão Junco Metalizado Dourado 40cm N.6,"R$ 65,90",Bazar-E-Utilidades
Balão Junco Metalizado Dourado 40cm N.4,"R$ 6,69",Bazar-E-Utilidades
Balão Junco Metalizado Dourado 40cm N.3,"R$ 23,99",Bazar-E-Utilidades
Filme Poliester Facilita Pronto 60x100 C/ 4 Unid.,"R$ 7,95",Bazar-E-Utilidades
Brinquedo Amoeba Cores Sortidas 110g,"R$ 7,95",Bazar-E-Utilidades
"Prato Laminado Junco Prata Número 06 31,5cm","R$ 7,95",Bazar-E-Utilidades
Colher De Mesa Tramontina Inox Leme Vermelha Unid.,"R$ 9,99",Bazar-E-Utilidades
Copo De Vidro Nadir Americano Long Drink 450ml,"R$ 12,90",Bazar-E-Utilidades
Vela Aniversário Junco Palito Branca C/ 20 Unid.,"R$ 6,39",Bazar-E-Utilidades
Porta Condimentos Plasútil De 7 Peças,"R$ 3,69",Bazar-E-Utilidades
"Pote Plástico Plasútil Trava+ Retangular Cristal 1,1l","R$ 9,49",Bazar-E-Utilidades
Chinelo Havaianas Top Nautical Unid.,"R$ 8,99",Bazar-E-Utilidades
Tigela Vidro Nadir Americano C/ Tampa 600ml,"R$ 42,90",Bazar-E-Utilidades
Gancho Scotch P C/ 5 Unid.,"R$ 37,90",Bazar-E-Utilidades
Fita Adesiva Scotch Corta Fácil 45mmx40m,"R$ 69,90",Bazar-E-Utilidades
Estopa Proauto Para Polimento Pacote 200g,"R$ 15,99",Bazar-E-Utilidades
"Panela De Pressão Tramontina Vancouver Effect 4,5 Litros","R$ 19,90",Bazar-E-Utilidades
Conjunto Tramontina Facas Inox Cabo Preto - 4 Peças,"R$ 16,90",Bazar-E-Utilidades
Frigideira Tramontina Turim Vermelha 24cm,"R$ 9,90",Bazar-E-Utilidades
"Assadeira Nadir Retangular Pequena 1,6litros Unid.","R$ 299,90",Bazar-E-Utilidades
Plug Adaptador 2p + T Kimarc - 3 Unidades,"R$ 39,90",Bazar-E-Utilidades
Kit Para Irrigação Kimarc Unid.,"R$ 59,90",Bazar-E-Utilidades
Caneca Para Chopp E Cerveja Haus Concept De Vidro Pavillion 350ml,"R$ 46,90",Bazar-E-Utilidades
Tábua De Bamboo Infinite Retangular Grande 34x24cm,"R$ 16,99",Bazar-E-Utilidades
Escumadeira Tramontina Inox Preto Utilita Unid.,"R$ 28,90",Bazar-E-Utilidades
Boneca Mattel Polly Básica Sortida,"R$ 19,90",Bazar-E-Utilidades
"Frigideira Brinox Wok Garlic Vermelho 24cm 2,3l","R$ 44,90",Bazar-E-Utilidades
"Mixer Original Line Premium 21,5cm","R$ 34,90",Bazar-E-Utilidades
Faca Descartável Strawplast Extra Forte Churrasco Branco C/ 20 Unid.,"R$ 32,90",Bazar-E-Utilidades
Caderno Tilibra Espiral Para Desenho D+ Universitário 48 Folhas,"R$ 49,90",Bazar-E-Utilidades
Caderno Tilibra Espiral Avengers Light 1 Matéria 80 Folhas,"R$ 15,99",Bazar-E-Utilidades
Frigideira Tramontina Turim Vermelha 22cm,"R$ 13,90",Bazar-E-Utilidades
Frigideira Brinox Fun Cereja - 16cm,"R$ 9,75",Bazar-E-Utilidades
Kit Estojo E Saboneteira Plasutil Multiuso - Unidade,"R$ 32,90",Bazar-E-Utilidades
