Título,Preço,Departamento
Gel Adesivo Pato Citrus Aplicador + Refil 38g,"R$ 18,89",Limpeza
Odorizante Bom Ar Refil Automático Lavanda C/ 50% De Desconto Na Segunda Unid. 250ml,"R$ 46,90",Limpeza
Limpador Perfumado Uau Perfumes Lavanda E Conforto 20% Desconto 2l,"R$ 15,49",Limpeza
Inseticida Sbp Aerossol Multi Eucalipto Leve 450ml Pague 300ml,"R$ 24,39",Limpeza
Limpa Forno Diabo Verde Sem Soda Cáustica Spray 300ml,"R$ 22,99",Limpeza
Limpador Diluído Veja Limpeza Pesada Original 1l,"R$ 22,99",Limpeza
Escova Bettanin Betta Jeans,"R$ 15,29",Limpeza
Desinfetante Ypê Pinho Lavanda 500ml,"R$ 6,45",Limpeza
Odorizador Glade Aerossol Energia Floral 360ml,"R$ 22,49",Limpeza
Rodo Melare Plástico 40cm,"R$ 14,99",Limpeza
Removedor Tupi Lavanda 500ml,"R$ 14,99",Limpeza
Detergente Concentrado Ypê Antibac 416g,"R$ 8,99",Limpeza
Desinfetante Pinho Sol Para Uso Geral Original Frasco Leve 500ml Pague 450ml,"R$ 8,99",Limpeza
Querosene Bufalo Jasmim 500ml,"R$ 21,99",Limpeza
Limpador Sanitário Pato Limpeza Profunda Game Das Frutas Edição Limitada 750ml,"R$ 16,59",Limpeza
Tira Limo Mr. Músculo C/ Cloro Gatilho 30% De Desconto 500ml,"R$ 21,99",Limpeza
Removedor Bufalo Tradicional 500ml,"R$ 19,89",Limpeza
Limpador Perfumado Casa & Perfume Sensazione - 1l,"R$ 10,99",Limpeza
Naftalina Lipex - 25g,"R$ 3,99",Limpeza
Limpa Vidros Veja Vidrex Cristal Refil 500ml,"R$ 21,59",Limpeza
Luva Limppano Wish Multiuso P Unid.,"R$ 10,90",Limpeza
Difusor Aromas Glade Aura Fresh 100ml,"R$ 23,90",Limpeza
Limpador De Piso Duratto Concentrado Vinílico Neutro 1l,"R$ 18,99",Limpeza
Alvejante Com Cloro Candura Lavanda 1l,"R$ 3,89",Limpeza
Amaciante De Roupa Urca Brisa Azul 2l,"R$ 8,49",Limpeza
Desinfetante Ypê Bak Lavanda 500ml,"R$ 4,69",Limpeza
Querosene Bufalo Tradicional 500ml,"R$ 21,99",Limpeza
Limpador Sanitário Harpic Power Plus - 500ml,"R$ 13,99",Limpeza
Limpador Diluível Uso Direto Floral 900ml,"R$ 13,99",Limpeza
Odorizante Glade Gel Toque De Maciez 70g,"R$ 9,49",Limpeza
Desinfetante Ypê Bak Floral 1l,"R$ 6,99",Limpeza
Limpador Perfumado Ajax Detergente De Uso Geral Bouquet De Flores Festas Das Flores Frasco 500ml,"R$ 6,99",Limpeza
Desinfetante Urca Floral 2l,"R$ 6,99",Limpeza
Inseticida Raid Aerossol Multi- Insetos Oleo De Plantas Essêncial Frasco 420ml Spray,"R$ 20,90",Limpeza
Escova Condor Lava Condor,"R$ 13,90",Limpeza
Desumidificador Secar Original Natural 180gr,"R$ 10,35",Limpeza
Luva Scotch Brite Multiuso M Unid.,"R$ 23,90",Limpeza
Inseticida Raid Aparelho Elétrico + Refil Líquido 45 Noites Á Base De Plantas Unid.,"R$ 22,90",Limpeza
"Tira-Manchas Vanish Gel Multiuso Sem Cloro 1,5l","R$ 40,99",Limpeza
"Tira-Manchas Vanish Gel Crystal White Mutliuso Sem Cloro 1,5l","R$ 40,99",Limpeza
"Lava Roupas Em Pó Tixan Ypê Maciez 1,6kg","R$ 19,99",Limpeza
Esponja Scotch-Brite Não Risca Banheiro C/ 3 Unid.,"R$ 9,19",Limpeza
Lava Roupas Líquido Omo Concentrado Lavagem Perfeita 500ml + Garrafa Para Diluir,"R$ 48,90",Limpeza
Difusor De Aromas Secar Bamboo Fresh 100ml,"R$ 19,99",Limpeza
Amaciante De Roupa Concentrado Ypê Liberdade 1l,"R$ 17,90",Limpeza
Limpador Perfumado Ypê Amor De Verão 1l,"R$ 9,99",Limpeza
Limpador Perfumado Veja Perfumes Lavanda Da França - 1l,"R$ 9,99",Limpeza
Amaciante De Roupa Baby Soft Toque Maciez 2l,"R$ 10,69",Limpeza
Odorizante Bom Ar Aerossol Fragrâncias Embalagem Econômica - 360ml,"R$ 19,59",Limpeza
"Amaciante De Roupa Concentrado Baby Soft Pureza E Delicadeza 1,5l","R$ 19,99",Limpeza
Limpador Pinho Sol Limpeza Pesada Eucalipto 1l,"R$ 19,49",Limpeza
Limpador Perfumado Casa & Perfume Bela Flore 500ml,"R$ 4,99",Limpeza
Desinfetante Ypê Pinho Citrus 500ml,"R$ 6,45",Limpeza
Limpa Forno Diabo Verde 250g,"R$ 12,90",Limpeza
Lava Louças Minuano Maçã 500ml,"R$ 2,99",Limpeza
Limp Piso Duratto Porcelanato Lavanda 1l,"R$ 16,49",Limpeza
Desinfetante Vim Cloro Gel Original Leve 700ml Pague 490ml,"R$ 10,49",Limpeza
Odorizante Bom Ar Aerossol Lavanda Embalagem Econômica 360ml,"R$ 19,59",Limpeza
Tira Vmanchas Em Pó Tixan Ypê Roupas Brancas E Coloridas Sachê 420g,"R$ 18,99",Limpeza
Vassoura Condor Uso Externo V-52,"R$ 37,90",Limpeza
Desentupidor Líquido Diabo Verde 1l,"R$ 37,90",Limpeza
Difusor De Aromas Glade Frescor De Águas Florais 100ml,"R$ 23,90",Limpeza
Amaciante De Roupa Concentrado Downy Frescor Da Primavera 1l,"R$ 29,99",Limpeza
Cera Poliflor Brilho Pratico Incolor 750ml,"R$ 18,89",Limpeza
Limpa Piso E Azulejo Melare Double Face 30cm,"R$ 18,85",Limpeza
Desinfetante Ypê Bak Eucalipto 500ml,"R$ 4,69",Limpeza
Limpador Perfumado Barbarex Sefe Ocean 1l,"R$ 7,49",Limpeza
Vassoura Melare Canto Flex Unid.,"R$ 12,90",Limpeza
Lava Roupas Líquido Tixan Ypê Maciez Refil 900ml,"R$ 11,99",Limpeza
Limpador Multi Uso Barbarex Ervas 500ml,"R$ 3,59",Limpeza
Álcool Em Gel Tupi Acendedor 80 Graus 425g,"R$ 11,89",Limpeza
Lustra Moveis Peroba Jasmim Leve 500ml Pague 450ml,"R$ 17,79",Limpeza
Amaciante Concentrado Comfort Brisa Elegante 500ml,"Compre online R$ 11,38",Limpeza
Limpador Perfumado Uau Perfumes Brisa & Frescor 20% Desconto 1l,"R$ 7,19",Limpeza
Limpador De Piso Destac Flores Do Campo E Lavanda 20% De Desconto 750ml,"R$ 15,99",Limpeza
Tira-Manchas Vanish Gel Crystal White Multiuso Sem Cloro 500ml,"R$ 17,55",Limpeza
Limpador Sanitário Harpic Power Plus 200ml,"R$ 6,99",Limpeza
Limpador Sanitário Harpic Cloro Forte 200ml,"R$ 6,99",Limpeza
Vassoura Noviça Varry 1000 Unid.,"R$ 34,90",Limpeza
Limpador Desengordurante Veja Cozinha Lavanda Gatilho 30% De Desconto 500ml,"R$ 17,43",Limpeza
Limpador Multi Uso Veja Original 500ml,"R$ 7,99",Limpeza
Amaciante Ypê Tradicional Aconchego 500ml,"R$ 3,49",Limpeza
Limpador Multiúso Uau Inox Limpa E Brilha Squeeze 500ml,"R$ 4,89",Limpeza
"Desinfetante Pinho Sol 2 X Poder 1,75l","R$ 16,99",Limpeza
Lava-Louças Em Pó Máquina Finish Advance Power Powder Pote - 450g,"R$ 33,90",Limpeza
Odorizante Glade Aparelho Automático + Refil Lembranças De Infância 269ml,"R$ 58,90",Limpeza
Amaciante Concentrado Ypê Delicado 900ml,"R$ 15,90",Limpeza
Limpador Desengordurante Mr. Músculo Cozinha Limão Gatilho 30% De Desconto 500ml,"R$ 17,90",Limpeza
Limpador Perfumado Casa & Perfume Amable 1l,"R$ 10,99",Limpeza
Desinfetante Pinho Bril Silvestre 1l,"R$ 10,99",Limpeza
Odorizador Glade Refil Automático Frescor De Aguas Florais Oferta Especial 269ml,"R$ 32,90",Limpeza
Odorizante Glade Refil Automatic Lavanda E Vanilla Oferta Especial 269ml,"R$ 32,90",Limpeza
Odorizante Glade Refil Automatic Frutas E Flores Vibrantes Oferta Especial 269ml,"R$ 32,90",Limpeza
Tira Limo Veja X14 Cloro Ativo 50% De Desconto 500ml,"R$ 32,85",Limpeza
Alvejante Sem Cloro Barbarex 1l,"R$ 6,29",Limpeza
Limpador Multi Uso Barbarex Tradicional 500ml,"R$ 3,59",Limpeza
Sabão Em Barra Minuano Coco C/ 5 Unid. 500g,"R$ 15,99",Limpeza
Detergente Ypê Gel Concentrado Clear 416g,"R$ 7,99",Limpeza
Lava-Louças De Máquina Finish Powerball C/ 10 Tabletes 125g,"R$ 31,90",Limpeza
Amaciante De Roupa Concentrado Downy Sensitive - 450ml,"R$ 15,69",Limpeza
Rolo Adesivo Flash Limp 30 Folhas Refil,"R$ 7,90",Limpeza
Esponja Ypê Multiuso Leve 4 Pague 3,"R$ 7,99",Limpeza
Amaciante De Roupa Vida Macia Glicerina & Erva Doce 500ml,"R$ 7,99",Limpeza
Limpador Sanitário Mr Musculo Sem Cloro C/ 30% De Desconto Sachê 400ml,"R$ 11,99",Limpeza
Limpa Vidros Veja Vidrex C/ Álcool Squeeze 20% De Desconto 500ml,"R$ 10,89",Limpeza
Lava Roupas Líquido Uau Rosas E Sedução 3l,"R$ 29,99",Limpeza
Alcool Asseptgel Zerobac Lavanda 46 Graus 1l,"R$ 14,99",Limpeza
Rodo Melare Plástico 30cm,"R$ 9,99",Limpeza
Limpador Perfumado Veja Perfumes Flores Do Mediterrâneo Leve + Pague - 1l,"R$ 9,99",Limpeza
Limpador Perfumado Veja Perfumes Flores Do Mediterrâneo Menor Desembolso 500ml,"R$ 5,99",Limpeza
Inseticida Sbp Elétrico Refil Pastilha 12h Leve 12 Pague 10 Unid.,"R$ 9,89",Limpeza
"Sanitizante Em Pó Omo Lavagem Perfeita 1,6kg","R$ 27,99",Limpeza
Limpador Diluído Ajax Fresh 20% De Desconto 800ml,"R$ 16,55",Limpeza
Álcool Duratto Bactericida Desinfetante Lavanda 1l,"R$ 7,19",Limpeza
"Amaciante Concentrado Ypê Liberdade 1,5l","R$ 28,39",Limpeza
"Amaciante Concentrado Ypê Blue 1,5l","R$ 28,39",Limpeza
Desinfetante Lysoform Fragrâncias 1l,"R$ 20,99",Limpeza
Limpador De Piso Bravo Laminado Sachê Embalagem Econômica 400ml,"R$ 13,99",Limpeza
Querosene Tupi Tradicional 500ml,"R$ 13,99",Limpeza
Limpador Desengordurante Veja Powerr Gel Limão Squeeze 500ml,"R$ 13,99",Limpeza
Limpador Perfumado Ajax Flers Lavanda 500ml,"R$ 6,99",Limpeza
Pá De Lixo Noviça Plastica Com Cabo,"R$ 27,90",Limpeza
Bloco Higiênico Pato Caixa Acoplada Pinho 50% De Desconto 40g C/ 2 Unid.,"R$ 26,68",Limpeza
Sabão Líquido Omo Roupas Finas E Delicadas Bebê 450ml,"R$ 14,29",Limpeza
Pedra Sanit Harpic Lavanda E Bem Estar Super Econômico 20g,"R$ 3,89",Limpeza
Saco Alvejado Para Limpeza Fortilimp 34x65xm,"R$ 8,99",Limpeza
Desinfetante Cif Multiuso + Antibac 500ml,"R$ 8,99",Limpeza
Limpador Perfumado Uau Perfumes Lavanda E Conforto 1l,"R$ 8,99",Limpeza
Desinfetante Lysol Aerossol Pureza Do Algodão 360ml,"R$ 26,90",Limpeza
Odorizante Glade Refil Toque Frescor Lembrança De Infância Leve 3 Pague 2 12ml,"R$ 27,90",Limpeza
Tira Limo Veja X14 C/ Cloro Gatilho 500ml,"R$ 26,90",Limpeza
Escova Brilhus Tanque Oval Unid.,"R$ 8,90",Limpeza
Lava-Roupas Em Pó Brilhante Delicadeza Total - 800g,"R$ 14,90",Limpeza
Pedra Sanitária Pato Marine 25% De Desconto 25g,"R$ 4,79",Limpeza
Limpador Perfumado Casa & Perfume Amable 500ml,"R$ 4,99",Limpeza
Limpador Multiuso Coperalcool Segredos Da Natureza Lavanda Gatilho,"R$ 13,99",Limpeza
Cera Poliflor Brilho Max Incolor Refil 500ml,"R$ 12,99",Limpeza
Odorizante Glade Aparelho Toque De Frescor Lembranças De Infância 12ml,"R$ 27,85",Limpeza
Limpador De Pedras Duratto 1l,"R$ 19,99",Limpeza
"Lava Roupa Em Pó Brilhante Higiêne Total Antibac Ativo Concentrado - 1,6kg","R$ 27,59",Limpeza
Lava Roupas Líquido Coquel Coco 500ml,"R$ 12,49",Limpeza
Odorizador Bom Ar Refil Click Spray Lavanda Leve 3 Pague 2 12ml,"R$ 24,98",Limpeza
Limpador Desengordurante Veja Cozinha Limão Gatilho 500ml,"R$ 24,90",Limpeza
Rodo Melare Plastico 60cm,"R$ 23,99",Limpeza
Odorizante Bom Ar Aerossol Aroma Sense Alegria Embalagem Econômica - 360ml,"R$ 19,59",Limpeza
Removedor Bufalo Eucalipto 500ml,"R$ 19,89",Limpeza
Lava-Louças Cif Concentrado Erva Doce - 420ml,"R$ 7,99",Limpeza
Limpador Perfumado Veja Perfumes Jasmim Do Caribe 500ml Menor Desembolso,"R$ 5,99",Limpeza
Amaciante De Roupa Concentrado Downy Collection Místico - 450ml,"R$ 15,69",Limpeza
Esponja Ypê Multiuso 3 Unid.,"R$ 7,99",Limpeza
Bloco Higiênico Pato Caixa Acoplada Pinho Leve 3 Pague 2 40g,"R$ 34,90",Limpeza
Odorizador Bom Ar Refil Elétrico Lavanda E Gerânio 16ml,"R$ 22,99",Limpeza
Inseticida Baygon Aerossol Ultra Embalagem Econômica 360ml,"R$ 22,90",Limpeza
Limpador Desengordurante Uau Cozinha Limão Squeeze 500ml,"R$ 7,59",Limpeza
"Lava-Roupas Em Pó Brilhante Limpeza Total 1,6kg Grátis 150g","R$ 24,99",Limpeza
Esponja Multiuso Assolan Pertuto 1 Unid.,"R$ 1,19",Limpeza
Lava Roupas Líquido Ypê Power Act Refil 900ml,"R$ 11,29",Limpeza
Inseticida Mortein Aerossol Pro Ação Total Eucalipto 360ml,"R$ 17,89",Limpeza
Kit Multiuso Azulim Mais Perfumes Leve Mais Por Menos C/ 3 Unid.,"R$ 10,99",Limpeza
Limpador Desengordurante Veja Cozinha Laranja Sachê 400ml,"R$ 10,99",Limpeza
Limpador Sanitário Cif Sem Cloro Sachê 450ml,"R$ 12,69",Limpeza
Pano Multiuso Esfrebom Rolo Azul 20x30cm C/ 25 Unid.,"R$ 21,90",Limpeza
Lustra Móveis Destac Lavanda 200ml,"R$ 10,89",Limpeza
Inseticida Raid Elétrica Pastilha Eucalipto Leve 12 Pague 10 Unid.,"R$ 10,49",Limpeza
Desinfetante Ypê Bak Lavanda 1l,"R$ 6,99",Limpeza
Limpa Piso Duratto Porcelanato E Cerâmicas 750ml,"R$ 8,99",Limpeza
Vassoura Infantil Melare,"R$ 10,99",Limpeza
Desinfetante Pinho Sol 2 X Poder Suave 1l,"R$ 19,99",Limpeza
"Lava Roupas Em Pó Tixan Ypê Maciez Sachê 1,6kg","R$ 19,99",Limpeza
Odorizante Bom Ar Aerossol Frescor Do Campo Embalagem Econômica - 360ml,"R$ 19,59",Limpeza
"Amaciante De Roupa Concentrado Baby Soft Desejo Envolvente 1,5l","R$ 19,99",Limpeza
Desodorante Aromas Secar Alecrim - 100ml,"R$ 19,99",Limpeza
Tira-Manchas Omo Liquido Extra Poder Ultra Espuma 150ml,"R$ 19,99",Limpeza
Limpador Perfumado Ypê Tropical 1l,"R$ 9,99",Limpeza
Limpador Perfumado Casa & Perfume Sensazione 500ml,"R$ 4,99",Limpeza
Limpador Perfumado Casa & Perfume Agradable 500ml,"R$ 4,99",Limpeza
Amaciante De Roupas Concentrado Fofo Azul Tudão - 1 Litro,"R$ 21,99",Limpeza
Balde Jaguar Max 12l,"R$ 19,90",Limpeza
Pano Microfibra Infinit. Basic C/3 Unid.,"R$ 19,90",Limpeza
Escova Noviça Adaptador Unid.,"R$ 19,90",Limpeza
Odorizador Glade Aerossol Toque De Maciez 360ml,"R$ 19,89",Limpeza
Álcool Barbarex 46 Graus Inpm 1l,"R$ 9,89",Limpeza
"Álcool Em Gel Tupi Lavanda 46,2 Graus 500g","R$ 9,75",Limpeza
Pedra Sanit Harpic Bosque De Pinho Super Econômico 20g,"R$ 3,89",Limpeza
Limpador Diluído Ajax Fresh - 500ml,"R$ 8,59",Limpeza
Limpador Perfumado Ypê Jardim Secreto 500ml,"R$ 6,49",Limpeza
Tira Manchas Em Pó Tixan Ypê Roupas Brancas Sachê 420g,"R$ 18,99",Limpeza
Limpador Perfumado Ypê Azul Tropical 2l,"R$ 18,99",Limpeza
"Amaciante De Roupa Concentrado Baby Soft Carinho E Cuidado - 1,5l","R$ 19,99",Limpeza
Amaciante De Roupa Uau Concentrado Lavanda E Frescor 500ml,"R$ 9,49",Limpeza
Tira-Manchas Omo Em Pó Roupas Brancas Extra Poder Refil 380g,"R$ 25,90",Limpeza
Amaciante De Roupa Concentrado Downy Collection Místico - 900ml,"R$ 29,99",Limpeza
Álcool Duratto Limpador Uso Geral Capim Limão 1l,"R$ 6,29",Limpeza
Tira Limo Limpol De Cloro 4 Em 1 Squeeze 500ml,"R$ 9,29",Limpeza
Sabão Em Barra Ypê Multiativo 180g,"R$ 3,69",Limpeza
Limpador Ajax Fresh Lemon 1l,"R$ 20,69",Limpeza
Inseticida Sbp Elétrico Refil Líquido 45 Noites 35ml,"R$ 18,35",Limpeza
Amaciante Concentrado Ypê Blue 1l,"R$ 17,90",Limpeza
Desinfetante Mr Músculo Platinum Cozinha Laranja Sachê 400ml,"R$ 14,99",Limpeza
Limpador Multi Uso Veja Azul 750ml,"R$ 8,59",Limpeza
Limpador Perfumado Veja Perfumes Flores Do Mediterrâneo Embalagem Econômica 2l,"R$ 16,99",Limpeza
Espoja Brilhus Multiuso C/ 1 Unid.,"R$ 1,39",Limpeza
Cloro Líquido Barbarex 1l,"R$ 5,49",Limpeza
Limpador Cremoso Mr. Músculo Multi Uso Desinfetante 450ml,"R$ 16,39",Limpeza
Limpador Cremoso Mr. Músculo Multi Uso Lavanda 450ml,"R$ 16,39",Limpeza
Limpador Perfumado Casa & Perfume Intuizione 500ml,"R$ 4,99",Limpeza
Pano Multiuso Esfrebom Lavável Evolution Rolo C/ 52 Unid.,"R$ 16,29",Limpeza
Pano De Pia Fortlimp Limpeza Pesada Amarelo 38x40cm C/ 2 Unid.,"R$ 5,59",Limpeza
Limpa Carpetes E Estofados Duratto Gatilho 500ml,"R$ 15,99",Limpeza
Álcool Coperalcool Eucalipto 46 Graus Inpm 1l,"R$ 16,29",Limpeza
Limpador Sanitário Veja Branqueador Oxi Ativo Antibac Sem Cloro Squeeze 500ml,"R$ 15,99",Limpeza
Lava Roupas Liquido Tixan Ype Green 1l,"R$ 15,99",Limpeza
Saponáceo Em Pó Sapólio Radium Cloro 300g,"R$ 7,99",Limpeza
"Pano Multiuso Duramax Verde 20,1x21,5cm C/ 48 Unid.","R$ 18,89",Limpeza
Amaciante Concentrado Ypê Pink Refil 900ml,"R$ 15,90",Limpeza
Amaciante De Roupa Concentrado Downy Collection Adorável - 450ml,"R$ 15,69",Limpeza
Desinfetante Mr Músculo Platinum Cozinha Laranja Gatilho 500ml,"R$ 24,90",Limpeza
Pano Multiuso Fortlimp Azul 33x50cm,"R$ 7,89",Limpeza
Amaciante Ypê Tradicional Ternura 500ml,"R$ 3,49",Limpeza
Desinfetante Mr Músculo Platinum Sachê 400ml,"R$ 14,99",Limpeza
Limpador Perfumado Barbarex Sefe D'Amour 1l,"R$ 7,49",Limpeza
Pano De Pia Máximo Esfregão Estampado 30x30cm Unid.,"R$ 2,99",Limpeza
Pano Multiuso Scotch Brite Azul C/ 5 Unid.,"R$ 14,90",Limpeza
Sabão Em Barra Ypê Fresh 180g,"R$ 3,69",Limpeza
Amaciante De Roupa Barbarex Max 5l,"R$ 15,29",Limpeza
Escova Condor Sanitária,"R$ 14,39",Limpeza
Limpador Desengordurante Veja Cozinha Limão Squeeze 500ml,"R$ 14,39",Limpeza
Pastilha Adesiva Harpic 2x1 Pinho Com 5 Unidades,"R$ 15,99",Limpeza
Limpador Sanitário Harpic Cloro Forte 500ml,"R$ 13,99",Limpeza
Difusor De Aromas Glade Lavanda 100ml,"R$ 23,90",Limpeza
Luva Limppano Fina Multiuso M C/6 Unid.,"R$ 13,90",Limpeza
Esponja Scoth Brite Wave Salve Unhas C/ 1 Unid.,"R$ 4,59",Limpeza
Amaciante De Roupa Vida Macia Glicerina E Erva-Doce 1l,"R$ 13,79",Limpeza
Lava Roupas Em Pó Brilhante Cuidado Total 800g,"R$ 14,90",Limpeza
Limpador Sanitário Pato Limpeza Profunda Gel Lavanda 500ml,"R$ 13,19",Limpeza
Limpador Veja Limpeza Pesada Power Fusion Com Cloro E Detergente Eucalipto 500ml,"R$ 14,19",Limpeza
Limpador Perfumado Veja Lavanda Da França Menor Desembolso 500ml,"R$ 6,49",Limpeza
Limpador Sanitário Veja Lavanda Sem Cloro Squeeze,"R$ 12,79",Limpeza
Limpador Desengordurante Ajax Cozinha Squeeze - 500ml,"R$ 12,69",Limpeza
Tira Limo Azulim Gatilho 500ml,"R$ 12,65",Limpeza
Limpa Piso Uau Rosas E Sedução 750ml,"R$ 12,49",Limpeza
Limpa Piso Uau Madeiras 750ml,"R$ 12,49",Limpeza
Luva Esfrebom Para Cozinha Latex P Unid.,"R$ 12,45",Limpeza
Luva Esfrebom Multiuso Latex G Unid.,"R$ 11,90",Limpeza
Limpa Vidros Azulim 500ml,"R$ 5,69",Limpeza
Palha De Aço Brillo Mágica,"R$ 2,79",Limpeza
Desinfetante Lysoform Bruto 500 Ml,"R$ 12,49",Limpeza
Saco Alvejado Ferreira Sacaria Tipo 1 Unid.,"R$ 10,99",Limpeza
Limpa Vidros Cif Sachê 450ml,"R$ 13,99",Limpeza
Luva Limppano Wish Multiuso G,"R$ 10,90",Limpeza
Esponja Scotch Brite Limpeza Pesada C/ 1 Unid.,"R$ 3,49",Limpeza
Inseticida Raid Elétrica Pastilha Leve 12 Pague 10 Unid.,"R$ 10,49",Limpeza
Escova Condor Para Lavar,"R$ 5,19",Limpeza
Esponja Ypê Multiuso C/ 1 Unid.,"R$ 2,79",Limpeza
Limpador Perfumado Ypê Mistérios Da Natureza 1l,"R$ 9,99",Limpeza
Saco Alvejado Ferreira Sacaria Tipo 2 Unid.,"R$ 7,99",Limpeza
Limpador Multiuso Veja Jojo Marcante & Envolvente 500ml,"R$ 9,99",Limpeza
Limpador Perfumado Veja Perfumes Lírio Do Nilo 1l,"R$ 9,99",Limpeza
Pedra Sanitária Pato Pinho 25g,"R$ 4,99",Limpeza
Amaciante De Roupa Concentrado Comfort 36 Segredos - 500ml,"Compre online R$ 13,52",Limpeza
Pastilha Adesiva Pato Tropical Oferta Especial C/ 3 Unid.,"R$ 9,69",Limpeza
Amaciante Concentrado Ypê Delicado 500ml,"R$ 9,49",Limpeza
Amaciante De Roupa Uau Concentrado Flores E Sonhos 500ml,"R$ 9,49",Limpeza
Amaciante Concentrado Ypê Blue 500ml,"R$ 9,49",Limpeza
Pano Multiuso Ober Roxo Leve 7 Pague 5,"R$ 8,99",Limpeza
Amaciante De Roupas Concentrado Fofo Azul Tudão - 500ml,"R$ 10,99",Limpeza
Amaciante De Roupas Concentrado Fofo Amarelo Chamego - 500ml,"R$ 10,99",Limpeza
Desinfetante Uau Banheiro Sem Cloro 7 Em 1 Squeeze 500ml,"R$ 8,69",Limpeza
Pá De Lixo Melare Plástica De Cabo Curto Unid.,"R$ 8,59",Limpeza
Amaciante De Roupa Concentrado Ypê Blue Leve 500ml Pague 450ml,"R$ 8,53",Limpeza
Saponáceo Em Pó Sapólio Radium Lavanda 300g,"R$ 7,99",Limpeza
Pano Multi Uso Fortilimp Rosa 33x50cm,"R$ 7,89",Limpeza
Alvejante Ypê Flores Da Primavera 1l,"R$ 6,99",Limpeza
Limpador Multiuso Ypê Controle De Odor 10%Desconto 500ml,"R$ 4,13",Limpeza
Limpador Perfumado Limpol Frescor Do Oceano 500ml,"R$ 7,39",Limpeza
Sabão Em Pasta Dipol Brilho - 500g,"R$ 6,99",Limpeza
Limpador Perfumado Veja Perfumes Lírio Do Nilo - 500ml,"R$ 6,49",Limpeza
Limpador Multiuso Veja Laranja 10% De Desconto 500ml,"R$ 7,19",Limpeza
Limpador Perfumado Ypê Amor De Verão 500ml,"R$ 6,49",Limpeza
Limpador Perfumado Ypê Doce Vida 500ml,"R$ 6,49",Limpeza
Pano Esfregão Máximo Colorido Piso 40x67cm,"R$ 5,99",Limpeza
Pano Esfregão Fortlimp Jeans Piso 70x42 Unid.,"R$ 5,29",Limpeza
Inseticida Mortein Iscas Mata Ratos 15g,"R$ 4,99",Limpeza
Tira Manchas Vanish Po Oxi Action Roupas Coloridas Sachê 30g,"R$ 2,99",Limpeza
Esponja Esfrebom C/ 1 Unid.,"R$ 2,38",Limpeza
Pano Pia Fortilimp Esfregão Alvejado 30x30,"R$ 2,79",Limpeza
Sabão Em Barra Ypê Aloe Vera 900g,"R$ 15,99",Limpeza
Limpador Sanitário Veja Lavanda Sem Cloro Refil Econômico 400ml,"R$ 13,29",Limpeza
"Sabão Em Pó Omo Lavanda 1,6kg","R$ 28,99",Limpeza
Tira-Manchas Brilhante Em Pó Utile Floral Sachê 380g,"R$ 18,99",Limpeza
Limpador Perfumado Veja Perfumes Tulipa Da Holanda Embalagem Econômica 2l,"R$ 16,99",Limpeza
Amaciante De Roupa Concentrado Downy Brisa Suave Frasco - 500ml,"R$ 15,69",Limpeza
Odorizante Glade Aparelho Automático + Refil Lavanda E Vanila,"R$ 58,90",Limpeza
Desinfetante Lysoform Lavanda 500ml,"R$ 12,49",Limpeza
Pano Esfrebom Microfibra Alta Performace,"R$ 13,90",Limpeza
Limpador Multiuso Veja Jojo Moderna & Poderosa 500ml,"R$ 9,99",Limpeza
Cera Bravo Incolor 500ml,"R$ 7,99",Limpeza
Lava Louças Em Gel Limpol Concentrado Neutro 400g,"R$ 7,29",Limpeza
Limpador Multiuso Duratto Flash Mágico Flotador 500ml,"R$ 14,99",Limpeza
Limpador Multi Uso Veja Floral 500ml,"R$ 7,99",Limpeza
Odorizante Glade Aparelho Toque De Frescor Lavanda 12ml,"R$ 27,85",Limpeza
Rodo Condor Duplo 40cm,"R$ 47,90",Limpeza
"Amaciante De Roupa Concentrado Comfort 48 Segredos 1,5 Litro","R$ 38,79",Limpeza
Espalhador De Cera Brilhus Unid.,"R$ 42,90",Limpeza
Limpa Alumínio Limpol 500ml,"R$ 17,39",Limpeza
Removedor Tupi Tradicional 1l,"R$ 23,90",Limpeza
Desodorante Aromas Secar Sensual - 100ml,"R$ 19,99",Limpeza
Bloco Higiênico Harpic Fresh Power6 Lavanda 39g,"R$ 20,90",Limpeza
Odorizante Bom Ar Aparelho Automático + Refil Pure Toque De Algodão 250ml,"R$ 62,90",Limpeza
Limpador Perfumado Veja Perfumes Jasmim Do Caribe - 1l,"R$ 9,99",Limpeza
Esponja Esfrebom Multi Uso Diamond C/ 3 Unid.,"R$ 7,19",Limpeza
Limpador Perfumado Barbarex Eucalipto 120ml,"R$ 10,99",Limpeza
Cera Líquida Brilho Prático Incolor Bravo Embeleza Sachê Refil 500ml,"R$ 18,99",Limpeza
Escova Condor Multiuso,"R$ 13,39",Limpeza
"Lixeira Coza Single Wgr 2,5l","R$ 29,90",Limpeza
Mop Noviça Spray Fit,"R$ 89,90",Limpeza
Anil Colman Pedra 90g,"R$ 21,90",Limpeza
Anil Colman Líquido 200ml,"R$ 22,99",Limpeza
"Amaciante De Roupa Concentrado Downy Brisa Suave Frasco 1,5l","R$ 35,09",Limpeza
Limpador Perfumado Barbarex Sefe Inspiration 1l,"R$ 7,49",Limpeza
Limpador Desengordurante Ajax Cozinha Com 20% Desconto Squeeze 500ml,"R$ 10,15",Limpeza
Limpador Diluído Ajax Fresh Lemon - 500ml,"R$ 8,59",Limpeza
Álcool Zulu Com Bicarbonato Limpador Uso Geral Lavanda 1l,"R$ 9,89",Limpeza
Pano Multiuso Esfrebom Rolo Verde 20x30cm C/ 25 Unid.,"R$ 21,90",Limpeza
Odorizador Glade Refil Automático Energia Floral 269ml,"R$ 36,99",Limpeza
Limpador Cremoso Cif Multi Uso Limpeza Milagrosa Floral E Rosas Jasmim 450ml,"R$ 24,90",Limpeza
Difusor De Aromas Glade Relax Lavender 100ml,"R$ 29,90",Limpeza
Graxa Em Pasta Nugget Marrom 36g,"R$ 16,99",Limpeza
Limpa Grelhas E Chapas Duratto 500ml,"R$ 18,89",Limpeza
Inseticida Raid Refil 45 Noites 32ml,"R$ 19,59",Limpeza
Limpa Piso Bravo Especial Lâminado 750ml,"R$ 26,99",Limpeza
Desinfetante Azulim Zerobac Cristal 46 Graus 1l,"R$ 14,99",Limpeza
Pedra Sanitária Glade Sany Bouquet Lavanda 25g,"R$ 4,79",Limpeza
Desinfetante Lysoform Cloro Gel Original 500ml,"R$ 15,29",Limpeza
Limpeza Pesada Ypê Original 500ml,"R$ 7,49",Limpeza
Limpador Cremoso Mr. Músculo Multi Uso Lavanda 200ml,"R$ 8,99",Limpeza
Odorizante Glade Gel Citrus 70g,"R$ 9,49",Limpeza
Escova Noviça Multiuso Unid.,"R$ 13,90",Limpeza
Tira-Manchas Omo Em Pó Extra Poder Embalagem Econômica Refil 380g,"R$ 25,90",Limpeza
Limpador Diluído Veja Limpeza Pesada Lavanda 20% De Desconto 500ml,"R$ 10,39",Limpeza
Álcool Coperalcool Bacfree Lavanda Oriental Inpm 1l,"R$ 16,29",Limpeza
Tira Manchas Vanish Pó Oxi Advance Roupas Coloridas 390g,"R$ 37,99",Limpeza
Lava Roupas Líquido Ariel Cores Radiantes Toque Downy - 3l,"R$ 52,90",Limpeza
Lava Roupas Líquido Omo Roupas Intimas E Biquinis 300ml,"R$ 18,99",Limpeza
"Amaciante Concentrado Ypê Inspiração 1,5l","R$ 28,39",Limpeza
Desinfetante Lysoform Citrus 2l,"R$ 36,90",Limpeza
Inseticida Raid Aparelho Elétrico Unid. + 4 Pastilhas,"R$ 31,99",Limpeza
Inseticida Sbp Aerossol Citronela Embalagem Econômica 380ml,"R$ 21,90",Limpeza
Lava Louças Em Gel Limpol Concentrado Cristal 400g,"R$ 7,29",Limpeza
Odorizador Glade Spray Relax Lavender 265ml,"R$ 29,90",Limpeza
Difusor De Aromas Glade Fresh Flowers 100ml,"R$ 29,90",Limpeza
Limpador Perfumado Veja Aroma Sense Alegria - 1l,"R$ 14,39",Limpeza
Tira-Manchas Vanish Gel Multiuso Sem Cloro 3l,"R$ 73,90",Limpeza
Alvejante Ypê Flores Da Primavera 2l,"R$ 12,99",Limpeza
"Álcool Em Gel Tupi Eucalipto 46,2 Graus 500g","R$ 9,75",Limpeza
Gel Adesivo Pato Marine Tubo Aparelho C/ 1 Unid.,"R$ 24,90",Limpeza
Lava-Roupas Líquido 0a2 Infantil Baby 500ml,"R$ 12,85",Limpeza
Mop Zigzag Sekito Unid,"R$ 82,90",Limpeza
Mop Novica Twister Plástico 6l Unidade,"R$ 188,90",Limpeza
Pano Para Pia Scotch-Brite 40cm X 38cm 2 Unid.,"R$ 12,99",Limpeza
Esponja Scoth Brite Grill C/ 1 Unid.,"R$ 8,99",Limpeza
Amaciante De Roupa Concentrado Comfort Explosão Floral Perfumes Do Brasil - Refil 810ml,"R$ 21,39",Limpeza
Desinfetante Lysoform Suave Odor 2l,"R$ 36,90",Limpeza
Sabão Em Barra Ufe Coco Fl Pack 50x180g,"R$ 4,99",Limpeza
Desinfetante Pinho Sol Natural Essentials Lavanda E Melaleuca 1l,"R$ 18,39",Limpeza
Luva Limppano Tarefas Pesadas Multiuso P Unid.,"R$ 21,90",Limpeza
Rodo Brilhus Plástico 40cm Unid.,"R$ 33,90",Limpeza
"Limpador Diluído Ajax Fresh Leve Mais Por Menos 1,75l","R$ 26,85",Limpeza
Lava Louças Em Gel Limpol Concentrado Limão E Verbena 400g,"R$ 7,29",Limpeza
Lava Louças Em Gel Limpol Concentrado Uva E Orquídea 400g,"R$ 7,29",Limpeza
Desinfetante Vim Original Espuma Poderosa Sachê Refil Econômico 450ml,"R$ 13,99",Limpeza
Polidor Líquido Silvo 200ml,"R$ 37,90",Limpeza
Limpa Piso Bravo Especial Cerâmica 750ml,"R$ 21,99",Limpeza
Lava-Louças Em Pó Maquina Unik 1kg,"R$ 47,90",Limpeza
Álcool Sólido Reax Acende Fácil 170g,"R$ 12,99",Limpeza
Tira-Manchas Vanish Em Pó Roupas Coloridas Sem Cloro 450g,"R$ 33,99",Limpeza
"Amaciante De Roupa Concentrado Comfort 36 Segredos - 1,5 Litro","R$ 38,79",Limpeza
Amaciante Concentrado Ypê Green 1l,"R$ 21,00",Limpeza
Limpador Sanitário Veja Branqueador Oxi Ativo Antibac Sem Cloro Gatilho 500ml,"R$ 29,69",Limpeza
Limpador Perfumado Barbarex Floral 120ml,"R$ 10,99",Limpeza
Luva Limppano Fina Multiuso G C/6 Unid.,"R$ 13,90",Limpeza
Lava-Roupas Líquido Mon Bijou Coco 500ml,"R$ 14,65",Limpeza
