Título,Preço,Departamento
Queijo Fresco Sol Brilhante Forma Kg,"R$ 57,90",Frios-E-Laticínios
Queijo Vida Veg Minas Castanha De Caju 200g,"R$ 29,90",Frios-E-Laticínios
Salsicha Jumirim Vinagrete 280g,"R$ 16,99",Frios-E-Laticínios
Queijo Prato Polenghi Fatiado Sandwich-In 144g,"R$ 16,99",Frios-E-Laticínios
Linguiça Calabresa Frimesa Cozida Fatiada - 400g,"R$ 16,99",Frios-E-Laticínios
Petit Suisse Elegê Paw Patrol 320g,"R$ 8,49",Frios-E-Laticínios
Iogurte Desnatado Vigor Protein Morango - 230g,"R$ 11,29",Frios-E-Laticínios
Iogurte Desnatado Corpus Zero Lactose Vitamina De Frutas - 800g,"R$ 16,98",Frios-E-Laticínios
"Iogurte Integral Vigor Com Granola, Castanha E Amêndoa 140g","R$ 4,99",Frios-E-Laticínios
Iogurte Desnatado Verde Campo Whey Zero Lactose Cookies & Cream - 250g,"R$ 10,89",Frios-E-Laticínios
Margarina Original Sem Sal Ômega 6 Becel Pote 500g,"R$ 11,99",Frios-E-Laticínios
Salame Sadia De Pepperoni 100g,"R$ 15,99",Frios-E-Laticínios
Queijo Muçarela Tirolez Light Sem Lactose Kg,"R$ 109,90",Frios-E-Laticínios
Leite Fermentado Semi Desnatado Activia Pêssego Summer Edition 170g,"R$ 4,29",Frios-E-Laticínios
Leite Fermentado Semi Desnatado Activia Morango 170g,"R$ 4,29",Frios-E-Laticínios
Iogurte Semi Desnatado Frutap Salada De Frutas 160g,"R$ 2,59",Frios-E-Laticínios
Requeijão Scala Tradicional Copo 200g,"R$ 9,99",Frios-E-Laticínios
Iogurte Semi Desnatado Frutap Ameixa 850g,"R$ 11,19",Frios-E-Laticínios
Leite Fermentado Desnatado Elegê Bob Esponja Morango - 3 Unidades De 160g 480g,"R$ 7,69",Frios-E-Laticínios
Bacon Pamplona Manta Kg,"R$ 35,90",Frios-E-Laticínios
Queijo Mozzarella Atilatte Bola 250g,"R$ 24,90",Frios-E-Laticínios
Queijo Mussarela Tirolez Stick - 240g,"R$ 29,99",Frios-E-Laticínios
Queijo Prato Tirolez Light Zero Lactose 150g,"R$ 14,99",Frios-E-Laticínios
Requeijão Puranata Cheddar Bisnaga 400g,"R$ 9,99",Frios-E-Laticínios
Queijo Parmesão President Peça Kg,"R$ 99,90",Frios-E-Laticínios
Iogurte Integral Atilatte Café 170g,"R$ 4,99",Frios-E-Laticínios
Bebida Láctea Parmalat Wheyfit Abacate 250g,"R$ 8,19",Frios-E-Laticínios
Mortadela Seara Gourmet Defumada Bandeja Kg,"R$ 28,90",Frios-E-Laticínios
Bebida Láctea Lider Chocolate Tp 1l,"R$ 5,89",Frios-E-Laticínios
Queijo Brie President 125g,"R$ 28,98",Frios-E-Laticínios
Ricota Monteminas Fresca Kg,"R$ 28,90",Frios-E-Laticínios
Manteiga Davaca C/ Sal Pote 500g,"R$ 31,49",Frios-E-Laticínios
Iogurte Grego Nestlé Com Calda De Coco 90g,"R$ 3,49",Frios-E-Laticínios
Queijo Muçarela De Bufala Bom Destino Cunha Kg,"R$ 94,90",Frios-E-Laticínios
Queijo Fresco Valeza Light Kg,"R$ 37,90",Frios-E-Laticínios
Iogurte Grego Nestle Tradicional/Morango 540g,"R$ 15,29",Frios-E-Laticínios
Manteiga Président C/ Sal Pote 380g,"R$ 27,99",Frios-E-Laticínios
Carne Seca Friboi Dianteira Curada 500g,"R$ 27,99",Frios-E-Laticínios
Manteiga President Sem Sal 200g,"R$ 14,49",Frios-E-Laticínios
Presunto Cru Giovanni Ceratti Italiano Fatiado 80g,"R$ 26,99",Frios-E-Laticínios
Presunto Cru Giovanni Ceratti Fatiado - 80g,"R$ 26,99",Frios-E-Laticínios
Queijo Parmesão Scala 12 Meses Fracionado 180g,"R$ 26,99",Frios-E-Laticínios
Lombo Canadense Pamplona Defumado Fatiado 180g,"R$ 8,99",Frios-E-Laticínios
Margarina Vigor Tradicional Sem Sal 500g,"R$ 9,49",Frios-E-Laticínios
Creme De Ricota De Búfala Bom Destino 200g,"R$ 14,99",Frios-E-Laticínios
Queijo Minas Fresco Bandeira Bandeja Kg,"R$ 50,90",Frios-E-Laticínios
Margarina Cremosa Com Sal Doriana 250g,"R$ 4,39",Frios-E-Laticínios
Sobremesa Láctea Chandelle Duo Chocolate Brenco E Meio Amargo Com 2 Unid.180g,"R$ 6,59",Frios-E-Laticínios
Salame Ceratti Hamburguês Defumado Fatiado - 100g,"R$ 12,99",Frios-E-Laticínios
Bebida Láctea Italac Mix De Fruta 200ml,"R$ 1,99",Frios-E-Laticínios
Sobremesa Láctea Cremosa Chocolate Ao Leite Chandelle Bandeja C/ 4 Unid. 360g,"R$ 13,09",Frios-E-Laticínios
Salada Atum Gomes Da Costa C/ Batata Doce E Azeite 150g,"R$ 12,69",Frios-E-Laticínios
Iogurte Desnatado Molico Morango/Baunilha Sem Lactose 170g,"R$ 2,99",Frios-E-Laticínios
Queijo Coalho Quata Com Orégano 300g,"R$ 29,99",Frios-E-Laticínios
Queijo Muçarela De Bufala Levitare Cereja Zero Lactose - 150g,"R$ 24,90",Frios-E-Laticínios
Leite Fermentado Desnatado Frutap 170g,"R$ 3,09",Frios-E-Laticínios
Bebida Not Milkinho Soja Chocolate 200ml,"R$ 3,49",Frios-E-Laticínios
Linguiça De Frango Churrasco Seara 700g,"R$ 23,99",Frios-E-Laticínios
Linguiça Toscana Sadia Pacote 700g,"R$ 23,99",Frios-E-Laticínios
Requeijão Bandeira Bisnaga 250g,"R$ 13,95",Frios-E-Laticínios
Lombo Ceratti Canadense Fatiado 100g,"R$ 11,99",Frios-E-Laticínios
Petit Suisse Ninho Maxi Banana E Maca 240g,"R$ 7,99",Frios-E-Laticínios
Manteiga Aviação C/ Sal Tablete 100g,"R$ 7,99",Frios-E-Laticínios
Bebida Láctea Starbucks Frappuccino Caramelo 280ml,"R$ 9,99",Frios-E-Laticínios
Manteiga Galbani Extra Com Sal Pote 200g,"R$ 15,99",Frios-E-Laticínios
Leite Fermentado Semi Desnatado Actimel Morango 100g,"R$ 3,29",Frios-E-Laticínios
Peito De Frango Eder Defumado Peça Kg,"R$ 39,90",Frios-E-Laticínios
Iogurte Semi Desnatado Batavo Morango 170g,"R$ 2,79",Frios-E-Laticínios
Margarina Original Com Sal Ômega 6 Becel Pote 1kg,"R$ 20,90",Frios-E-Laticínios
Iogurte Desnatado Yopro Doce De Leite Zero Lactose 250g,"R$ 9,99",Frios-E-Laticínios
Bebida Lactea Parmalat Wheyfit Baunilha 250g,"R$ 8,19",Frios-E-Laticínios
Queijo Minas Frescal Sol Brilhante Menos Sódio Kg,"R$ 57,90",Frios-E-Laticínios
Presunto Cozido Sem Capa Perdigão Peça Kg,"R$ 28,90",Frios-E-Laticínios
Iogurte Integral Vigor Mel 150g,"R$ 2,89",Frios-E-Laticínios
Bacon Perdigão Manta Kg,"R$ 39,90",Frios-E-Laticínios
Cream Cheese Danúbio 150g,"R$ 11,99",Frios-E-Laticínios
Peito De Frango Hans Defumado Bandeja Kg,"R$ 41,90",Frios-E-Laticínios
Requeijão Soffice Cremoso Bisnaga 150g,"R$ 7,49",Frios-E-Laticínios
Iogurte Vida Veg Protein Morango Com Granola 230g,"R$ 11,99",Frios-E-Laticínios
Cream Cheese Scala Pote 300g,"R$ 21,99",Frios-E-Laticínios
Cream Cheese Scala Light Pote 300g,"R$ 21,99",Frios-E-Laticínios
Iogurte Desnatado Atilatte Ameixa/Cereais 500g,"R$ 11,90",Frios-E-Laticínios
Requeijão Scala Cremoso Bisnaga 400g,"R$ 21,90",Frios-E-Laticínios
Iogurte Integral Batavo Probio2 Morango 510g,"R$ 11,99",Frios-E-Laticínios
Cheddar Davaca Copo 200g,"R$ 10,89",Frios-E-Laticínios
Carne Seca Marba Jerked Beef Dianteiro 400g,"R$ 21,99",Frios-E-Laticínios
Sobremesa Láctea Chambinho Chocolate Bandeja 320g,"R$ 10,65",Frios-E-Laticínios
Mortadela Marba Tradicional Bandeja Kg,"R$ 18,89",Frios-E-Laticínios
Bebida Silk De Amêndoa 1l,"R$ 20,89",Frios-E-Laticínios
Iogurte Desnatado Yopro Açaí C/ Banana Zero Lactose Sqz 160g,"R$ 10,49",Frios-E-Laticínios
Iogurte Semi Desnatado Frutap Morango 850g,"R$ 11,19",Frios-E-Laticínios
Iogurte Semi Desnatado Frutap Açai Com Banana 850g,"R$ 11,19",Frios-E-Laticínios
Bebida Lactea Lider Choco Tp 200ml,"R$ 1,45",Frios-E-Laticínios
Linguiça Rossini De Lombo 400g,"R$ 19,99",Frios-E-Laticínios
Linguiça Rossini Apimentada 400g,"R$ 19,99",Frios-E-Laticínios
Creme De Queijo Tirolez Minas Frescal Original Pote 150g,"R$ 8,79",Frios-E-Laticínios
Iogurte Integral Batavo C/ Pedaços Pêssego 500g,"R$ 10,55",Frios-E-Laticínios
Iogurte Semi Desnatado Atilatte Skyr Maracujá Zero Lactose 160g,"R$ 9,99",Frios-E-Laticínios
Iogurte Vida Veg Protein Tradicional 160g,"R$ 9,99",Frios-E-Laticínios
Iogurte Semi Desnatado Atilatte Skyr Morango Zero Lactose 160g,"R$ 9,99",Frios-E-Laticínios
Cream Cheese Président Light 150g,"R$ 9,99",Frios-E-Laticínios
Coalhada Atilatte Natural Desnatado 500gr,"R$ 9,99",Frios-E-Laticínios
Margarina Qualy Tradicional Sem Sal 250g,"R$ 4,99",Frios-E-Laticínios
Embutido De Lombo Seara Levissimo Cozido Granel Kg,"R$ 29,90",Frios-E-Laticínios
Apresuntado Perdigão Bandeja Kg,"R$ 24,90",Frios-E-Laticínios
Apresuntado Sadia Peça Kg,"R$ 24,90",Frios-E-Laticínios
Leite Em Po Integral Itambé Sachê 200g,"R$ 10,09",Frios-E-Laticínios
Coalhada Atilatte Natural 170g,"R$ 5,59",Frios-E-Laticínios
Bebida Lactea Vigor Morango 510g,"R$ 6,39",Frios-E-Laticínios
Salame Pamplona Milano Fatiado 100g,"R$ 10,89",Frios-E-Laticínios
Iogurte Integral Danone Quaker Morango E Aveia 340g C/ 4 Unid. 85g,"R$ 9,49",Frios-E-Laticínios
Salsicha Hans Aperitivo - 200g,"R$ 18,49",Frios-E-Laticínios
Leite Fermentado Activia Shot Morango 100g,"R$ 3,69",Frios-E-Laticínios
Iogurte Semi Desnatado Frutap Coco 160g,"R$ 2,59",Frios-E-Laticínios
Linguiça Portuguesa Ceratti Pacote 300g,"R$ 17,99",Frios-E-Laticínios
Margarina Delícia Toque De Chef Pedaços De Alho E Cebola Com Sal 500g,"R$ 8,99",Frios-E-Laticínios
Queijo Ralado Faixa Azul 50g,"R$ 8,99",Frios-E-Laticínios
Petit Suisse Danoninho Ice Morango 70g,"R$ 4,49",Frios-E-Laticínios
Apresuntado Sadia Bandeja Kg,"R$ 29,90",Frios-E-Laticínios
Salsicha Viena Ceratti C/ Corante 200g,"R$ 18,49",Frios-E-Laticínios
Salsicha Viena Ceratti Sem Corante 200g,"R$ 18,49",Frios-E-Laticínios
Margarina Manteiga C/ Sal Vigor Pote 1kg Embalagem Econômica,"R$ 18,69",Frios-E-Laticínios
Requeijão Poços De Caldas Light 200g,"R$ 9,29",Frios-E-Laticínios
Queijo Gouda Tirolez Granel Kg,"R$ 124,90",Frios-E-Laticínios
Iogurte Semi Desnatado Chamyto Go Vitamina De Frutas 100g,"R$ 3,75",Frios-E-Laticínios
Iogurte Desnatado Verde Campo Lacfree Zero Lactose Morango 170g,"R$ 4,29",Frios-E-Laticínios
Queijo Mussarela Polenghi Fatiado Sandwich-In 144g,"R$ 16,99",Frios-E-Laticínios
"Requeijão Top Cheddar Bisnaga 1,2kg","R$ 16,99",Frios-E-Laticínios
Creme Para Chantilly Fleischmann 200ml,"R$ 8,49",Frios-E-Laticínios
Pé Suíno Bandeja Kg,"R$ 16,90",Frios-E-Laticínios
Pé Suíno Salgado Bandeja Kg,"R$ 16,90",Frios-E-Laticínios
Queijo Ralado Kiformaggio Zero Lactose - 40g,"R$ 5,49",Frios-E-Laticínios
Presunto Cozido Pamplona Sem Capa De Gordura Bandeja Kg,"R$ 26,90",Frios-E-Laticínios
Manteiga Galbani Extra Sem Sal Pote 200g,"R$ 15,99",Frios-E-Laticínios
Cereja Em Calda A Granel Kg,"R$ 79,90",Frios-E-Laticínios
Bebida Láctea Três Corações Cappuccino Chocolate 260ml,"R$ 7,99",Frios-E-Laticínios
Apresuntado Seara Fatiado 180g,"R$ 7,99",Frios-E-Laticínios
Iogurte Integral Atilatte Maracujá 180g,"R$ 4,49",Frios-E-Laticínios
Iogurte Grego Nestlé Com Calda De Damasco 90g,"R$ 3,49",Frios-E-Laticínios
Salsicha Hot Dog Seara Defumada Congelada Granel Kg,"R$ 15,90",Frios-E-Laticínios
Petit Suisse Elegê Bob Esponja Morango E Banana 320g,"R$ 8,55",Frios-E-Laticínios
Salamitos Sadia Snacks Limão 36g,"R$ 4,99",Frios-E-Laticínios
Iogurte Semi Desnatado Frutap Açai Com Banana 160g,"R$ 2,59",Frios-E-Laticínios
Iogurte Semi Desnatado Batavinho Morango Bob Esponja 120g,"R$ 4,49",Frios-E-Laticínios
Bebida Láctea Piracanjuba Chocolate Zero Lactose - 200ml,"R$ 3,75",Frios-E-Laticínios
Queijo Brie Quata Granel Kg,"R$ 119,90",Frios-E-Laticínios
Leite Fermentado Desnatado Lettico Zero Lactose 1kg,"R$ 19,99",Frios-E-Laticínios
"Iogurte Semi Desnatado Batavo Graviola 1,150kg","R$ 16,49",Frios-E-Laticínios
Queijo Provolone Tirolez Granel Kg,"R$ 119,90",Frios-E-Laticínios
Salame Seara Gourmet Pepperoni Fatiado 100g,"R$ 14,29",Frios-E-Laticínios
Iogurte Integral Danone Mel 160g,"R$ 3,19",Frios-E-Laticínios
"Iorgute Semidesnatado Batavo Probio2 Ameixa 1,15kg","R$ 14,99",Frios-E-Laticínios
Manteiga Danone Com Sal Tablete 200g,"R$ 14,55",Frios-E-Laticínios
Goiabada Granel Kg,"R$ 14,50",Frios-E-Laticínios
Iogurte Vida Veg Coco Com Morango 170g,"R$ 6,99",Frios-E-Laticínios
Salaminho Pamplona Bandeja Kg,"R$ 69,90",Frios-E-Laticínios
Sobremesa Láctea Danette Chocolate Branco C/ 2 Unid. 180g,"R$ 6,89",Frios-E-Laticínios
Orelha Suina Salgada Bandeja Kg,"R$ 22,90",Frios-E-Laticínios
Sobremesa Láctea Danette Cremosão Chocolate Com Avelã 90g,"R$ 3,65",Frios-E-Laticínios
Rosbife Ceratti Bandeja Kg,"R$ 89,90",Frios-E-Laticínios
Lombo Seara Levissimo Fatiado 180g,"R$ 13,49",Frios-E-Laticínios
Linguiça Toscana Sadia Bandeja Kg,"R$ 24,90",Frios-E-Laticínios
Ricota Sol Brilhante Fresca 400g,"R$ 32,90",Frios-E-Laticínios
Leite Em Pó Finissima Integral Instantâneo Sachê 350gleite Em Pó Finissima Integral Instantâneo Sachê 350g,"R$ 14,89",Frios-E-Laticínios
Iogurte Integral Danone Quaker Batido E Aveia - 800g,"R$ 14,99",Frios-E-Laticínios
Iogurte Integral Danone Kids Morango 800g,"R$ 13,85",Frios-E-Laticínios
Iogurte Integral Danoninho Bom Dia Morango Com Aveia 90g,"R$ 3,29",Frios-E-Laticínios
Bebida Láctea Nescau 40% Menos Açucares E Zero Lactose 180ml,"R$ 3,19",Frios-E-Laticínios
Iorgute Frutap Morango Com Confeitos Coloridos 115g,"R$ 4,19",Frios-E-Laticínios
Iogurte Grego Batavo Morango 500g,"R$ 11,99",Frios-E-Laticínios
Bebida De Soja Yakult Tonyu Maca 200ml,"R$ 3,99",Frios-E-Laticínios
Marrom Glace Bandeja Granel,"R$ 29,90",Frios-E-Laticínios
Salsicha Hot Dog Sadia Congelado Bandeja Kg,"R$ 14,90",Frios-E-Laticínios
Iogurte Semi Desnatado Batavo Graviola 170g,"R$ 2,79",Frios-E-Laticínios
Linguiça Calabresa Sadia Bandeja Kg,"R$ 29,29",Frios-E-Laticínios
Iogurte Semi Desnatado Danone 10g Proteína Morango Zero Lactose 160g,"R$ 5,69",Frios-E-Laticínios
Iogurte Grego Nestle Frutas Vermelhas 360g,"R$ 12,09",Frios-E-Laticínios
Mortadela Marba Italiana Fatiada 180g,"R$ 10,99",Frios-E-Laticínios
Iogurte Desnatado Verde Campo Lacfree Zero Lactose Morango 500g,"R$ 10,79",Frios-E-Laticínios
Requeijão Cremoso Catupiry Cebola Caramelizada 180g,"R$ 10,49",Frios-E-Laticínios
Iogurte Semi Desnatado Frutap Açaí Com Morango 850g,"R$ 11,19",Frios-E-Laticínios
Iogurte Semi Desnatado Frutap Salda De Fruta 850g,"R$ 11,19",Frios-E-Laticínios
Iogurte Integral Danoninho Bom Dia Banana Com Aveia 90g,"R$ 3,29",Frios-E-Laticínios
Requeijão Scala Light Copo 200g,"R$ 9,99",Frios-E-Laticínios
Salame Italiano Fatiado Sulita 100g,"R$ 9,99",Frios-E-Laticínios
Iogurte Integral Batavo Probio2 Ameixa E Tradicional 510g,"R$ 11,99",Frios-E-Laticínios
Bebida Láctea Piracanjuba 23g De Proteína Pasta De Amendoim Zero Lactose Whey 250ml,"R$ 9,69",Frios-E-Laticínios
Leite In Natura Letti Semi Desnatado Garrafa 1l,"R$ 9,59",Frios-E-Laticínios
Iogurte Integral Batavo C/ Pedaços Abacaxi 500g,"R$ 10,55",Frios-E-Laticínios
Linguiça De Frango Marchiori Fina Bandeja Kg,"R$ 45,90",Frios-E-Laticínios
Presunto Cozido Perdigão Sem Capa Bandeja Kg,"R$ 34,19",Frios-E-Laticínios
Requeijão Monteminas Light Copo 200g,"R$ 8,99",Frios-E-Laticínios
Margarina Delícia Creme De Leite Com Sal 250g,"R$ 4,59",Frios-E-Laticínios
Requeijão Poços De Calda Cheddar 200g,"R$ 10,49",Frios-E-Laticínios
Margarina Cremosa Sem Sal Doriana 250g,"R$ 4,39",Frios-E-Laticínios
Peito De Frango Sadia Kg,"R$ 43,90",Frios-E-Laticínios
Bacon Seara Bandeja Kg,"R$ 44,90",Frios-E-Laticínios
Iorgute Frutap Morango Com Cereais Chocolate 115g,"R$ 4,19",Frios-E-Laticínios
Iorgute Frutap Morango Com Cereais Coloridos 115g,"R$ 4,19",Frios-E-Laticínios
Iorgute Semidesnatado Batavo Probio2 Ameixa 170g,"R$ 3,19",Frios-E-Laticínios
Requeijão Frimesa Tradicional Copo 200g,"R$ 9,79",Frios-E-Laticínios
Iogurte Nestle Morango/Vitamina De Frutas 510g,"R$ 7,99",Frios-E-Laticínios
Leite Fermentado Desnatado Chamyto Big - 120g,"R$ 1,99",Frios-E-Laticínios
Sobremesa Láctea Chandelle Chantilly Chocolate C/ 2 Unid. 180g,"R$ 7,79",Frios-E-Laticínios
Leite Fermentado Semi Desnatado Acitivia Ameixa 170gr,"R$ 4,29",Frios-E-Laticínios
Salamitos Sadia Snacks Pepperoni 26g,"R$ 4,99",Frios-E-Laticínios
Petit Suisse Frutapinho Morango E Maçã Com Banana 320g,"R$ 7,75",Frios-E-Laticínios
Leite Fermentado Desnatado Elegê Bob Esponja Uva C/3 Unid. De 160g - 480g,"R$ 7,69",Frios-E-Laticínios
Leite Fermentado Desnatado Elegê Bob Esponja Laranja C/3 Unid. De 160g - 480g,"R$ 7,69",Frios-E-Laticínios
Margarina Original C/ Sal Ômega 6 Becel Pote 250g,"R$ 7,49",Frios-E-Laticínios
Sobremesa Láctea Cremosa De Chocolate Ao Leite Danette C/ 2 Unid. 180g,"R$ 6,89",Frios-E-Laticínios
Sobremesa Láctea Danette Cremosão Doce De Leite Insano 90g,"R$ 3,65",Frios-E-Laticínios
Mortadela Mista Perdigão 400g,"R$ 6,79",Frios-E-Laticínios
Iorgute Semidesnatado Batavo Probio2 Tradicional 170g,"R$ 3,19",Frios-E-Laticínios
Bebida Láctea Nescafé Uht Cappuccino Canela Com Café 270ml,"R$ 8,69",Frios-E-Laticínios
Pimenta Biquinho Granel Kg,"R$ 59,90",Frios-E-Laticínios
Apresuntado Seara Bandeja Kg,"R$ 28,90",Frios-E-Laticínios
Coalhada Atilatte Natural Desnatado 170g,"R$ 5,59",Frios-E-Laticínios
Margarina Vigor Tradicional C/ Sal 250g,"R$ 5,03",Frios-E-Laticínios
Sobremesa Láctea Frutap Pudim De Leite Condensado 100g,"R$ 4,65",Frios-E-Laticínios
Pé Suíno Pamplona Salgado Fracionado Kg,"R$ 22,90",Frios-E-Laticínios
Salsicha Hot Dog Copacol Congelado Kg,"R$ 10,99",Frios-E-Laticínios
Linguiça Jack Links Frango Pimenta Mexicana 30g,"R$ 4,25",Frios-E-Laticínios
Mortadela Perdigão Tradicional Fatiada Kg,"R$ 19,99",Frios-E-Laticínios
Iogurte Integral Danone Quaker Batido Aveia 170g,"R$ 3,99",Frios-E-Laticínios
Bebida De Soja Yakult Tonyu Morango 200ml,"R$ 3,99",Frios-E-Laticínios
Salamitos Sadia Snacks Sweet Chilli 36g,"R$ 4,99",Frios-E-Laticínios
Queijo Processado Tradicional Polenguinho C/ 2 Unid. 34g,"R$ 3,99",Frios-E-Laticínios
Queijo Provolone Kg,"R$ 79,90",Frios-E-Laticínios
Queijo Prato Tirolez Light Bandeja Kg,"R$ 84,90",Frios-E-Laticínios
Bebida Láctea Leco Líquido Vitamina 800g,"R$ 10,89",Frios-E-Laticínios
Trio Salame E Copa Haciendas Todo Dia 90g,"R$ 21,99",Frios-E-Laticínios
Queijo Brie Tirolez Cremíssimo 220g,"R$ 46,99",Frios-E-Laticínios
Linguiça Toscana Frimesa Bandeja Kg,"R$ 24,90",Frios-E-Laticínios
Margarina Qualy Aerada 250g,"R$ 4,99",Frios-E-Laticínios
Manteiga Dom Afonso Ghee Com Sal Rosa Vidro 200g,"R$ 39,90",Frios-E-Laticínios
Creme De Ricota Galbani Tradicional Pote 200g,"R$ 10,29",Frios-E-Laticínios
Queijo Parmesão Scala 18 Meses Speciale Fracionado 180g,"R$ 32,99",Frios-E-Laticínios
Cream Cheese Polenghi Tradicional 300g,"R$ 22,90",Frios-E-Laticínios
Queijo Minas Faz For Artesanal Fracionado Kg,"R$ 99,99",Frios-E-Laticínios
Peito De Peru Sadia Defumado Peça Kg,"R$ 60,90",Frios-E-Laticínios
Orelha Salgada Bandeja Kg,"R$ 22,90",Frios-E-Laticínios
Queijo Prato Tirolez Peça Kg,"R$ 56,90",Frios-E-Laticínios
Salsicha Ceratti Viena Bandeja Kg,"R$ 42,90",Frios-E-Laticínios
Chantilly Vigor Spray 250g,"R$ 41,90",Frios-E-Laticínios
Iogurte Desnatado Atilatte Morango 180g,"R$ 4,49",Frios-E-Laticínios
Iogurte Desnatado Atilatte Coco 180g,"R$ 4,49",Frios-E-Laticínios
Manteiga Frimesa Extra Com Sal Pote 500g,"R$ 34,69",Frios-E-Laticínios
Iogurte Desnatado Nesfit Frutas Vermelhas/Aveia/Hibisco Sem Lactose 170g,"R$ 4,79",Frios-E-Laticínios
Carne Suína Salgada Sem Osso Fracionada Kg,"R$ 29,90",Frios-E-Laticínios
Costela Suína Salgada Com Osso Fracionada Kg,"R$ 33,90",Frios-E-Laticínios
Linguiça Suina Marchiori Apimentada Fina Granel Kg,"R$ 46,90",Frios-E-Laticínios
Salame Frimesa Alemão Peça Kg,"R$ 114,90",Frios-E-Laticínios
Salame Frimesa Alemão Granel Kg,"R$ 114,90",Frios-E-Laticínios
Linguiça Calabresa Seara Bandeja Kg,"R$ 33,90",Frios-E-Laticínios
Linguiça Portugal Perdigão Band Kg,"R$ 52,90",Frios-E-Laticínios
Queijo Parmesão Quata Capa Preta Peça Kg,"R$ 129,90",Frios-E-Laticínios
Bacon Seara Bandeja Kg,"R$ 47,90",Frios-E-Laticínios
Queijo Brie Vigor Granel Kg,"R$ 139,90",Frios-E-Laticínios
Queijo Emmental Vigor Fracionado 145g,"R$ 31,99",Frios-E-Laticínios
Salsicha Hot Dog Seara Bandeja Kg,"R$ 15,75",Frios-E-Laticínios
Iogurte Semi Desnatado Vigor 3 Grãos Manga/Maracujá 800g,"R$ 13,99",Frios-E-Laticínios
Bebida Láctea Leco Líquido Vitamina 170g,"R$ 2,99",Frios-E-Laticínios
Iogurte Semi Desnatado Vigor 3 Grãos Manga/Maracujá 170g,"R$ 4,29",Frios-E-Laticínios
Salame Ceratti Italiano Defumado Bandeja Kg,"R$ 110,90",Frios-E-Laticínios
Salsicha Hans Viena - 200g,"R$ 18,49",Frios-E-Laticínios
Salaminho Ceratti Defumado Bandeja,"R$ 134,90",Frios-E-Laticínios
Creme Para Chantilly Fleischmann Gran Finale Spray 250g,"R$ 39,90",Frios-E-Laticínios
Salame Hamburguês Defumado Ceratti Granel Kg,"R$ 95,90",Frios-E-Laticínios
Requeijão Levitare Bufala - Copo 200g,"R$ 12,99",Frios-E-Laticínios
Queijo Brie Scala Peça Kg,"R$ 139,90",Frios-E-Laticínios
Bebida Láctea Fast Nescau Shake 270ml,"R$ 8,69",Frios-E-Laticínios
Iogurte Desnatado Yorgus Proteína Ameixa Zero Lactose 250g,"R$ 13,99",Frios-E-Laticínios
Queijo Brie Tirolez Peça Kg,"R$ 139,90",Frios-E-Laticínios
Embutido De Filé Mignon Suíno Sadia Cozido Granel Kg,"R$ 29,90",Frios-E-Laticínios
Manteiga Danone Extra Sem Sal Tablete 200g,"R$ 14,55",Frios-E-Laticínios
Requeijão Monteminas Tradicional Copo 200g,"R$ 8,99",Frios-E-Laticínios
Salame Frimesa Hamburguês Peça Kg,"R$ 114,90",Frios-E-Laticínios
Queijo Provolonete Mini Frimesa Bandeja Kg,"R$ 104,90",Frios-E-Laticínios
Salsicha Hot Dog Seara Defumada Congelada Bandeja Kg,"R$ 17,90",Frios-E-Laticínios
Cream Cheese Frimesa Pote 150g,"R$ 11,49",Frios-E-Laticínios
Linguiça Suína Sadia Churrasco 700g,"R$ 19,99",Frios-E-Laticínios
Creme De Ricota Galbani Light Pote 200g,"R$ 10,29",Frios-E-Laticínios
Queijo Parmesão Galbani Fracionado 180g,"R$ 28,90",Frios-E-Laticínios
Queijo Parmigiano Reggiano Galbani Fracionado 125g,"R$ 39,90",Frios-E-Laticínios
Linguiça Calabresa Ceratti Fininha Congelada 400g,"R$ 21,90",Frios-E-Laticínios
"Iogurte Integral Danone Quaker Banana, Aveia E Mel 170g","R$ 3,99",Frios-E-Laticínios
Linguiça Suína Marchiori Cuiabana C/ Queijo Pacote 420g,"R$ 21,90",Frios-E-Laticínios
Queijo Estepe Tirolez Granel Kg,"R$ 119,90",Frios-E-Laticínios
Pele Suína Salgada Bandeja Kg,"R$ 13,90",Frios-E-Laticínios
Linguiça Suína Sulita Panceta Pacote 500g,"R$ 19,99",Frios-E-Laticínios
"Iorgute Semidesnatado Batavo Probio2 Tradicional Embalagem Econômica 1,15kg","R$ 14,99",Frios-E-Laticínios
Bebida Láctea Nescau Extra Cacau 270ml,"R$ 8,69",Frios-E-Laticínios
Salaminho Sadia Peca Kg,"R$ 106,90",Frios-E-Laticínios
Linguiça Toscana Seara Bandeja Kg,"R$ 28,90",Frios-E-Laticínios
Linhaça Jasmine 200g,"R$ 13,49",Frios-E-Laticínios
Mortadela Seara Frango 400g,"R$ 8,99",Frios-E-Laticínios
Queijo Reino Tirolez Granel Kg,"R$ 114,90",Frios-E-Laticínios
Margarina Leco Extra Cremosa Sem Sal 200g,"R$ 14,49",Frios-E-Laticínios
Queijo Mussarela Valeza Palito Kg,"R$ 79,90",Frios-E-Laticínios
Salame Seara Gourmet Italiano Bandeja Kg,"R$ 104,90",Frios-E-Laticínios
Bebida Láctea Piracanjuba 23g De Proteína Banana Zero Lactose Whey 250ml,"R$ 9,69",Frios-E-Laticínios
Carne Seca Friboi Traseira Curada - 500g,"R$ 34,99",Frios-E-Laticínios
Manteiga Scala Com Sal Pote 500g,"R$ 34,99",Frios-E-Laticínios
Manteiga Frimesa Extra Com Sal Pote 200g,"R$ 15,09",Frios-E-Laticínios
Salsicha Anglo 180g,"R$ 6,19",Frios-E-Laticínios
Iogurte Desnatado Nesfit Morango/Aveia/Baunilha Sem Lactose 170g,"R$ 4,79",Frios-E-Laticínios
Ingredientes Para Carreteiro Pamplona 600g,"R$ 28,99",Frios-E-Laticínios
Salame Pamplona Italiano Bandeja Kg,"R$ 70,90",Frios-E-Laticínios
Bebida Láctea Quata Chocolate - 1l,"R$ 6,29",Frios-E-Laticínios
Iogurte Desnatado Yopro 25g Morango Zero Lactose 250g,"R$ 14,25",Frios-E-Laticínios
Bebida Láctea Batavo Pense Zero Ameixa 170g,"R$ 3,35",Frios-E-Laticínios
Queijo Parmesão Quata Granel Kg,"R$ 119,90",Frios-E-Laticínios
Mortadela Ceratti Peça Kg,"R$ 63,90",Frios-E-Laticínios
Ricota Fresca Quata Kg,"R$ 49,90",Frios-E-Laticínios
Manteiga Gran Mestri C/ Sal Lata 200g,"R$ 19,99",Frios-E-Laticínios
Embutido De Lombo Seara Levissimo Cozido Peça Kg,"R$ 34,90",Frios-E-Laticínios
Queijo Azul President Le Blue 100gr,"R$ 18,99",Frios-E-Laticínios
Duo Salame Haciendas Todo Dia 80g,"R$ 19,99",Frios-E-Laticínios
Linguiça De Pernil Frimesa 600g,"R$ 18,99",Frios-E-Laticínios
Linguiça Toscana Frimesa Pacote 5kg,"R$ 84,50",Frios-E-Laticínios
Ricota Nacon Condimentada Peça Kg,"R$ 34,99",Frios-E-Laticínios
Salame Hans Hamburguês Mini Peça Kg,"R$ 89,90",Frios-E-Laticínios
Queijo Gruyere Vigor Fracionado 145g,"R$ 27,99",Frios-E-Laticínios
Salame Eder Italiano Mini Granel Kg,"R$ 89,90",Frios-E-Laticínios
Queijo Gouda Vigor Granel Kg,"R$ 129,90",Frios-E-Laticínios
Queijo Mussarela De Búfala Bom Destino Bola Média 250g,"R$ 29,99",Frios-E-Laticínios
Queijo Muçarela De Bufala Levitare Bola - 150g,"R$ 18,90",Frios-E-Laticínios
Queijo Provolone Scala Peça Kg,"R$ 99,90",Frios-E-Laticínios
Queijo Prato Scala Peça Kg,"R$ 62,90",Frios-E-Laticínios
Iogurte Desnatado Yorgus Proteína Baunilha Zero Lactose 250g,"R$ 13,99",Frios-E-Laticínios
Margarina Catupiry Extra Com Sal 200g,"R$ 15,09",Frios-E-Laticínios
Salame Frimesa Hamburguês Granel Kg,"R$ 114,90",Frios-E-Laticínios
Queijo Provolonete Mini Frimesa Peça Kg,"R$ 104,90",Frios-E-Laticínios
Queijo Provolonete Mini Frimesa Granel Kg,"R$ 104,90",Frios-E-Laticínios
Embutido De Filé Mignon Suíno Sadia Cozido Peça Kg,"R$ 29,90",Frios-E-Laticínios
Queijo Grana Padano Galbani Fracionado 125g,"R$ 29,90",Frios-E-Laticínios
Linguiça De Pernil Suína Ceratti Limão Siciliano Congelado 400g,"R$ 21,90",Frios-E-Laticínios
Linguiça Calabresa Ceratti 370g,"R$ 16,99",Frios-E-Laticínios
Queijo Camembert Polenghi A Queijaria 125g,"R$ 27,99",Frios-E-Laticínios
Salsicha Viena Ceratti Bandeja Kg,"R$ 42,90",Frios-E-Laticínios
Gordura Vegana Primor 500g,"R$ 15,99",Frios-E-Laticínios
"Paio Seara Pacote 2,5kg","R$ 87,25",Frios-E-Laticínios
Salaminho Seara Granel Kg,"R$ 104,90",Frios-E-Laticínios
Queijo Azul Tirolez Peça Kg,"R$ 109,90",Frios-E-Laticínios
Salame Com Borda Pimenta Seara Gourmet 100g,"R$ 16,99",Frios-E-Laticínios
Iogurte Semi Desnatado Frutap Frutas Vermelhas 850g,"R$ 11,19",Frios-E-Laticínios
Leite Fermentado Desnatado Frutap Uva 170g,"R$ 3,09",Frios-E-Laticínios
Salame Pamplona Hamburguers Fatiado 100g,"R$ 10,89",Frios-E-Laticínios
Copa Pamplona Fatiada 100g,"R$ 12,99",Frios-E-Laticínios
Bacon Tablete Kg,"R$ 46,90",Frios-E-Laticínios
