Título,Preço,Departamento
Toalha Papel Kitchen Folha Dupla 360fls 19x20cm 3 Rolos C/ 120 Fls,"R$ 18,89",Bazar-E-Utilidades
Papel Toalha Kitchen Jumbo 19x20cm C/ 2 Rolos 120 Folhas,"R$ 12,29",Bazar-E-Utilidades
Toalha De Papel Fani 22x20cm C/ 2 Unid 50 Folhas Cada,"R$ 4,89",Bazar-E-Utilidades
Saco De Lixo Saron 50l Rolo C/ 30 Unid.,"R$ 13,49",Bazar-E-Utilidades
Saco De Lixo Embalixo Reforçado 50l Rolo C/ 50 Unid.,"R$ 31,90",Bazar-E-Utilidades
Saco De Lixo Embalixo Reforçado 110l Rolo C/ 25 Unid.,"R$ 43,90",Bazar-E-Utilidades
Filtro De Papel 3 Corações 103 C/ 30 Unid.,"R$ 4,79",Bazar-E-Utilidades
Saco De Lixo Embalixo Neut Pia E Banheiro C/ 100 Unid.,"R$ 17,49",Bazar-E-Utilidades
Toalha Papel Kitchen 120fls 19x21 2 Rolos C/ 60 Fls,"R$ 6,29",Bazar-E-Utilidades
Saco De Lixo Embalixo Mg 100l C/ 40 + 10 Unid.,"R$ 26,90",Bazar-E-Utilidades
"Guardanapo Kitchen Fs Ul Mac 22,7x22,8cm C/ 50 Unid.","R$ 3,15",Bazar-E-Utilidades
Ventilador Mondial 40cm Preto E Prata 127v,"R$ 199,00",Bazar-E-Utilidades
"Papel Alumínio Facilita E Pronto 30x7,5m","R$ 6,29",Bazar-E-Utilidades
Carvão Vegetal Sertanejo 4kg,"R$ 29,90",Bazar-E-Utilidades
Toalha De Papel Snob Classica 120fls 19x20cm C/3,"R$ 18,89",Bazar-E-Utilidades
Ventilador Mondial Super Power 30cm Preto 127v,"R$ 15,99",Bazar-E-Utilidades
Guardanapo Folha Simples Fani 23x22cm C/ 50 Unid.,"R$ 159,90",Bazar-E-Utilidades
Coador De Papel Melitta Aro Max 103,"R$ 2,29",Bazar-E-Utilidades
Coador Papel Brigitta 103,"R$ 5,29",Bazar-E-Utilidades
Ventilador Cadence New Windy 127v,"R$ 3,89",Bazar-E-Utilidades
"Guardanapo Scott Grand Hotel Folha Dupla G 31,8x32,8cm","R$ 179,90",Bazar-E-Utilidades
Saco De Lixo Saron 30l Rolo C/ 30 Unid.,"R$ 11,59",Bazar-E-Utilidades
Toalha De Papel Snob Decora 19x20cm 60 Flolhas Com 2 Rolos,"R$ 13,49",Bazar-E-Utilidades
"Toalha Papel Scala Plus Folha Dupla 19x22,2cm C/ 2 Unid. 60 Folhas Cada","R$ 6,99",Bazar-E-Utilidades
Filme De Pvc Wyda 30m,"R$ 6,99",Bazar-E-Utilidades
"Papel Alumínio Facilita E Pronto 45x7,5m","R$ 8,99",Bazar-E-Utilidades
Guardanapo Kitchen 32x30cm Branco C/ 50 Unid.,"R$ 9,99",Bazar-E-Utilidades
Saco De Lixo Saron 100l Rolo C/ 15 Unid.,"R$ 5,59",Bazar-E-Utilidades
Saco De Lixo Saron 15l Rolo C/ 60 Unidades,"R$ 13,49",Bazar-E-Utilidades
Filtro De Papel 3 Corações 102 C/ 30 Unid.,"R$ 13,49",Bazar-E-Utilidades
Pilha Panasonic Palito Aaa C/ 4 Unid.,"R$ 4,79",Bazar-E-Utilidades
Papel Alumínio Facilita&Pronto 30x4mt,"R$ 14,69",Bazar-E-Utilidades
Vela Moroaba 7 Dias Todos Os Santos 260g Unid.,"R$ 4,39",Bazar-E-Utilidades
Carvão Vegetal Jacaré 8kg,"R$ 13,99",Bazar-E-Utilidades
Saco Para Alimentos Facilita E Pronto 3kg,"R$ 69,90",Bazar-E-Utilidades
Toalha Papel Scala Plus Folha Dupla 19x22cm 3 Unid. C/ 120 Folhas Cada,"R$ 7,49",Bazar-E-Utilidades
Saco De Lixo Saron 50l C/ 10 Unid.,"R$ 17,99",Bazar-E-Utilidades
Guarda Chuva Mor Paraguas Sortido Unidade,"R$ 6,99",Bazar-E-Utilidades
Saco De Lixo Embalixo Com Alca 50l Com 30 Unidades,"R$ 19,90",Bazar-E-Utilidades
Saco De Lixo Embalixo Mg 30l C/ 80 + 20gts Unid.,"R$ 32,99",Bazar-E-Utilidades
Guardanapo Scott Grand Hotel Folha Dupla Pequeno 24x24cm,"R$ 24,90",Bazar-E-Utilidades
Toalha De Papel Absoluto Multiuso 120 Folhas C/ 2 Unid.,"R$ 6,29",Bazar-E-Utilidades
Pilha Panasonic Pequena Shs C/ 4 Unid.,"R$ 6,59",Bazar-E-Utilidades
Varal Mor Chao C/ Abas Slim Unid.,"R$ 12,99",Bazar-E-Utilidades
Guardanapo Scott Folha Simples Dia A Dia 24x22cm,"R$ 189,90",Bazar-E-Utilidades
Panela Arroz Elétrica Mondial Bianca Rice Branco - 127v,"R$ 3,29",Bazar-E-Utilidades
Guardanapo Fani Folha Simples 30x31cm C/ 50 Unid.,"R$ 179,90",Bazar-E-Utilidades
Copo Descartavel Copomais Branco 200ml C/ 100 Unid.,"R$ 3,99",Bazar-E-Utilidades
"Panela De Pressão Clock Polida 4,5l","R$ 7,19",Bazar-E-Utilidades
Saco De Lixo Embalixo Com Alça 100l Contém 15 Unidades,"R$ 169,00",Bazar-E-Utilidades
Mexedor Para Café Prafesta Cristal C/ 250 Unid.,"R$ 32,99",Bazar-E-Utilidades
Filme Pvc Wyda 15m,"R$ 7,75",Bazar-E-Utilidades
Saco De Lixo Saron 100l C/ 5 Unid.,"R$ 5,49",Bazar-E-Utilidades
Caixa Térmica Mor Azul C/ Preto 34l,"R$ 6,99",Bazar-E-Utilidades
Coador De Papel Brigitta 102,"R$ 99,90",Bazar-E-Utilidades
Aparador De Pelos Mondial Super Groom 6 Preto E Verde,"R$ 3,89",Bazar-E-Utilidades
Ducha Lorenzetti Top Jet Mult 220v 7500w Unid.,"R$ 159,00",Bazar-E-Utilidades
Pilha Duracell Alcalina Palito Aaa C/ 4 Unid.,"R$ 159,90",Bazar-E-Utilidades
Sanduicheira Mondial Fast Grill Preto 127v,"R$ 29,90",Bazar-E-Utilidades
Coador De Papel Melitta Aro Max 102,"R$ 149,90",Bazar-E-Utilidades
Prato Descartável Facilita Pronto 21cm C/ 10 Unid.,"R$ 5,29",Bazar-E-Utilidades
Vela Moroaba 7 Dias Fina Branca 200g Unid.,"R$ 4,55",Bazar-E-Utilidades
Carvão Vegetal Jacaré 4kg,"R$ 11,99",Bazar-E-Utilidades
Vela Moroaba Especial Branca 248g C/ 8 Unid.,"R$ 35,90",Bazar-E-Utilidades
Saco De Lixo Embalixo Banheiro C/ 50 Unid.,"R$ 13,99",Bazar-E-Utilidades
Ducha Lorenzetti Shower Multi 220v 7500w,"R$ 11,29",Bazar-E-Utilidades
Fósforo Fiat Lux Tradicional C/ 10 Unid.,"R$ 122,90",Bazar-E-Utilidades
Saco De Lixo Saron 15l C/ 20 Unid.,"R$ 4,99",Bazar-E-Utilidades
Saco De Lixo Saron 30l C/ 10 Unid.,"R$ 5,99",Bazar-E-Utilidades
Toalha De Papel Snob Clássica 19x20cm C/ 2 Unid. 60 Folhas Cada,"R$ 5,99",Bazar-E-Utilidades
Saco De Lixo Embalixo Wecycle 30l Com 20 Unidades,"R$ 7,89",Bazar-E-Utilidades
Carvão Vegetal Sertanejo 7kg,"R$ 15,99",Bazar-E-Utilidades
Pano Luxcar Microfibra C/ 4 Unid.,"R$ 52,90",Bazar-E-Utilidades
Chinelo Havaianas Tradicional Número 33 À 43,"R$ 26,90",Bazar-E-Utilidades
Pote De Vidro Euro Slim C/ Tampa De Inox 1l,"R$ 35,90",Bazar-E-Utilidades
"Carvão Vegetal Jacaré 2,5kg","R$ 25,90",Bazar-E-Utilidades
Ducha Lorenzetti Bella 4t 220v 6800w Unid.,"R$ 23,90",Bazar-E-Utilidades
Frigideira Tramontina Turim Vermelha 20cm,"R$ 99,90",Bazar-E-Utilidades
Copo Descartavel Facilita Pronto Tran 180ml C/ 100 Unid.,"R$ 48,90",Bazar-E-Utilidades
Saco Para Freezer Wyda 2kg C/ 100 Unid.,"R$ 7,29",Bazar-E-Utilidades
Copo Descartavel Facilita Pronto Tran 300ml C/ 100 Unid.,"R$ 11,99",Bazar-E-Utilidades
Balde Simplo Dobrável Plástico 5l,"R$ 13,39",Bazar-E-Utilidades
Frigideira Tramontina Funda Grafite 24cm,"R$ 25,90",Bazar-E-Utilidades
Boleira Ruvolo C/ Pé E Tampa Home Especial Vidro Unid.,"R$ 89,90",Bazar-E-Utilidades
"Carvão Vegetal Sertanejo 2,5kg","R$ 89,90",Bazar-E-Utilidades
Lampada Ourolux Super Led 12w Biv 6500k Unid.,"R$ 21,99",Bazar-E-Utilidades
Saco Para Alimentos Facilita E Pronto 2kg,"R$ 10,99",Bazar-E-Utilidades
Lampada Ourolux Led 9w Biv 6500k Unid.,"R$ 6,49",Bazar-E-Utilidades
Prato Descartável Facilita Pronto 15cm C/ 10 Unid.,"R$ 6,99",Bazar-E-Utilidades
Forma Facilita & Pronto Papel Air Fryer,"R$ 2,19",Bazar-E-Utilidades
"Pote De Vidro Euro Slim C/ Tampa De Inox 0,700l","R$ 13,85",Bazar-E-Utilidades
Lampada Ourolux Led Alta Potencia 15w 6500k Bivolt,"R$ 24,90",Bazar-E-Utilidades
"Papel Manteiga Wyda 29x7,5m Unid.","R$ 11,99",Bazar-E-Utilidades
Pote De Vidro Com Tampa Hermética Retangular Oikos 840ml,"R$ 7,99",Bazar-E-Utilidades
Algicida Choque Hidroall Hcl Para Piscinas 1l,"R$ 35,90",Bazar-E-Utilidades
Lâmpada Kian Led Globe 20w 6500k E27 Bivolt,"R$ 35,90",Bazar-E-Utilidades
Coador Papel Melitta Água Adoçada C/ 30 Unid.,"R$ 17,90",Bazar-E-Utilidades
Papel Alumínio Facilita E Pronto 45x4m,"R$ 6,39",Bazar-E-Utilidades
Esponja De Aco Q'Lustro C/6,"R$ 6,99",Bazar-E-Utilidades
Protetor Para Fogão Wyda 4/6 Bocas 27x27cm C/ 12 Folhas,"R$ 2,49",Bazar-E-Utilidades
Palito De Dente Gina Madeira C/ 200 Unid.,"R$ 9,79",Bazar-E-Utilidades
Toalha De Papel Absoluto Multiuso 240 Folhas C/ 2 Unid.,"R$ 2,90",Bazar-E-Utilidades
Prendedor De Roupa Ligbrin C/ 24 Unid.,"R$ 12,49",Bazar-E-Utilidades
Toalha De Papel Maxim Stylus 12x2 Rolos 50 Metros,"R$ 11,90",Bazar-E-Utilidades
Pilha Panasonic Alcalina Aa 3+1 C/ 4 Unid.,"R$ 4,90",Bazar-E-Utilidades
Acendedor Paraná Para Lareira E Churrasqueira Em Bastão C/ 5 Unid.,"R$ 20,90",Bazar-E-Utilidades
"Grill Brinox Garlic Vermelho 24x24x2,3cm 0,75l Unid.","R$ 10,29",Bazar-E-Utilidades
"Frigideira Wok Ebony Preto Brinox 2,3litro 24cm","R$ 59,90",Bazar-E-Utilidades
Conjunto De Pote De Vidro Euro Redondo C/ Tampa Plastica Vermelho 3pcs,"R$ 59,90",Bazar-E-Utilidades
Fósforo Gaboardi De Segurança Longo C/ 200 Unid.,"R$ 29,90",Bazar-E-Utilidades
Isqueiro Bic Maxi Chama Unid.,"R$ 4,59",Bazar-E-Utilidades
Saco Para Freezer Wyda 3kg C/ 100 Unid.,"R$ 8,39",Bazar-E-Utilidades
Desentupidor Sanitário Brilhus,"R$ 14,49",Bazar-E-Utilidades
Pote De Vidro Marinex Facilita Vap Quadrado 500ml Unid.,"R$ 56,90",Bazar-E-Utilidades
Resistencia Lorenzetti Advanced T 127v 5500w Unid.,"R$ 24,90",Bazar-E-Utilidades
Copo Descartavel Copomais Branco 180ml C/ 100 Unid.,"R$ 52,90",Bazar-E-Utilidades
Vela Moroaba 7 Dias Média 330g,"R$ 6,49",Bazar-E-Utilidades
Jarra Vidro Sm Tango 750ml,"R$ 16,99",Bazar-E-Utilidades
Filme Poliester Facilita Pronto 45x5mt 5m Unid.,"R$ 16,90",Bazar-E-Utilidades
Caderno São Domingos Espiral Deadpool 10 Matérias 160 Folhas,"R$ 12,59",Bazar-E-Utilidades
"Jarra Vidro Nadir Ladrilho Com Tampa 1,2l","R$ 49,99",Bazar-E-Utilidades
Cola Super Bonder Loctite 3g,"R$ 24,99",Bazar-E-Utilidades
Conjunto Frigideira Panelux Francesa 18cm + 20cm Aa Grafite Magnific,"R$ 9,99",Bazar-E-Utilidades
"Fervedor Ebony Preto Brinox 1,2 Litro 12x11 5cm","R$ 49,90",Bazar-E-Utilidades
Coador De Pano Anis Unid.,"R$ 69,90",Bazar-E-Utilidades
Protetor De Fogão Lumipam C/ 12 Unid.,"R$ 16,39",Bazar-E-Utilidades
Pilha Duracell Pequena Aa C/ 2 Unid.,"R$ 8,19",Bazar-E-Utilidades
Pote De Vidro Marinex Facilita Vap Quadrado 2l Unid.,"R$ 16,99",Bazar-E-Utilidades
Copo Descartavel Facilita Pronto Tran 200ml C/ 100 Unid.,"R$ 48,90",Bazar-E-Utilidades
Odorizante Para Automóvel Proauto Gil Carro Novo 60g,"R$ 8,69",Bazar-E-Utilidades
Fósforo Gaboardi De Segurança C/ 10 Unid.,"R$ 14,99",Bazar-E-Utilidades
Garrafa Térmica Invicta Arábica Preto 1l,"R$ 5,49",Bazar-E-Utilidades
Vela Rio Claro 76g C/ 8 Unid.,"R$ 42,90",Bazar-E-Utilidades
Garrafa Térmica Invicta Vogue Preta 750ml Unid.,"R$ 4,79",Bazar-E-Utilidades
Cesto Condor Com 24 Prendedores Unidade,"R$ 39,90",Bazar-E-Utilidades
Cesto Plasútil Para Roupas Telado Pequeno 30l Unid.,"R$ 39,90",Bazar-E-Utilidades
Fita Crepe Kimarc 18x50m,"R$ 39,90",Bazar-E-Utilidades
Prendedor Para Roupas Esfrebom Plástico Classic C/ 12 Unid.,"R$ 12,99",Bazar-E-Utilidades
Lâmpada Kian Eletrônica 3u 25w 127v Unid.,"R$ 12,90",Bazar-E-Utilidades
Flanela Rs Sacaria Branca 38x58 Unid.,"R$ 17,99",Bazar-E-Utilidades
Assadeira Facilita&Pronto Alumínio Descartável 4l,"R$ 8,99",Bazar-E-Utilidades
Palito De Dente Gina De Madeira C/ 100 Unid.,"R$ 8,90",Bazar-E-Utilidades
Cera Proauto Líquida Super Brilho C/ Gatilho 500ml,"R$ 1,79",Bazar-E-Utilidades
Chinelo Ipanema Anatômica Unid.,"R$ 33,90",Bazar-E-Utilidades
Saco Plástico Junco Para Geladinho C/ 100 Unid.,"R$ 31,99",Bazar-E-Utilidades
Saco Hermético Wyda 18x23cm C/ 15 Unid.,"R$ 4,49",Bazar-E-Utilidades
Pilha Duracell Pequena A.A C/ 4 Unid.,"R$ 15,49",Bazar-E-Utilidades
Tomada Kimarc C/ Placa 2p + Terra 20 A,"R$ 29,90",Bazar-E-Utilidades
Saco De Lixo Saron Branco 30l C/ 10 Unid.,"R$ 14,99",Bazar-E-Utilidades
Toalha De Papel Social Clean Folha Dupla 19x19cm 50 Folhas Com 2 Rolos,"R$ 5,99",Bazar-E-Utilidades
Porta Sabonete Líquido Paramount Branco Quadratta,"R$ 4,99",Bazar-E-Utilidades
Garrafa Térmica Mor Use Rubi 1l Unid.,"R$ 29,90",Bazar-E-Utilidades
Porta Sabonete Líquido Paramount Preto Quadratta,"R$ 35,69",Bazar-E-Utilidades
Varal Ligbrin Tamanho 3 C/ 26 Prendedores,"R$ 29,90",Bazar-E-Utilidades
"Extensão Kimarc M/F Paral 2x0,75m 3m","R$ 35,90",Bazar-E-Utilidades
Chinelo Havaianas Top 33 À 43 Unid.,"R$ 29,90",Bazar-E-Utilidades
Prato Isopor Fibraform Raso 23cm Com 25 Unid.,"R$ 39,99",Bazar-E-Utilidades
Pilha Duracell Palito Aaa C/ 2 Unid.,"R$ 14,90",Bazar-E-Utilidades
Saco Hermético Wyda 27x31cm C/ 8 Unid.,"R$ 16,99",Bazar-E-Utilidades
Pilha Panasonic Cr2032,"R$ 14,29",Bazar-E-Utilidades
Filtro De Café Não Descartável Ijetemp Número 103,"R$ 13,99",Bazar-E-Utilidades
Saco De Lixo Saron Branco 50l,"R$ 6,99",Bazar-E-Utilidades
Lixeira Plasútil Ecoblack Com Pedal 7l Unid.,"R$ 6,99",Bazar-E-Utilidades
Cadeado Pado Blister 20mm Unid.,"R$ 27,90",Bazar-E-Utilidades
Corda Esfrebom Para Varal Revestida,"R$ 27,90",Bazar-E-Utilidades
Saboneteira Plasútil Unid.,"R$ 13,90",Bazar-E-Utilidades
Saco Lixo Embalixo Mg 50l C/ 80 + 20gts Unid.,"R$ 5,49",Bazar-E-Utilidades
Tigela Bowl Nadir Astral 2l,"R$ 26,90",Bazar-E-Utilidades
Triturador De Alho Original Line Premium,"R$ 26,90",Bazar-E-Utilidades
Saco Para Alimentos Facilita E Pronto 5kg,"R$ 8,90",Bazar-E-Utilidades
Porta Escova Para Viagem Plasútil,"R$ 8,79",Bazar-E-Utilidades
"Pote De Vidro Euro Slim C/ Tampa De Inox 1,3l","R$ 12,99",Bazar-E-Utilidades
Saco Picotado Lumipam 18x29 C/ 50 Unid. 2kg,"R$ 25,90",Bazar-E-Utilidades
"Jarra Nadir Tropicana Vidro 1,75l","R$ 6,25",Bazar-E-Utilidades
Lâmpada Kian Led Globe 30w 6500k E27 Bivolt,"R$ 24,99",Bazar-E-Utilidades
Rodo Melare Puxesec Metal 40cm,"R$ 24,90",Bazar-E-Utilidades
Papel Sulfite Chamequinho Branco A4 C/ 100 Folhas Pacote,"R$ 23,99",Bazar-E-Utilidades
Cera Proauto Pasta C/ Antiaderente Tradicional 200g,"R$ 7,99",Bazar-E-Utilidades
Cortador De Legumes Keita 24cm Unid.,"R$ 23,90",Bazar-E-Utilidades
Odorizante Para Automóvel Proauto Breeze Retro,"R$ 23,90",Bazar-E-Utilidades
Vela Moroaba Número 3 Branca 144g Unid.,"R$ 11,99",Bazar-E-Utilidades
Pote De Vidro Com Tampa Hermética Quadrado Oikos 520ml,"R$ 7,89",Bazar-E-Utilidades
Limpa E Hidrata Couro Proauto 150gr,"R$ 28,90",Bazar-E-Utilidades
Odorizante Luxcar New Fresh Car Carro Novo,"R$ 22,90",Bazar-E-Utilidades
Chinelo Ipanema Feminino Unid.,"R$ 12,99",Bazar-E-Utilidades
Chinelo Ipanema Clássica Masculino Unid.,"R$ 14,99",Bazar-E-Utilidades
Faca Tramontina Plenus Legumes Preto Numero 3 Unid.,"R$ 14,99",Bazar-E-Utilidades
Suporte Para Filtro Melitta 100 Unid.,"R$ 10,90",Bazar-E-Utilidades
"Folha De Alumínio Wyda 30x7,5mt Unid.","R$ 10,90",Bazar-E-Utilidades
Porta Filtro De Café Plásutil,"R$ 6,69",Bazar-E-Utilidades
Saco Hermet Ziploc Para Conservar Médio C/ 8 Unid.,"R$ 10,49",Bazar-E-Utilidades
Faca Tramontina Plenus Pão Numero 7 Unid.,"R$ 19,99",Bazar-E-Utilidades
Vassoura Melare Karpet Sem Cabo,"R$ 19,99",Bazar-E-Utilidades
Copo Plástico Plasútil Com Tampa Stitch 500ml,"R$ 19,90",Bazar-E-Utilidades
Porta Biscoito/Torrada Plásutil Decorado,"R$ 9,90",Bazar-E-Utilidades
Vela Aniversário Junco Estrelar Unid.,"R$ 22,90",Bazar-E-Utilidades
Faca Original Peixeira Design N.8,"R$ 6,49",Bazar-E-Utilidades
Balão Junco Liso Sortido Número 7 C/ 50 Unid.,"R$ 18,99",Bazar-E-Utilidades
Taça Ruvolo Para Martini Vidro 225ml,"R$ 18,90",Bazar-E-Utilidades
Garfo Descartavel Facilita Pronto Sobremesa C/ 50 Unid.,"R$ 14,99",Bazar-E-Utilidades
Vela Moroaba Repel 180g,"R$ 5,99",Bazar-E-Utilidades
Espeto Gina De Bambu 25cm - 50 Unidades,"R$ 17,89",Bazar-E-Utilidades
Espeto De Bambu Junco Para Churrasco C/ 50 Unid.,"R$ 8,69",Bazar-E-Utilidades
Caneta Bic Cristal Azul Dura Mais Leve 4 Pague 3 Unid.,"R$ 8,45",Bazar-E-Utilidades
Garfo Descartavel Facilita Pronto Master C/ 50 Unid.,"R$ 7,79",Bazar-E-Utilidades
Coador Papel Melitta Original 100 C/ 30 Unid.,"R$ 16,19",Bazar-E-Utilidades
Pote Plástico Plasútil Decorado Retangular 2 Divisórias,"R$ 5,35",Bazar-E-Utilidades
Chinelo Ipanema Clássica Infantil Unid.,"R$ 15,99",Bazar-E-Utilidades
Tesoura Original 8.5 Unid.,"R$ 15,90",Bazar-E-Utilidades
Coqueteleira Plasútil 740ml Unid.,"R$ 15,39",Bazar-E-Utilidades
Cabide Melare Plástico Adulto C/ 3 Unid.,"R$ 15,29",Bazar-E-Utilidades
Prato Descartável Strawplast Cristal 15cm,"R$ 4,99",Bazar-E-Utilidades
Suporte Para Filtro 3 Corações 102 Unidade,"R$ 14,39",Bazar-E-Utilidades
Vela Aniversário Junco Fonte Estrelar Unid.,"R$ 13,99",Bazar-E-Utilidades
Pote De Vidro Com Tampa Hermética Retangular Oikos 160ml,"R$ 13,95",Bazar-E-Utilidades
Mini Varal Flash Limp Oval C/ 8 Prendedores,"R$ 13,90",Bazar-E-Utilidades
Copo De Vidro Medidor Nadir Sempre 350ml,"R$ 13,90",Bazar-E-Utilidades
Shakeira Plasútil Decora 500ml,"R$ 13,29",Bazar-E-Utilidades
Jogo Copo Nadir Sm Aurora C/ 6 Unid. 270ml,"R$ 12,99",Bazar-E-Utilidades
Prendedor De Roupas Esfrebom Plástico Argola C/12 Unid.,"R$ 19,90",Bazar-E-Utilidades
Prendedor De Roupa Ligbrin Prende Fácil C/ 12 Unid.,"R$ 12,90",Bazar-E-Utilidades
Odorizante Para Automóvel Glade Gel Lavanda 70g,"R$ 12,90",Bazar-E-Utilidades
Odorizante Para Automóvel Glade Gel Flower Power 70g,"R$ 12,89",Bazar-E-Utilidades
Toalha Papel Kitchen Evolution Folha Triplha 120fls 19x20cm 2 Rolos C/ 60 Fls,"R$ 12,89",Bazar-E-Utilidades
Palito De Dente Gaboardi Bambu Premium C/ 80 Unid.,"R$ 11,99",Bazar-E-Utilidades
Esponja Proauto Para Limpeza Unid.,"R$ 1,99",Bazar-E-Utilidades
Saco De Lixo Saron Banheiro/Pia 10l,"R$ 11,90",Bazar-E-Utilidades
Abridor Lata/Garrafa Original Sardinha Inox,"R$ 5,90",Bazar-E-Utilidades
Copo Descartavel Facilita&Pronto Branco 50ml C/ 100 Unid.,"R$ 5,79",Bazar-E-Utilidades
Suporte Para Coador Melitta 102 Unid.,"R$ 3,85",Bazar-E-Utilidades
Casca De Pinus Pet Garden 1kg,"R$ 11,45",Bazar-E-Utilidades
Substrato De Orquideas Garden Plus 1kg,"R$ 10,99",Bazar-E-Utilidades
Coador Papel Melitta Cafeteira Elétrica Média Numero 2 C/ 30 Unid.,"R$ 10,99",Bazar-E-Utilidades
Porta Escova E Creme Dental Plasútil Unid.,"R$ 5,49",Bazar-E-Utilidades
Cumbuca Isopor Fibraform Térmico Branco 500ml C/ 25 Unid.,"R$ 10,95",Bazar-E-Utilidades
Porta Escova Plásutil Trama,"R$ 10,90",Bazar-E-Utilidades
Kit Kimarc Fita Isolante 5mt + 1 Veda Rosca 10m,"R$ 10,90",Bazar-E-Utilidades
Vela Aniversário Junco Live Collors C/ Gliter Azul Número 8 Unid.,"R$ 9,99",Bazar-E-Utilidades
Porta Sabonete Líquido Plásutil Trama 360ml,"R$ 9,99",Bazar-E-Utilidades
Vela Aniversário Junco Live Collors C/ Gliter Azul Número 7 Unid.,"R$ 12,55",Bazar-E-Utilidades
Vela Aniversário Junco Live Collors C/ Gliter Azul Número 9 Unid.,"R$ 9,99",Bazar-E-Utilidades
Vela Aniversário Junco Live Collors C/ Gliter Azul Número 1 Unid.,"R$ 9,99",Bazar-E-Utilidades
Bandeja Junco Laminada Prata Numero 7 50x40cm,"R$ 9,99",Bazar-E-Utilidades
Caneta Faber Castell Fine Pen Black,"R$ 9,99",Bazar-E-Utilidades
Torneira Para Bebedouro Kimarc,"R$ 10,99",Bazar-E-Utilidades
Folha De Alumínio Wyda 30x4mt Unid.,"R$ 9,99",Bazar-E-Utilidades
Cabides Catuai Pop Cristal C/ 3 Unid.,"R$ 4,79",Bazar-E-Utilidades
Vela Moroaba Branca Número 4 150g,"R$ 9,90",Bazar-E-Utilidades
Copo De Vidro Nadir Americano Comum Unid.,"R$ 9,75",Bazar-E-Utilidades
"Espátula Original Bamboo 33,3cm","R$ 1,59",Bazar-E-Utilidades
Flanela Ferreira Sacaria 38x58 Unid.,"R$ 8,99",Bazar-E-Utilidades
Tampa Para Pia Kimarc Plastica 1/2 C/ 2 Unid.,"R$ 8,99",Bazar-E-Utilidades
Folha De Alumínio Wyda 45x4mt,"R$ 2,99",Bazar-E-Utilidades
Toalha Papel Scala Plus Folha Dupla 12x22cm C/ 2 Unid.100 Folhas Cada,"R$ 8,45",Bazar-E-Utilidades
Sacola Ecológica Baú Diversos Retornável Unid.,"R$ 8,15",Bazar-E-Utilidades
Pote Plástico Plásutil Decorado Redondo 680ml,"R$ 7,99",Bazar-E-Utilidades
Terra Vegetal Pet Garden 5kg,"R$ 7,99",Bazar-E-Utilidades
Pote Plástico Plasútil Organizador Gire E Trave Unid.,"R$ 7,99",Bazar-E-Utilidades
Vela De Aniversário Junco Ouro Glitter Número 0 Unid.,"R$ 3,99",Bazar-E-Utilidades
Vela De Aniversário Junco Ouro Glitter Número 1 Unid.,"R$ 9,89",Bazar-E-Utilidades
Colher Suco Original Recife Premium 30cm Unid.,"R$ 9,89",Bazar-E-Utilidades
"Borracha Silicone Kimarc Clock 4,5l","R$ 7,35",Bazar-E-Utilidades
Coador Papel Melitta Cafeteira Elétrica Média Numero 4 C/ 30 Unid.,"R$ 6,99",Bazar-E-Utilidades
Escumadeira Plasútil Unid.,"R$ 6,99",Bazar-E-Utilidades
Ralo Para Pia Kimarc Zincado Unid.,"R$ 6,85",Bazar-E-Utilidades
Ralo Para Pia Kimarc Tipo Telinha Unid.,"R$ 5,99",Bazar-E-Utilidades
Pote Plástico Plasútil Organizador Gire E Trave M Unidade,"R$ 5,99",Bazar-E-Utilidades
Funil Plasútil Grande Unid.,"R$ 5,99",Bazar-E-Utilidades
Bandeja Junco Laminada Prata Rocambole 33x18cm,"R$ 5,99",Bazar-E-Utilidades
Colher Descartável Facilita Pronto Sobremesa C/ 50 Unid.,"R$ 2,99",Bazar-E-Utilidades
Fita Veda Rosca Kimarc 12x10,"R$ 5,90",Bazar-E-Utilidades
Palito De Dente Gaboardi C/ 80 Unid.,"R$ 4,99",Bazar-E-Utilidades
Saleiro Plasútil 100ml,"R$ 0,99",Bazar-E-Utilidades
Canudo Para Refresco Junco Biodegradável Descartável C/ 80 Unid.,"R$ 4,75",Bazar-E-Utilidades
Palito Junco Para Picolé C/ 50 Unid.,"R$ 4,59",Bazar-E-Utilidades
Vela Aniversário Junco Branca Número 7 Unid.,"R$ 4,45",Bazar-E-Utilidades
"Terra Vegetal Pet Garden 1,5kg","R$ 4,19",Bazar-E-Utilidades
Forminha Junco Papel Branca Número 5 C/ 100 Unid.,"R$ 3,89",Bazar-E-Utilidades
Forminha Junco Papel Rosa Número 5 C/ 100 Unid.,"R$ 2,99",Bazar-E-Utilidades
Dispenser Coza Single Preto 500ml,"R$ 2,99",Bazar-E-Utilidades
Dispenser Coza Single Wgr 500ml,"R$ 26,90",Bazar-E-Utilidades
Cumbuca Isopor Copobrás Térmico Branco 360ml C/ 25 Unid.,"R$ 26,90",Bazar-E-Utilidades
Copo Vidro Nadir Bristol Long Drink 340ml,"R$ 26,90",Bazar-E-Utilidades
Pulverizador Plásutil Pequeno Decorado 300ml,"R$ 12,49",Bazar-E-Utilidades
Cumbuca Plástica Coza Uno Vermelho 500ml,"R$ 14,65",Bazar-E-Utilidades
Espremedor Mondial Elétrico Turbo Citrus 127v,"R$ 10,90",Bazar-E-Utilidades
Lâmpada Ourolux Controled 3 Tons De Luz,"R$ 99,90",Bazar-E-Utilidades
"Pote Plástico Paramount Slim Multiuso Branco - 1,360ml","R$ 29,90",Bazar-E-Utilidades
Travessa Paramount Retangular Com Friso Le Chef Branca 33x23x6cm,"R$ 29,90",Bazar-E-Utilidades
"Travessa Paramount Oval Com Friso Le Chef Branca 28x19,5x6cm","R$ 33,90",Bazar-E-Utilidades
Marmita Paramount Plástica Pratica 23x13x9cm Unidade,"R$ 20,90",Bazar-E-Utilidades
Conjunto De Utensilios Plasútil Com Pegador 5 Peças,"R$ 33,90",Bazar-E-Utilidades
Lapis De Cor Bic Kids Com 12 Cores,"R$ 39,90",Bazar-E-Utilidades
Kit Caneta Bic Esferográfica Cristal Celebration Azul E Preta,"R$ 16,99",Bazar-E-Utilidades
Cola Escolar Mercur Branca 90g,"R$ 23,99",Bazar-E-Utilidades
"Kit Caneta Bic Esferográfica Fina Azul, Vermelha E Preta","R$ 9,90",Bazar-E-Utilidades
Lápis De Cor Bic Evolution C/ 24 Unid.,"R$ 8,99",Bazar-E-Utilidades
Chinelo Havaianas Elegance Print,"R$ 31,90",Bazar-E-Utilidades
Caixa Térmica Mor Cinza Com Preta 18l Unid.,"R$ 44,90",Bazar-E-Utilidades
Tigela De Vidro Marinex Astral C/ Tampa 500ml,"R$ 86,90",Bazar-E-Utilidades
Cesto Santana Telado 8l,"R$ 19,90",Bazar-E-Utilidades
Cola Escolar Mercur Com Gliter 4 Cores 23g,"R$ 8,19",Bazar-E-Utilidades
Lapiseira Faber Castell Polly 3 Em 1 0.7,"R$ 23,90",Bazar-E-Utilidades
Lasanheira Marinex Retangular Funda 5 Litros Unid.,"R$ 28,90",Bazar-E-Utilidades
Pote Plástico Plasútil Clic Rosca 900ml,"R$ 69,90",Bazar-E-Utilidades
Resistência Lorenzetti Maxi Ducha 4t 220/5500 Unid.,"R$ 9,19",Bazar-E-Utilidades
Adesivo Instantâneo Scotch Bond 3g,"R$ 32,90",Bazar-E-Utilidades
"Forro Térmico Anis Para Tábua De Passar 1,20x0,45cm Unid.","R$ 8,90",Bazar-E-Utilidades
Oléo Desengripante Luxcar Luxlu Spray 300ml,"R$ 34,90",Bazar-E-Utilidades
Saco Picotado Lumipam 23x34 C/ 50 Unid. 3kg,"R$ 22,99",Bazar-E-Utilidades
Vela Moroaba 7 Dias Fina Branca 260g,"R$ 8,99",Bazar-E-Utilidades
"Panela De Pressão Panelux Classic 4,5l","R$ 13,49",Bazar-E-Utilidades
Resistência Lorenzetti Duo Shower 127v 5500w,"R$ 84,90",Bazar-E-Utilidades
"Porta Açúcar C/ Colher Plasútil Decorado 2,3l","R$ 52,90",Bazar-E-Utilidades
Interruptor Kimarc 1 Tec C/ Placa Radial,"R$ 24,90",Bazar-E-Utilidades
Soquete Para Teto Kimarc Porcelana,"R$ 13,99",Bazar-E-Utilidades
Tomada Embut Kimarc C/ Placa Radial,"R$ 7,99",Bazar-E-Utilidades
Vedante Plástico Kimarc 3/4 C/ 3 Unid.,"R$ 13,99",Bazar-E-Utilidades
Cotovelo Kimarc Cardinali Ll 3/4 C/ 2 Unid.,"R$ 2,99",Bazar-E-Utilidades
Luva De Conexão Kimarc Cardinali Ll 3/4 C/ 2 Unid.,"R$ 6,99",Bazar-E-Utilidades
Sifão Kimarc Sanfonado,"R$ 6,99",Bazar-E-Utilidades
Pino/Válvula Panela Pressão Kimarc Tampa Clock,"R$ 14,99",Bazar-E-Utilidades
Pino 3 Saidas Kimarc 2p + Terra Flp C/ 1 Unid.,"R$ 9,99",Bazar-E-Utilidades
Chinelo Havaianas Slim Gloss Unid.,"R$ 14,99",Bazar-E-Utilidades
Prato Nadir Raso Opaline Menu 24cm,"R$ 62,90",Bazar-E-Utilidades
"Prato Nadir Fundo Opaline Pétala 23,5cm","R$ 14,90",Bazar-E-Utilidades
"Prato Nadir Raso Opaline Pétala 25,5cm","R$ 14,90",Bazar-E-Utilidades
"Prato Nadir Sobremesa Opaline Pétala 19,5cm","R$ 14,90",Bazar-E-Utilidades
Utensílios Tramontina Churrasco Diversos - Unidade,"R$ 11,29",Bazar-E-Utilidades
Suporte Para Filtro 3 Corações 103 Unid.,"R$ 69,90",Bazar-E-Utilidades
Plaina Original Para Queijo Cook Unid.,"R$ 17,99",Bazar-E-Utilidades
Faca Para Pão Original Wood N.8,"R$ 16,49",Bazar-E-Utilidades
Vela De Aniversário Junco Ouro Glitter Número 7 Unid.,"R$ 14,90",Bazar-E-Utilidades
Vela De Aniversário Junco Vermelha Glitter Número 2 Unid.,"R$ 9,89",Bazar-E-Utilidades
Vela De Aniversário Junco Vermelha Glitter Número 4 Unid.,"R$ 9,89",Bazar-E-Utilidades
Chinelo Havaianas Slim Square,"R$ 9,89",Bazar-E-Utilidades
Conjunto De Pote Plasútil Pop Quadrado 4 Peças Unid.,"R$ 69,90",Bazar-E-Utilidades
Torneira Plastica Para Pia Kimarc 3/4 Pop Unid.,"R$ 21,90",Bazar-E-Utilidades
Torneira Para Jardim Kimarc C/ Esfera 3/4 Unid.,"R$ 9,99",Bazar-E-Utilidades
Vela Aniversário Junco Emoji Engraçadinha Unid.,"R$ 39,90",Bazar-E-Utilidades
Vela De Aniversário Junco Emoji Óculos Unid.,"R$ 13,79",Bazar-E-Utilidades
Kit Gelele Lab Slim Doce Brinquedo Unid.,"R$ 13,79",Bazar-E-Utilidades
Oleo Desengripante Proauto Lub Aerossol 300ml,"R$ 37,90",Bazar-E-Utilidades
Garrafa Térmica Termolar Personal 1l,"R$ 24,99",Bazar-E-Utilidades
Pipoqueira Panelux Rose Magnific 20cm,"R$ 51,90",Bazar-E-Utilidades
Caderno Foroni Espiral 4 Elementos 160 Folhas,"R$ 159,90",Bazar-E-Utilidades
Caderno Jandaia Espiral Flork 160 Folhas,"R$ 23,90",Bazar-E-Utilidades
Saboneteira Coza Bulky,"R$ 35,90",Bazar-E-Utilidades
Balão Junco Metalizado Prata 40cm N.1,"R$ 12,99",Bazar-E-Utilidades
