Título,Preço,Departamento
Atum Gomes Da Costa Pedaços 120g,"R$ 11,99",Conservas-E-Enlatados
Azeitona Verde Vale Fértil Sem Caroço Sachê 120g,"R$ 6,69",Conservas-E-Enlatados
Palmito Vitália Inteiro Açai 300g,"R$ 28,99",Conservas-E-Enlatados
Atum Coqueiro Pedaços Ao Natural 110g,"R$ 11,99",Conservas-E-Enlatados
Atum Gomes Da Costa Ralado 130g,"R$ 9,89",Conservas-E-Enlatados
Palmito Bonduelle Inteiro Pupunha 270g,"R$ 35,90",Conservas-E-Enlatados
Milho Verde Bonduelle Tradicional Lata 170g,"R$ 5,45",Conservas-E-Enlatados
Azeitona Verde Diza C/ Caroço Vidro 500g,"R$ 19,69",Conservas-E-Enlatados
Azeitona Verde Vale Fértil Sem Caroço Vidro 160g,"R$ 14,29",Conservas-E-Enlatados
Atum Robinson Crusoé Sólido Em Óleo 120g,"R$ 12,79",Conservas-E-Enlatados
Sardinha Coqueiro Em Molho De Tomate 83g,"R$ 6,29",Conservas-E-Enlatados
Azeitona Verde Nucete Fatiada Sachê 120g,"R$ 5,99",Conservas-E-Enlatados
Patê Gomes Da Costa Atum Sachê 170g,"R$ 10,29",Conservas-E-Enlatados
Sardinha Robinson Crusoé Em Óleo 84g,"R$ 5,79",Conservas-E-Enlatados
Atum Coqueiro Sólido Ao Natural 130g,"R$ 13,99",Conservas-E-Enlatados
Atum Gomes Da Costa Sólido Defumado 120g,"R$ 13,49",Conservas-E-Enlatados
Palmito Kamoká Rodela Pupunha 300g,"R$ 14,49",Conservas-E-Enlatados
Ervilha Predilecta Lata 170g,"R$ 3,79",Conservas-E-Enlatados
Palmito Kamoká Inteiro Pupunha 300g,"R$ 18,39",Conservas-E-Enlatados
Atum Coqueiro Sólido 120g,"R$ 13,99",Conservas-E-Enlatados
Palmito Castelo Inteiro Açaí 300g,"R$ 36,90",Conservas-E-Enlatados
Atum Robinson Crusoé Sólido Ao Natural 120g,"R$ 12,79",Conservas-E-Enlatados
Palmito Kamoká Picado Pupunha 300g,"R$ 14,99",Conservas-E-Enlatados
Seleta De Legumes Predilecta Lata 170g,"R$ 5,25",Conservas-E-Enlatados
Azeitona Verde Vale Fértil Gordal Premium Vidro 200g,"R$ 24,90",Conservas-E-Enlatados
Filé De Sardinha Gomes Da Costa Limão 85g,"R$ 14,29",Conservas-E-Enlatados
Azeitona Preta Vale Fértil Premium Azapa Vidro 200g,"R$ 26,90",Conservas-E-Enlatados
Champignon Diza Fatiado Sachê 100g,"R$ 10,69",Conservas-E-Enlatados
Grão De Bico Fugini Sachê 170g,"R$ 4,99",Conservas-E-Enlatados
Filé De Sardinha Gomes Da Costa 85g,"R$ 14,29",Conservas-E-Enlatados
Champignon Em Conserva Inteiro Vale Fértil Sachê Peso Líquido 160g,"R$ 9,19",Conservas-E-Enlatados
Azeitona Preta Vale Fértil Sem Caroço Sachê 120g,"R$ 8,79",Conservas-E-Enlatados
Palmito Equador Inteiro Açaí 300g,"R$ 23,90",Conservas-E-Enlatados
File De Atum Gomes Da Costa C/ Azeite Oliva 84gr,"R$ 17,89",Conservas-E-Enlatados
Atum Robinson Crusoe Pedaços Em Óleo 120g,"R$ 10,95",Conservas-E-Enlatados
Milho Verde Bonduelle Importado Lata 285g,"R$ 25,29",Conservas-E-Enlatados
Patê Gomes Da Costa Atum Com Azeitona Sachê 170g,"R$ 10,29",Conservas-E-Enlatados
Atum Gomes Da Costa Pedaços Natural 120g,"R$ 11,99",Conservas-E-Enlatados
Ervilha E Milho Quero Sachê 170g,"R$ 6,55",Conservas-E-Enlatados
Atum Gomes Da Costa Ralado Molho Tomate 140g,"R$ 9,89",Conservas-E-Enlatados
Feijoada Bordon Lata 830g,"R$ 27,19",Conservas-E-Enlatados
Ervilha Quero Lata 170g,"R$ 4,99",Conservas-E-Enlatados
Ervilha E Milho Quero Lata 170g,"R$ 6,85",Conservas-E-Enlatados
Milho Verde Stella D'Oro Sachê 170g,"R$ 3,99",Conservas-E-Enlatados
Filé De Sardinha Gomes Da Costa C/ Pimenta 85g,"R$ 14,29",Conservas-E-Enlatados
Seleta De Legumes Quero Lata 170g,"R$ 5,95",Conservas-E-Enlatados
Sardinha 88 Em Óleo 84g,"R$ 5,79",Conservas-E-Enlatados
Azeitona Verde Diza Sem Caroço Sachê - 80g,"R$ 6,59",Conservas-E-Enlatados
Palmito Kamoká Rodela Palmeira Real 300g,"R$ 14,49",Conservas-E-Enlatados
Sardinha Gomes Da Costa C/ Molho De Tomate 84g,"R$ 6,29",Conservas-E-Enlatados
Atum Coqueiro Ralado Ao Natural 120g,"R$ 10,49",Conservas-E-Enlatados
Ervilha Importada Bonduelle Lata 280g,"R$ 27,29",Conservas-E-Enlatados
Patê Sadia Presunto Bisnaga 100g,"R$ 4,89",Conservas-E-Enlatados
Milho Em Conserva Knorr 170g,"R$ 5,19",Conservas-E-Enlatados
Atum Robinson Crusoé Ralado Ao Natural 120g,"R$ 9,39",Conservas-E-Enlatados
Alcaparras Diza Vidro - 60g,"R$ 13,99",Conservas-E-Enlatados
Palmito Equador Picado Açaí 270g,"R$ 15,99",Conservas-E-Enlatados
Ervilha Fugini Sachê 170g,"R$ 3,99",Conservas-E-Enlatados
Atum Gomes Da Costa Ralado Sabor Defumado 130g,"R$ 9,89",Conservas-E-Enlatados
Atum Robinson Crusoé Pedaços Ao Natural 120g,"R$ 10,95",Conservas-E-Enlatados
Sardinha Gomes Da Costa C/ Limão 84g,"R$ 6,29",Conservas-E-Enlatados
Atum Robinson Crusoé Ralado 120g,"R$ 9,39",Conservas-E-Enlatados
Alcaparras Vale Fértil Vidro 60g,"R$ 13,99",Conservas-E-Enlatados
Champignon Castelo Inteiro Sachê 80g,"R$ 9,99",Conservas-E-Enlatados
Azeitona Preta Azapa Diza Sachê 150g,"R$ 15,99",Conservas-E-Enlatados
Atum Coqueiro Pedaços 110g,"R$ 11,99",Conservas-E-Enlatados
Atum Coqueiro Ralado 120g,"R$ 10,49",Conservas-E-Enlatados
Azeitona Verde Vale Fértil C/ Caroço Vidro 500g,"R$ 25,45",Conservas-E-Enlatados
Patê De Peito Peru Bisnaga Sadia 100g,"R$ 4,89",Conservas-E-Enlatados
Palmito Palmeiral Inteiro Pupunha 300g,"R$ 23,99",Conservas-E-Enlatados
Salsicha Bordon Viena 180g,"R$ 7,39",Conservas-E-Enlatados
Ervilha Stella D'Oro Lata 170g,"R$ 3,99",Conservas-E-Enlatados
Azeitona Verde Vale Fértil Fatiada Vidro 160g,"R$ 14,19",Conservas-E-Enlatados
Filé De Sardinha Gomes Da Costa C/ Molho Tomate 85g,"R$ 14,29",Conservas-E-Enlatados
Picles Salsaretti Vidro 180g,"R$ 13,89",Conservas-E-Enlatados
Palmito Castelo Picado Açai 300g,"R$ 19,99",Conservas-E-Enlatados
Pimenta Biquinho Salsaretti 180g,"R$ 19,90",Conservas-E-Enlatados
Azeitona Preta Diza Com Caroço Azapa Premium Vidro 500g,"R$ 38,90",Conservas-E-Enlatados
Grão De Bico Quero Lata 170g,"R$ 6,39",Conservas-E-Enlatados
Sardinha Gomes Da Costa C/ Molho De Tomate Picante 84g,"R$ 6,29",Conservas-E-Enlatados
Azeitona Verde Diza Sem Caroço Premium Vidro 500g,"R$ 35,90",Conservas-E-Enlatados
Sardinha Robinson Crusoé Em Molho De Tomate 84g,"R$ 5,79",Conservas-E-Enlatados
Conserva Knorr Ervilha 170g,"R$ 4,79",Conservas-E-Enlatados
Azeitona Preta Nucete Sem Caroço Sachê 100g,"R$ 6,99",Conservas-E-Enlatados
Milho Verde Fugini Crocante Ao Vapor Lata 170g,"R$ 4,99",Conservas-E-Enlatados
Dueto Knorr Lata 170g,"R$ 8,49",Conservas-E-Enlatados
Aspargos La Pastina Branco 205g,"R$ 33,90",Conservas-E-Enlatados
Milho Verde Predilecta Sachê 170g,"R$ 4,19",Conservas-E-Enlatados
Azeitona Verde Bonduelle Sem Caroço Vidro 320g,"R$ 16,99",Conservas-E-Enlatados
Patê Coqueiro Atum Toque De Pimenta Sache 170g,"R$ 10,45",Conservas-E-Enlatados
Azeitona Verde Diza Sem Caroço Sachê 150g,"R$ 10,90",Conservas-E-Enlatados
Ervilha Stella D'Oro Sachê 170g,"R$ 4,35",Conservas-E-Enlatados
Palmito Palmeiral Picado Pupunha 300g,"R$ 14,99",Conservas-E-Enlatados
Champignon Aica Premium Fatiado Vidro - 200g,"R$ 28,99",Conservas-E-Enlatados
Seleta De Legumes Knorr Lata 170g,"R$ 7,19",Conservas-E-Enlatados
Feijoada Bordon Lata 430g,"R$ 15,29",Conservas-E-Enlatados
Pimenta Malagueta Em Conserva Kenko 30g,"R$ 13,65",Conservas-E-Enlatados
Palmito Ribeiro Inteiro Pupunha 290g,"R$ 23,99",Conservas-E-Enlatados
Azeitona Verde Nucete Com Caroço Sachê 120g,"R$ 4,59",Conservas-E-Enlatados
Azeitona Preta Diza Fatiada Sachê 100g,"R$ 7,59",Conservas-E-Enlatados
Picles Ponzan Vidro 300g,"R$ 21,99",Conservas-E-Enlatados
Palmito Bonduelle Picado Pupunha - 270g,"R$ 21,90",Conservas-E-Enlatados
Ervilha Verde Broto Legal Partida - 500g,"R$ 9,99",Conservas-E-Enlatados
Seleta De Legumes Fugini Sachê 170,"R$ 6,49",Conservas-E-Enlatados
Azeitona Verde Diza Recheada Pimentão Vidro 195g,"R$ 18,99",Conservas-E-Enlatados
Azeitona Verde Nucete Recheado Com Pimenta Jalapeño Vidro 200g,"R$ 18,69",Conservas-E-Enlatados
Azeitona Verde Nucete Recheado Com Limão Vidro 200g,"R$ 18,69",Conservas-E-Enlatados
Azeitona Verde Vale Fértil Recheada Presunto 130g,"R$ 18,29",Conservas-E-Enlatados
Azeitona Preta Vale Fértil Fatiada Sachê 120g,"R$ 8,55",Conservas-E-Enlatados
Palmito Equador Inteiro Açai 180g,"R$ 16,65",Conservas-E-Enlatados
Milho Verde Stella D'Oro Lata 170g,"R$ 3,99",Conservas-E-Enlatados
Pepino Vale Fértil Sachê 300g,"R$ 15,39",Conservas-E-Enlatados
Azeitona Verde Diza Fatiada Sachê 100g,"R$ 7,55",Conservas-E-Enlatados
Patê Seara Peito De Peru Bisnaga 100g,"R$ 4,59",Conservas-E-Enlatados
Azeitona Verde Nucete Sem Caroço Sachê 100g,"R$ 5,99",Conservas-E-Enlatados
Azeitona Verde Diza C/ Caroco Sachê 100g,"R$ 4,65",Conservas-E-Enlatados
Atum Gomes Da Costa Ralado Picante 140g,"R$ 9,89",Conservas-E-Enlatados
Patê Seara Presunto Bisnaga 100g,"R$ 4,59",Conservas-E-Enlatados
Beterraba Fugini Sachê - 160g,"R$ 7,19",Conservas-E-Enlatados
Salsicha Bordon Aperitivo Lata 150g,"R$ 6,69",Conservas-E-Enlatados
Azeitona Verde Nucete Para Salada Sachê 120g,"R$ 5,99",Conservas-E-Enlatados
Sardinha 88 Em Molho De Tomate 84g,"R$ 5,79",Conservas-E-Enlatados
Batata Fugini Sachê 170g,"R$ 5,49",Conservas-E-Enlatados
Ervilha Quero Sachê 170g,"R$ 4,99",Conservas-E-Enlatados
Azeitona Verde Bonduelle C/ Caroço Vidro 320g,"R$ 15,55",Conservas-E-Enlatados
Almôndega Bordon Ao Molho Lata 420g,"R$ 13,29",Conservas-E-Enlatados
Carne De Panela Bordon Lata 400g,"R$ 15,99",Conservas-E-Enlatados
Palmito Flora Rodela Palmeira Real 300g,"R$ 18,95",Conservas-E-Enlatados
Palmito Pote D'Oro Rodela Pupunha 300g,"R$ 19,90",Conservas-E-Enlatados
Azeitona Verde Vale Fértil C/ Caroço Sachê 150g,"R$ 7,99",Conservas-E-Enlatados
Azeitona Verde Vale Fértil Sem Caroço Tempero Provençal Snack 50g,"R$ 4,69",Conservas-E-Enlatados
Palmito Palmeiral Inteiro Açaí 300g,"R$ 29,90",Conservas-E-Enlatados
Azeitona Preta Ting Fatiada Vidro 160g,"R$ 13,99",Conservas-E-Enlatados
Azeitona Verde C/ Caroço Vidro Ting 500g,"R$ 21,90",Conservas-E-Enlatados
Azeitona Verde Diza C/ Caroço Sachê 150g,"R$ 6,39",Conservas-E-Enlatados
Azeitona Preta Nucete Com Caroço Sachê 120g,"R$ 7,99",Conservas-E-Enlatados
Cebolinha Perline Em Conserva La Pastina Vidro 180g,"R$ 24,90",Conservas-E-Enlatados
Alcaparras Em Conserva La Pastina 60g,"R$ 19,35",Conservas-E-Enlatados
Atum Coqueiro Ralado Tomate 120g,"R$ 10,49",Conservas-E-Enlatados
Bruschetta Alcachofra La Pastina Vidro 280g,"R$ 34,90",Conservas-E-Enlatados
Fiambre Kitut Bovina 320g,"R$ 13,99",Conservas-E-Enlatados
Azeitona Verde Vale Fértil C/ Caroço Sachê 500g,"R$ 23,99",Conservas-E-Enlatados
Azeitona Ponzan Com Cebolinha Vidro 280g,"R$ 24,99",Conservas-E-Enlatados
Azeitona Verde Nucete Com Caroço Sachê 80g,"R$ 3,79",Conservas-E-Enlatados
Alcachofra La Pastina Fundo 190g,"R$ 28,99",Conservas-E-Enlatados
Milho Verde Quero - 170g,"R$ 6,99",Conservas-E-Enlatados
Bruschetta La Pastina Aspargo Verde 280g,"R$ 33,90",Conservas-E-Enlatados
Grão De Bico Bonduelle Lata 265g,"R$ 22,90",Conservas-E-Enlatados
Azeitona Preta Diza C/ Caroço Sachê 150g,"R$ 11,29",Conservas-E-Enlatados
Milho Verde Bonduelle Importado Lata - 140g,"R$ 16,45",Conservas-E-Enlatados
Carne Bovina Bordon Lata 320g,"R$ 13,89",Conservas-E-Enlatados
Palmito Ribeiro Rodela 290g,"R$ 17,99",Conservas-E-Enlatados
Azeitona Verde Nucete Sem Caroço Premium Vidro 450g,"R$ 34,99",Conservas-E-Enlatados
Tomate Seco Em Conserva La Pastina Vidro 150g,"R$ 38,90",Conservas-E-Enlatados
Azeitona Verde Diza Recheada Sachê 150g,"R$ 10,99",Conservas-E-Enlatados
Azeitona Verde Vale Fértil Sem Caroço Tempero Chilli Snack 50g,"R$ 4,69",Conservas-E-Enlatados
Pimentão La Pastina Ao Forno 225g,"R$ 29,90",Conservas-E-Enlatados
Bruschetta Pimentão E Jalapeño La Pastina Vidro 280g,"R$ 34,90",Conservas-E-Enlatados
Palmito Flora Corações Palmeira Real 300g,"R$ 21,90",Conservas-E-Enlatados
Cebolinha Salsaretti Conserva Vidro 190g,"R$ 26,90",Conservas-E-Enlatados
Azeitona Verde Nucete Com Caroço Premium Vidro 500g,"R$ 19,90",Conservas-E-Enlatados
Azeitona Verde Vale Fértil C/ Caroço Vidro 200g,"R$ 15,15",Conservas-E-Enlatados
Ervilha Predilecta Sachê 170g,"R$ 3,99",Conservas-E-Enlatados
Ervilha Bonduelle Lata 160g,"R$ 17,79",Conservas-E-Enlatados
Alcachofras La Pastina Coração Vidro 165g,"R$ 31,90",Conservas-E-Enlatados
"Azeitona Verde Vale Fértil C/ Caroço Bag 1,01kg","R$ 32,99",Conservas-E-Enlatados
Bruschetta Paganini Tomate 170g,"R$ 29,99",Conservas-E-Enlatados
Azeitona Preta Nucete Sem Caroço Premium Vidro 450g,"R$ 40,99",Conservas-E-Enlatados
Ervilha Crocante Fugini Ao Vapor Lata 170g,"R$ 4,99",Conservas-E-Enlatados
Aspargo Branco Em Conserva Vale Fértil Vidro Peso Líquido 330g,"R$ 35,90",Conservas-E-Enlatados
Azeitona Verde Diza Com Caroço Gordal Vidro Premium 500g,"R$ 34,90",Conservas-E-Enlatados
Alcaparrones Em Conserva La Pastina 180g,"R$ 39,90",Conservas-E-Enlatados
Palmito Ribeiro Picado Pupunha 270g,"R$ 15,99",Conservas-E-Enlatados
Ovos De Codorna Em Conserva Diza Vidro 300g,"R$ 29,90",Conservas-E-Enlatados
Azeitona Ponzan Com Pimenta Biquinho Vidro 280g,"R$ 24,90",Conservas-E-Enlatados
Farinha Karui Panko 200g,"R$ 17,39",Cozinha-Do-Mundo-1
Molho Tare Sakura 180ml,"R$ 9,19",Cozinha-Do-Mundo-1
Macarrão Harusame Karui - 200g,"R$ 23,90",Cozinha-Do-Mundo-1
Molho Para Yakissoba Karui 500ml,"R$ 15,99",Cozinha-Do-Mundo-1
Gergelim Karui Preto 100g,"R$ 14,99",Cozinha-Do-Mundo-1
Macarrão Para Yakissoba De 200g,"R$ 5,49",Cozinha-Do-Mundo-1
Tortilha Chips Frontera Queijo 125g,"R$ 12,99",Cozinha-Do-Mundo-1
Macarrão Para Yakissoba Da Roz 500g,"R$ 9,89",Cozinha-Do-Mundo-1
Macarrão Para Yakissoba Karui - 500g,"R$ 13,99",Cozinha-Do-Mundo-1
Gergelim Natural Life 200g,"R$ 13,49",Cozinha-Do-Mundo-1
Macarrão Oriental Sem Glúten Karui - 200g,"R$ 9,29",Cozinha-Do-Mundo-1
Pancake Nacho Loco Tradicional 100g,"R$ 7,49",Cozinha-Do-Mundo-1
Burrito Nacho Loco Ovo Com Bacon 160g,"R$ 12,29",Cozinha-Do-Mundo-1
Macarrão Oriental Sem Glúten Karui 500g,"R$ 20,59",Cozinha-Do-Mundo-1
Doce De Gergelim Halawi Istambul 500g,"R$ 49,90",Cozinha-Do-Mundo-1
Raiz Forte Wasabi Karui Bisnaga 43g,"R$ 19,99",Cozinha-Do-Mundo-1
Sardella Paganini Vidro - 180g,"R$ 28,90",Cozinha-Do-Mundo-1
Gengibre Em Conserva Kenko 110g,"R$ 26,39",Cozinha-Do-Mundo-1
Gengibre Em Conserva Karui Fatias Finas - 150g,"R$ 38,90",Cozinha-Do-Mundo-1
Burrito Nacho Loco Misto Quente 160g,"R$ 12,29",Cozinha-Do-Mundo-1
Macarrão Instantâneo Nissin Lámen Galinha Caipira C/6 Unid. 510g,"R$ 15,75",Massas
Macarrão Dona Benta Ovos Espaguete 8 500g,"R$ 3,69",Massas
Macarrão Dona Benta Ovos Parafuso 500g,"R$ 3,69",Massas
Macarrão Instantâneo Nissin Lamen Suave Tomate 85g,"R$ 3,15",Massas
Macarrão Instantâneo Nissin Lamen Carne 85g,"R$ 3,15",Massas
Macarrão Basilar Espaguete Pacote 400g,"R$ 3,39",Massas
Macarrão Dona Benta Ovos Penne 500g,"R$ 3,69",Massas
Massa Pastel Massa Leve Discão 500g,"R$ 7,99",Massas
Macarrão Basilar Verde Parafuso 400g,"R$ 3,39",Massas
Massa Pastel Massa Leve 1k,"R$ 12,49",Massas
Macarrão Instantâneo Nissin Lamen Galinha Caipira 85g,"R$ 3,15",Massas
Macarrão Dona Benta Sêmola Espaguete 500g,"R$ 3,39",Massas
Macarrão Camil Ovos Espaguete 8 500g,"R$ 4,89",Massas
Macarrão Basilar Verde Penne - 400g,"R$ 3,39",Massas
Macarrão Camil Ovos Parafuso 500g,"R$ 4,89",Massas
Macarrão Sêmola Espaguete 8 Galo 500g,"R$ 4,39",Massas
Macarrão Instantâneo Nissin Lamen Suave Galinha 85g,"R$ 3,15",Massas
Macarrão Instantâneo Nissin Lamen Galinha 88g,"R$ 3,15",Massas
Macarrão Spaghetti 5 Barilla 500g,"R$ 14,99",Massas
Macarrão Caseiro Talharini 3 De 500g,"R$ 10,85",Massas
Macarrão Instantâneo Renata Lámen Express Carne C/ Tomate 85g,"R$ 1,99",Massas
Macarrão Adria Ovos Espaguete 8 500g,"R$ 4,39",Massas
Macarrão Basilar Verde Ave Maria - 400g,"R$ 3,39",Massas
Macarrão Grano Duro Spaghetti Paganini 500g,"R$ 10,99",Massas
Macarrão Adria Ovos Parafuso 500g,"R$ 4,39",Massas
Macarrão Dona Benta Ovos Linguine 500g,"R$ 3,69",Massas
Lasanha Petybon Tradicional 200g,"R$ 3,89",Massas
Creme De Cebola Maggi 68g,"R$ 7,39",Massas
Massa Pastel Disco Landarini 500g,"R$ 10,99",Massas
Macarrão Ninho 2 Basilar 500g,"R$ 3,39",Massas
Macarrão Dona Benta Sêmola Parafuso 500g,"R$ 3,39",Massas
Macarrão Adria Ovos Gravata 500g,"R$ 4,39",Massas
Nhoque De Batata Mezzani 500g,"R$ 13,19",Massas
Canelone Ki Massas Presunto E Mussarela 500g,"R$ 21,90",Massas
Macarrão Basilar Fininho - 400g,"R$ 3,39",Massas
Macarrão Semolado Espaguete Galo 500g,"R$ 3,99",Massas
Massa Pizza Brotinho Massa Leve 300g,"R$ 7,99",Massas
Macarrão Ovos Espaguete Renata Pacote 500g,"R$ 4,45",Massas
Macarrão Instantâneo Nissin Cup Noodles Galinha Caipira 69g,"R$ 5,59",Massas
Macarrão Instantâneo Nissin Lámen Galinha Caipira Picante 85g,"R$ 3,15",Massas
Macarrão Grano Duro Conchiglione Da Roz 500g,"R$ 13,29",Massas
Macarrão Sêmola Parafuso Galo 500g,"R$ 4,39",Massas
Macarrão Penne Rigate 73 Barilla 500g,"R$ 15,99",Massas
Massa Pastel Landarini 1kg,"R$ 14,99",Massas
Talharim Massa Leve 500g,"R$ 8,99",Massas
Massa Lasanha Ki Massas 500g,"R$ 10,99",Massas
Rondelli Ki Massas Presunto E Queijo 500g,"R$ 21,90",Massas
Macarrão Urbano Arroz Espaguete Sem Gluten - 500g,"R$ 5,59",Massas
Macarrão Integral Espaguete 8 Galo 500g,"R$ 5,99",Massas
Macarrão Renata Parafuso Sem Glúten 500g,"R$ 6,49",Massas
Macarrão Spahettoni 7 Barilla 500g,"R$ 14,99",Massas
Macarrão Instantâneo Nissin Lamen Suave Carne 85g,"R$ 3,15",Massas
Lasanha Renata C/ Ovos 500g,"R$ 9,99",Massas
Macarrão Caseiro Talharini 2 De 500g,"R$ 10,85",Massas
Macarrão Spaghettini 3 Barilla 500g,"R$ 14,99",Massas
Macarrão Instantâneo Nissin Lamen Yakissoba U.F.O Carne 97g,"R$ 8,85",Massas
Macarrão Adria Ovos Fidelinho 10 500g,"R$ 4,39",Massas
Macarrão Instantâneo Renata Lámen Express Galinha Caipira 85g,"R$ 1,99",Massas
Macarrão Padre Nosso Basilar - 400g,"R$ 3,39",Massas
Creme De Cebola Kisabor 65g,"R$ 5,49",Massas
Macarrão Semolado Parafuso Galo 500g,"R$ 3,99",Massas
Massa Folhada Arosa Lâminada Congelada 300g,"R$ 19,99",Massas
Macarrão Grano Duro Superiore Tricolori Penne Renata 500g,"R$ 9,29",Massas
Capeletti Massa Leve Queijo 400g,"R$ 9,49",Massas
Creme De Cebola Equilibrium Maggi 61g,"R$ 7,39",Massas
Macarrão Grano Duro Paganini Fettuccine Nidi 500g,"R$ 16,29",Massas
Macarrão Basilar Gravata - 400g,"R$ 3,39",Massas
Talharim Mezzani 500g,"R$ 9,49",Massas
Macarrão Sadia Com Mini Almôndegas Pote 300g,"R$ 11,99",Massas
Macarrão Urbano Arroz Parafuso Sem Glúten 500g,"R$ 5,59",Massas
Macarrão Instantâneo Nissin Lamen Yakissoba 500g,"R$ 9,95",Massas
Macarrão Instantâneo Panco Lamen Galinha Caipira E Carne 340g - 4 Unidades,"R$ 8,45",Massas
Macarrão Instantâneo Nissin Lamen Cremoso Costela C/ Molho De Churrasco 88g,"R$ 3,15",Massas
Macarrão Instatâneo Lámen Picanha 85g,"R$ 3,15",Massas
Massa Lasanha Massa Leve 500g,"R$ 10,99",Massas
Macarrão Ovos Ninho 2 Renata Pacote 500g,"R$ 7,29",Massas
Macarrão Petybon Grano Duro Spaghetti 500g,"R$ 8,39",Massas
Macarrão Instantâneo Nissin Lamen Frango Assado C/ Limão 85g,"R$ 3,15",Massas
Nhoque De Batata Landarini 500g,"R$ 10,49",Massas
Macarrão Dona Benta Ovos Espaguetinho 9 500g,"R$ 3,69",Massas
Massa Pizza Grande La Pastita 400g,"R$ 14,99",Massas
Macarrão Instantâneo Nissin Cup Noodles Galinha Picante 68g,"R$ 5,59",Massas
Macarrão Ovos Parafuso Renata Pacote 500g,"R$ 4,45",Massas
Macarrão Ovos Tricolori Parafuso Renata Pacote 500g,"R$ 7,29",Massas
Macarrão Ovos Caracolino Renata Pacote 500g,"R$ 4,45",Massas
Macarrão Instantâneo Nissin Lamén Caldinho De Feijão 75g,"R$ 3,15",Massas
Macarrão Sadia Carbonara Pote 300g,"R$ 11,99",Massas
Macarrão Instantâneo Nissin Lamen Legumes 85g,"R$ 3,15",Massas
Macarrão Grano Duro Conchiglione Paganini 500g,"R$ 21,90",Massas
Macarrão Instantâneo Nissin Cup Noodles Yakissoba Tradicional 70g,"R$ 5,59",Massas
Capeletti Mezzani 4 Queijos 400g,"R$ 12,39",Massas
Macarrão Grano Duro Integral Espaguete Barilla 500g,"R$ 15,65",Massas
Macarrão Instantâneo Nissin Lámen Cremoso Frango 88g,"R$ 3,15",Massas
Nhoque De Batata Ki-Massas 500g,"R$ 11,99",Massas
Macarrão Instantâneo Nissin Lamen Yakissoba U.F.O. Curry Indiano 96g,"R$ 8,85",Massas
Macarrão Urbano Arroz Integral Parafuso Sem Glúten 500g,"R$ 7,39",Massas
Massa Pastel Dona Sofia 1kg,"R$ 14,99",Massas
Macarrão Instantâneo Adria Lámen Galinha Caipira 75g,"R$ 1,99",Massas
Macarrão Instantâneo Nissin Cup Noodles Legumes C/ Azeite 67g,"R$ 5,59",Massas
Macarrão Instantâneo Renata Lámen Cremoso Queijo 88g,"R$ 1,99",Massas
Macarrão Instantâneo Renata Lámen Express Carne 85g,"R$ 1,99",Massas
Macarrão Sêmola Ave Maria Galo 500g,"R$ 4,55",Massas
Macarrão Instantâneo Nissin Espaguete 5 Minutos 500g,"R$ 9,39",Massas
Macarrão Adria Ovos Sopa De Letrinhas 500g,"R$ 4,39",Massas
Massa Pastel Cumbuca Massa Leve 200g,"R$ 4,29",Massas
Macarrão Instantâneo Nissin Talharim Bolonhesa 99g,"R$ 4,39",Massas
Sorrentino Mezzani Ricota E Espinafre Gourmet 250g,"R$ 17,99",Massas
Massa Folhada Mezzani 300g,"R$ 10,99",Massas
Lasanha Barilla Grano Glúten Free 250g,"R$ 26,90",Massas
Massa Pizza Frigideira Mezzani 270g,"R$ 10,75",Massas
Massa Fina Arosa Fillo Congelada 300g,"R$ 17,59",Massas
Macarrão Instantâneo Nissin Lámen Hot Carne Desfiada Com Pimenta Caiena 85g,"R$ 3,15",Massas
Macarrão Grano Duro Bavette Linguine 13 Barilla 500g,"R$ 14,99",Massas
Massa Lasanha Mezzani 500g,"R$ 9,99",Massas
Creme De Cebola C/ Bacon Maggi 61g,"R$ 7,39",Massas
Lasanha Petybon Com Ovos 500g,"R$ 9,59",Massas
Lasanha Dona Benta C/ Ovos 500g,"R$ 7,99",Massas
Macarrão Instantâneo Nissin Lamen Yakissoba Legumes 95g,"R$ 8,85",Massas
Macarrão Instantâneo Nissin Lamen Costela 85g,"R$ 3,15",Massas
"Sopa Vono C/ Mandioquinha, Cebola E Salsa 17g","R$ 3,65",Massas
Macarrão Ovos Penne Petybon Pacote 500g,"R$ 4,99",Massas
Lasanha Barilla Grano 250g,"R$ 15,35",Massas
Macarrão Renata Espaguete Sem Glúten 500g,"R$ 6,49",Massas
Macarrão Urbano Arroz Integral Espaguete Sem Gluten - 500g,"R$ 7,39",Massas
Macarrão Sêmola Caralino Galo 500g,"R$ 4,55",Massas
Macarrão Sêmola Aletria Galo 500g,"R$ 6,99",Massas
Macarrão Urbano Arroz Integral Pena Sem Glúten 500g,"R$ 7,39",Massas
Macarrão Sêmola Furadinho 5 Galo 500g,"R$ 4,39",Massas
Macarrão Urbano Arroz Pena Sem Glúten - 500g,"R$ 5,59",Massas
Macarrão Instantâneo Nissin Lamen Bacon 85g,"R$ 3,15",Massas
Capeletti Massa Leve Carne 400g,"R$ 9,49",Massas
Macarrão Integral Parafuso 2 Galo 500g,"R$ 5,99",Massas
Macarrão Urbano Arroz Personagens Kids Sem Glúten - 500g,"R$ 6,59",Massas
Macarrão Instantâneo Nissin Cup Noodles Frango Teriyaki 72g,"R$ 5,59",Massas
Macarrão Grano Duro Capellini 1 Barilla 500g,"R$ 14,99",Massas
Massa Pastel Dona Sofia 500g,"R$ 8,09",Massas
Macarrão Basilar Furadinho - 400g,"R$ 3,39",Massas
Macarrão Grano Duro Superiore Tricolori Fusilli Renata 500g,"R$ 9,29",Massas
Macarrão Instantâneo Karui Oriental Arroz Galinha Caipira - 78g,"R$ 3,99",Massas
Macarrão De Cecco Grano Duro Conchiglioni Rigati 500g,"R$ 35,90",Massas
Macarrão Sêmola Pena Galo 500g,"R$ 4,55",Massas
Macarrão Sêmola Padre Nosso Galo 500g,"R$ 4,55",Massas
Macarrão Instantâneo Panco Lamen Quatro Queijos - 88g,"R$ 2,49",Massas
Macarrão Instantâneo Nissin Cup Noodles Bolonhesa 72g,"R$ 5,59",Massas
Macarrão Instantâneo Nissin Cup Noodles Costela 65g,"R$ 5,59",Massas
Massa Pizza Frigideira Massa Leve 250g,"R$ 8,99",Massas
Macarrão Ovos Linguine Renata Pacote 500g,"R$ 4,45",Massas
Macarrão Ovos Fidelinho 10 Renata Pacote 500g,"R$ 4,45",Massas
Macarrão Ovos Petybon Espaguetinho 9 Pacote 500g,"R$ 4,99",Massas
Macarrão Grano Duro Farfaloni Paganini 500g,"R$ 16,29",Massas
Macarrão Renata Pena Sem Glúten 500g,"R$ 6,49",Massas
Macarrão Ovos Petybon Linguine Pacote 500g,"R$ 4,99",Massas
"Macarrão Penne De Beterraba, Banana Verde E Pimenta Caiena Casarão 300g","R$ 15,99",Massas
"Macarrão Penne De Cenoura, Batata Doce, Curcuma E Chia Casarão 300g","R$ 15,99",Massas
Capeletti Mezzani Carne 400g,"R$ 12,39",Massas
Macarrão Grano Duro Superiore Capelli Renata 500g,"R$ 10,29",Massas
Macarrão Instantâneo Renata Lámen Express Galinha 85g,"R$ 1,99",Massas
Sopa Vono Abóbora C/ Carne 17g,"R$ 3,65",Massas
Ravioli Massa Leve Carne 400g,"R$ 9,49",Massas
Macarrão Caseiro Talharini 1 De 500g,"R$ 10,85",Massas
Macarrão Sêmola Fidelinho Galo 500g,"R$ 4,39",Massas
Macarrão Caseiro Ninho 2 De 500g,"R$ 10,85",Massas
Ravioli Massa Leve Carne 1kg,"R$ 27,99",Massas
Macarrão Instantâneo Panco Lamen Carne Com Tomate - 85g,"R$ 2,49",Massas
Macarrão Grano Duro Superiore Fusilli Renata 500g,"R$ 9,29",Massas
Macarrão Instantâneo Nissin Lamén Camarão C/ Alho 85g,"R$ 3,15",Massas
Macarrão Petybon Grano Duro Cavatappi 500g,"R$ 8,39",Massas
Macarrão Instantâneo Nissin Lamen Carne C/ Tomate 85g,"R$ 3,15",Massas
Macarrão Dona Benta Ovos Ave Maria 500g,"R$ 3,69",Massas
Ravioli Massa Leve 4 Queijos 1kg,"R$ 27,99",Massas
Macarrão Sêmola Espaguete Galo 500g,"R$ 4,39",Massas
Macarrão Grano Duro Tagliarini Paganini 500g,"R$ 23,90",Massas
Macarrão Instantâneo Renata Lámen Feijão C/ Bacon 85g,"R$ 1,99",Massas
Macarrão Divella Grano Duro Mezze Penne 500g,"R$ 11,79",Massas
Macarrão Instantâneo Renata Lámen Cremoso Picanha 88g,"R$ 1,99",Massas
Macarrão Sêmola Ninho 3 Galo 500g,"R$ 6,99",Massas
Macarrão Caseiro Pappardelle Gourmet Premium De 400g,"R$ 10,89",Massas
Massa Pastel Massa Leve Rolo 400g,"R$ 7,19",Massas
Macarrão Instantâneo Nissin Talharim Frango 99g,"R$ 4,39",Massas
Massa Para Lasanha Landarini 500g,"R$ 10,49",Massas
Ravioli Mezzani Carne 400g,"R$ 12,39",Massas
Sopa Vono Aipim C/ Costela 18g,"R$ 3,65",Massas
Macarrão Adria Grano Duro Spaghetti 500g,"R$ 10,29",Massas
Creme A Tal Da Castanha Cemeria Vegetal 200g,"R$ 9,99",Massas
Ravioli Massa Leve Frango 400g,"R$ 9,49",Massas
Macarrão Caseiro Talharini 0 De 500g,"R$ 10,85",Massas
Lasanha Petybon Integral Direto Ao Forno 200g,"R$ 3,89",Massas
Macarrão Spaghetti Barilla Sem Glúten 500g,"R$ 10,29",Massas
Macarrão Ovos Petybon Espaguete 8 Pacote 500g,"R$ 4,99",Massas
Macarrão Casarão Penne Premium Sem Glúten 500g,"R$ 17,69",Massas
Macarrão Sêmola Argola Galo 500g,"R$ 4,55",Massas
Macarrão Instantâneo Nissin Cup Noodles Carne Defumada 69g,"R$ 5,59",Massas
